id,name,data_version,day_ago_created ,price,list_price,original_price,discount,discount_rate,rating_average,review_count,favourite_count,all_time_quantity_sold,inventory_status,inventory_type,has_ebook ,url_path,authors,seller_name;spid;price,breadcrumbs,number_of_page
217123666,Sách: Giá Trong Chiến Lược Kinh Doanh (Tái Bản),3300,133,63200,80000,80000,16800,21,0.0,0,0,1.0,available,backorder,False,sach-gia-trong-chien-luoc-kinh-doanh-tai-ban-p217123666.html?spid=257675472,,BOOK SAI GON;257675472;63200 | Việt Thư Books;257675471;64000,Nhà Sách Tiki | Sách tiếng Việt | Sách kinh tế | Bài học kinh doanh | Sách: Giá Trong Chiến Lược Kinh Doanh (Tái Bản),
213669688,Câu Chuyện Tiếp Thị Trong Thời Đại Kỹ Thuật Số - Bản Quyền,3300,174,51600,64500,64500,12900,20,0.0,0,0,,available,backorder,False,cau-chuyen-tiep-thi-trong-thoi-dai-ky-thuat-so-ban-quyen-p213669688.html?spid=213669689,,Gooda Official;213669689;51600,Nhà Sách Tiki | Sách tiếng Việt | Sách kinh tế | Bài học kinh doanh | Câu Chuyện Tiếp Thị Trong Thời Đại Kỹ Thuật Số - Bản Quyền,
101365036,Combo Sách - Jeff Bezos Và Kỷ Nguyên Amazon + Những Cuộc Phiêu Lưu Trong Kinh Doanh,3300,753,210000,210000,210000,0,0,0.0,0,0,,available,backorder,False,combo-sach-jeff-bezos-va-ky-nguyen-amazon-nhung-cuoc-phieu-luu-trong-kinh-doanh-p101365036.html?spid=120305278,,info book;120305278;210000 | nha sach nguyet linh;101365037;215000 | Nhà Sách Vĩnh Thụy;120303656;211000,Nhà Sách Tiki | Sách tiếng Việt | Sách kinh tế | Bài học kinh doanh | Combo Sách - Jeff Bezos Và Kỷ Nguyên Amazon + Những Cuộc Phiêu Lưu Trong Kinh Doanh,
149253672,Combo 2 cuốn OKR + OKR căn bản,3300,553,253000,288000,288000,35000,12,0.0,0,0,,available,backorder,False,combo-2-cuon-okr-okr-can-ban-p149253672.html?spid=201943380,,Nhà Sách Vĩnh Thụy;201943380;253000 | 1980Books Official;149253673;187200 | Minhhabooks;150736590;215000 | Tiệm sách Minh Hằng;190194272;215000 | info book;208741841;288000,Nhà Sách Tiki | Sách tiếng Việt | Sách kinh tế | Bài học kinh doanh | Combo 2 cuốn OKR + OKR căn bản,
188658250,Sách Tại Sao Càng Bận Càng Nghèo Càng Nhàn Càng Giàu,3300,357,78000,78000,78000,0,0,5.0,1,0,3.0,available,backorder,False,sach-tai-sao-cang-ban-cang-ngheo-cang-nhan-cang-giau-p188658250.html?spid=188658251,Trương Tinh Vũ,Nhà Sách Thành An;188658251;78000,Nhà Sách Tiki | Sách tiếng Việt | Sách kinh tế | Bài học kinh doanh | Sách Tại Sao Càng Bận Càng Nghèo Càng Nhàn Càng Giàu,60
70722369,Combo Sách Để Tối Đa Hóa Hiệu Quả Kinh Doanh : Profit Zone - Vùng Lợi Nhuận + Dòng Tiền Gắn Liền Lợi Nhuận,3300,977,243600,348000,348000,104400,30,0.0,0,0,5.0,available,backorder,False,combo-sach-de-toi-da-hoa-hieu-qua-kinh-doanh-profit-zone-vung-loi-nhuan-dong-tien-gan-lien-loi-nhuan-p70722369.html?spid=88963726,nhieu tac gia,Omega Plus Books;88963726;243600 | Nhà Sách Lifebooks;70722370;348000 | AHABOOKS;72586695;302500 | Nhà Sách Vĩnh Thụy;73759678;306000 | Phương Đông Books;74911365;329500 | Sống Official;74978975;243600 | info book;76170209;306000 | ETS Books;88950328;243600 | Alpha Books Official;89920919;243600 | Bamboo Books;180607245;278400 | HỆ THỐNG NHÀ SÁCH ABC;193741715;306000 | FishingBook;260921350;295800,Nhà Sách Tiki | Sách tiếng Việt | Sách kinh tế | Bài học kinh doanh | Combo Sách Để Tối Đa Hóa Hiệu Quả Kinh Doanh : Profit Zone - Vùng Lợi Nhuận + Dòng Tiền Gắn Liền Lợi Nhuận,
201004707,Combo 2Q Sách Kĩ Năng/ Tận Dụng Truyền Thông Để Kinh Doanh Thành Công: Viết Truyền Cảm Nói Thông Suốt  + Content Bạc Tỷ,3300,246,245000,278000,278000,33000,12,0.0,0,0,,available,backorder,False,combo-2q-sach-ki-nang-tan-dung-truyen-thong-de-kinh-doanh-thanh-cong-viet-truyen-cam-noi-thong-suot-content-bac-ty-p201004707.html?spid=242425406,,HỆ THỐNG NHÀ SÁCH ABC;242425406;245000 | Phương Đông Books;201004708;241500 | MHbooks;252107678;220000,Nhà Sách Tiki | Sách tiếng Việt | Sách kinh tế | Bài học kinh doanh | Combo 2Q Sách Kĩ Năng/ Tận Dụng Truyền Thông Để Kinh Doanh Thành Công: Viết Truyền Cảm Nói Thông Suốt  + Content Bạc Tỷ,
154227529,Sách - Anh: Start With Why,3300,480,376200,376200,376200,0,0,0.0,0,0,6.0,available,backorder,False,sach-anh-start-with-why-p154227529.html?spid=154227530,,Blue Horizon Books;154227530;376200,Nhà Sách Tiki | Sách tiếng Việt | Sách kinh tế | Bài học kinh doanh | Sách - Anh: Start With Why,256
177996045,Bí Quyết Tay Trắng Thành Triệu Phú ( tái bản ),3300,410,153000,180000,180000,27000,15,0.0,0,0,,available,backorder,False,bi-quyet-tay-trang-thanh-trieu-phu-tai-ban-p177996045.html?spid=252333846,Adam Khoo,Bảo Châu Books;252333846;153000 | NHASACHTRITUE;177996046;130500,Nhà Sách Tiki | Sách tiếng Việt | Sách kinh tế | Bài học kinh doanh | Bí Quyết Tay Trắng Thành Triệu Phú ( tái bản ),436
183223203,Nhấn Nút Tái Tạo,3300,390,90400,90400,90400,0,0,0.0,0,0,1.0,available,backorder,False,nhan-nut-tai-tao-p183223203.html?spid=207710227,,Hiệu Sách Tự Do;207710227;90400 | Bamboo Books;196247993;101700 | Nhà Sách Trẻ Online;205048922;95450 | VBooks;208641711;96050 | FishingBook;253517843;101700,Nhà Sách Tiki | Sách tiếng Việt | Sách kinh tế | Bài học kinh doanh | Nhấn Nút Tái Tạo,
22080363,Đầu Tư Bất Động Sản (Tặng Kèm Bookmark Tiki),3300,1442,118300,169000,169000,50700,30,0.0,0,0,,available,backorder,False,dau-tu-bat-dong-san-tang-kem-bookmark-tiki-p22080363.html?spid=59552091,David Lindahl,Alpha Books Official;59552091;118300 | Times Books;55719572;117324 | VBooks;70831671;117624 | Nhà Sách Vĩnh Thụy;191907148;149000 | HỆ THỐNG NHÀ SÁCH ABC;192129433;149000,Nhà Sách Tiki | Sách tiếng Việt | Sách kinh tế | Bài học kinh doanh | Đầu Tư Bất Động Sản (Tặng Kèm Bookmark Tiki),382
222686843,(Business Book of the Year 2020) THƯƠNG VỤ F.A.CEBOOK THÂU TÓM I.N.STAGRAM - Sarah Frier - Phúc An dịch - First News – bìa mềm,3300,123,215000,215000,215000,0,0,5.0,1,0,2.0,available,backorder,False,business-book-of-the-year-2020-thuong-vu-f-acebook-thau-tom-i-nstagram-sarah-frier-phuc-an-dich-first-news-bia-mem-p222686843.html?spid=222686844,,BÌNH BÁN BOOK;222686844;215000,Nhà Sách Tiki | Sách tiếng Việt | Sách kinh tế | Bài học kinh doanh | (Business Book of the Year 2020) THƯƠNG VỤ F.A.CEBOOK THÂU TÓM I.N.STAGRAM - Sarah Frier - Phúc An dịch - First News – bìa mềm,
248985962,How Business Works - Hiểu Hết Về Kinh Doanh,3300,85,380000,380000,380000,0,0,0.0,0,0,,available,backorder,False,how-business-works-hieu-het-ve-kinh-doanh-p248985962.html?spid=248985963,nhieu tac gia,Nhà sách Anh Thành;248985963;380000,Nhà Sách Tiki | Sách tiếng Việt | Sách kinh tế | Bài học kinh doanh | How Business Works - Hiểu Hết Về Kinh Doanh,351
177056713,KOCHLAND - ĐẾ CHẾ KOCH,3300,420,439000,499000,499000,60000,12,0.0,0,0,,available,backorder,False,kochland-de-che-koch-p177056713.html?spid=192586672,Christopher Leonard,HỆ THỐNG NHÀ SÁCH ABC;192586672;439000 | info book;194808881;439000 | VBooks;248485794;347304 | SÁCH ĐẠI NAM;254021355;497000 | Nhà Sách Trẻ Online;261021697;346704 | Times Books;261021698;347004 | Tiệm Sách Hoa Hồng;261021699;347304,Nhà Sách Tiki | Sách tiếng Việt | Sách kinh tế | Bài học kinh doanh | KOCHLAND - ĐẾ CHẾ KOCH,908
198416968,Sách Sự Suy Tàn Của Quyền Lực,3300,270,101540,101540,101540,0,0,0.0,0,0,,available,backorder,False,sach-su-suy-tan-cua-quyen-luc-p198416968.html?spid=248783204,,Times Books;248783204;101540 | Bách Việt Bookstore;198416969;112000 | VBooks;230368315;106530,Nhà Sách Tiki | Sách tiếng Việt | Sách kinh tế | Bài học kinh doanh | Sách Sự Suy Tàn Của Quyền Lực,
252040694,Big Data Analyst - Vén Màn Hậu Trường Của Những Bước Chân 4.0,3300,67,106000,128000,128000,22000,17,0.0,0,0,,available,backorder,False,big-data-analyst-ven-man-hau-truong-cua-nhung-buoc-chan-4-0-p252040694.html?spid=252040695,,Nhân Văn;252040695;106000,Nhà Sách Tiki | Sách tiếng Việt | Sách kinh tế | Bài học kinh doanh | Big Data Analyst - Vén Màn Hậu Trường Của Những Bước Chân 4.0,
201843203,HÒN TUYẾT LĂN - CUỘC ĐỜI VÀ SỰ NGHIỆP CỦA WARREN BUFFETT - BÌA CỨNG,3300,243,742000,839000,839000,97000,12,0.0,0,0,,available,backorder,False,hon-tuyet-lan-cuoc-doi-va-su-nghiep-cua-warren-buffett-bia-cung-p201843203.html?spid=201843204,Alice Schroeder,Nhà Sách Thành An;201843204;742000,Nhà Sách Tiki | Sách tiếng Việt | Sách kinh tế | Bài học kinh doanh | HÒN TUYẾT LĂN - CUỘC ĐỜI VÀ SỰ NGHIỆP CỦA WARREN BUFFETT - BÌA CỨNG,
184248168,Nghệ thuật tư duy chiến lược trong kinh doanh - Chris Thomason,3300,385,97000,110000,110000,13000,12,0.0,0,0,,available,backorder,False,nghe-thuat-tu-duy-chien-luoc-trong-kinh-doanh-chris-thomason-p184248168.html?spid=205968132,Chris Thomason,Nhà Sách Vĩnh Thụy;205968132;97000 | 1980Books Official;184248169;71500 | info book;208170159;110000 | HỆ THỐNG NHÀ SÁCH ABC;254206825;97000,Nhà Sách Tiki | Sách tiếng Việt | Sách kinh tế | Bài học kinh doanh | Nghệ thuật tư duy chiến lược trong kinh doanh - Chris Thomason,276
247451183,"ĐẦU TƯ BẤT ĐỘNG SẢN KHÔN NGOAN – BẮT ĐẦU NHỎ, SINH LỜI LỚN – Joshua Dorkin, Brandon Turner - Bizbooks -NXB Hồng Đức",3300,98,199000,199000,199000,0,0,0.0,0,0,,available,backorder,False,dau-tu-bat-dong-san-khon-ngoan-bat-dau-nho-sinh-loi-lon-joshua-dorkin-brandon-turner-bizbooks-nxb-hong-duc-p247451183.html?spid=252184063,,Nhà sách PLV;252184063;199000 | BÌNH BÁN BOOK;247451184;199000,"Nhà Sách Tiki | Sách tiếng Việt | Sách kinh tế | Bài học kinh doanh | ĐẦU TƯ BẤT ĐỘNG SẢN KHÔN NGOAN – BẮT ĐẦU NHỎ, SINH LỜI LỚN – Joshua Dorkin, Brandon Turner - Bizbooks -NXB Hồng Đức",
249683555,"The Business Model Book: Xây Dựng, Thiết Kế Và Tối Ưu Mô Hình Kinh Doanh - Adam J Bock, Gerard George",3300,78,170000,200000,200000,30000,15,0.0,0,0,,available,backorder,False,the-business-model-book-xay-dung-thiet-ke-va-toi-uu-mo-hinh-kinh-doanh-adam-j-bock-gerard-george-p249683555.html?spid=261803307,"Dr Seuss,George Booth | Adam J. Bock",Bamboo Books;261803307;170000 | Nhà sách Anh Thành;249683556;200000 | Nhà Sách Vĩnh Thụy;252887463;200000 | Nhà Sách Trẻ Online;253252371;163400 | Tiệm Sách Hoa Hồng;253252372;164000,"Nhà Sách Tiki | Sách tiếng Việt | Sách kinh tế | Bài học kinh doanh | The Business Model Book: Xây Dựng, Thiết Kế Và Tối Ưu Mô Hình Kinh Doanh - Adam J Bock, Gerard George",264
476514,Hùng Biện Kiểu Ted,3300,2216,97300,139000,139000,41700,30,0.0,0,0,,available,backorder,False,hung-bien-kieu-ted-p476514.html?spid=98571856,Jeremey Donovan,Omega Plus Books;98571856;97300 | Times Books;55823040;83200 | Bamboo Books;192306998;111200 | HỆ THỐNG NHÀ SÁCH ABC;249651082;122000,Nhà Sách Tiki | Sách tiếng Việt | Sách kinh tế | Bài học kinh doanh | Hùng Biện Kiểu Ted,342
54749787,Combo Sách Mang Đến Sự Thành Công: Tôi Tài Giỏi - Bạn Cũng Thế (Tái Bản 2019 ) + Năng Đoạn Kim Cương (Tái Bản 2018) (Sách Kinh Tế),3300,1131,261350,261350,261350,0,0,5.0,3,0,18.0,available,instock,False,combo-sach-mang-den-su-thanh-cong-toi-tai-gioi-ban-cung-the-tai-ban-2019-nang-doan-kim-cuong-tai-ban-2018-sach-kinh-te-p54749787.html?spid=54749788,Nhiều Tác Giả,AHABOOKS;54749788;261350 | nha sach nguyet linh;244317729;269800,Nhà Sách Tiki | Sách tiếng Việt | Sách kinh tế | Bài học kinh doanh | Combo Sách Mang Đến Sự Thành Công: Tôi Tài Giỏi - Bạn Cũng Thế (Tái Bản 2019 ) + Năng Đoạn Kim Cương (Tái Bản 2018) (Sách Kinh Tế),
183539025,Giải Mã Chiến Lược Đông Tây,3300,389,165170,199000,199000,33830,17,5.0,1,0,7.0,available,backorder,False,giai-ma-chien-luoc-dong-tay-p183539025.html?spid=183539026,,Nhà sách Fahasa;183539026;165170,Nhà Sách Tiki | Sách tiếng Việt | Sách kinh tế | Bài học kinh doanh | Giải Mã Chiến Lược Đông Tây,
252282008,Kiếm tiền thời khủng hoảng ( tái bản 2023 -Trạm Đọc phân phối ),3300,63,184000,209000,209000,25000,12,0.0,0,0,,available,backorder,False,kiem-tien-thoi-khung-hoang-tai-ban-2023-tram-doc-phoi-p252282008.html?spid=253181523,,HỆ THỐNG NHÀ SÁCH ABC;253181523;184000 | Trạm đọc;252282009;166850,Nhà Sách Tiki | Sách tiếng Việt | Sách kinh tế | Bài học kinh doanh | Kiếm tiền thời khủng hoảng ( tái bản 2023 -Trạm Đọc phân phối ),
177286650,MÔ HÌNH KINH DOANH TỐI ƯU - CÔNG CỤ VÀ ÁP DỤNG: GIẢI PHÁP CHO DOANH NGHIỆP CẦN THAY ĐỔI SAU ĐẠI DỊCH COVID,3300,419,70000,79000,79000,9000,11,0.0,0,0,3.0,available,backorder,False,mo-hinh-kinh-doanh-toi-uu-cong-cu-va-ap-dung-giai-phap-cho-doanh-nghiep-can-thay-doi-sau-dai-dich-covid-p177286650.html?spid=178744315,TS. Đào Xuân Khương,Nhà Sách Vĩnh Thụy;178744315;70000 | Bamboo Books;195741955;75050 | info book;195826754;70000 | HỆ THỐNG NHÀ SÁCH ABC;196035323;70000,Nhà Sách Tiki | Sách tiếng Việt | Sách kinh tế | Bài học kinh doanh | MÔ HÌNH KINH DOANH TỐI ƯU - CÔNG CỤ VÀ ÁP DỤNG: GIẢI PHÁP CHO DOANH NGHIỆP CẦN THAY ĐỔI SAU ĐẠI DỊCH COVID,176
262694340,	7 Quy Tắc Tạo Lập Vị Trí Số Một Của Doanh Nghiệp Vừa Và Nhỏ - Chiến Lược Để Trở Thành Số 1 Theo Phương Thức Kinh Doanh Lanchester _PNU,3300,17,84150,99000,99000,14850,15,0.0,0,0,,available,backorder,False,7-quy-tac-tao-lap-vi-tri-so-mot-cua-doanh-nghiep-vua-va-nho-chien-luoc-de-tro-thanh-so-1-theo-phuong-thuc-kinh-doanh-lanchester-_pnu-p262694340.html?spid=263065848,Yoichi Takeda | Katsumi Kayano,Bamboo Books;263065848;84150 | NewShop Official;262694341;86130,Nhà Sách Tiki | Sách tiếng Việt | Sách kinh tế | Bài học kinh doanh | 	7 Quy Tắc Tạo Lập Vị Trí Số Một Của Doanh Nghiệp Vừa Và Nhỏ - Chiến Lược Để Trở Thành Số 1 Theo Phương Thức Kinh Doanh Lanchester _PNU,220
32423902,Triệu Phú Môi Giới Bất Động Sản(Tặng kèm Kho Audio Books),3300,1373,250500,250500,250500,0,0,1.0,1,0,29.0,available,backorder,False,trieu-phu-moi-gioi-bat-dong-san-tang-kem-kho-audio-books-p32423902.html?spid=33649941,Gary Keller,NhatPham0356;33649941;250500,Nhà Sách Tiki | Sách tiếng Việt | Sách kinh tế | Bài học kinh doanh | Triệu Phú Môi Giới Bất Động Sản(Tặng kèm Kho Audio Books),
867270,Điểm Thử Thách (Tái Bản),3300,2120,42000,42000,42000,0,0,0.0,0,0,11.0,available,backorder,False,diem-thu-thach-tai-ban-p867270.html?spid=213698580,Seth Godin,Hiệu Sách Tự Do;213698580;42000,Nhà Sách Tiki | Sách tiếng Việt | Sách kinh tế | Bài học kinh doanh | Điểm Thử Thách (Tái Bản),120
260922778,Giàu Từ Chứng Khoán - Bài Học Từ Những Nhà Kinh Doanh Thành Công Nhất Mọi Thời Đại,3300,28,96444,96444,96444,0,0,0.0,0,0,,available,backorder,False,giau-tu-chung-khoan-bai-hoc-tu-nhung-nha-kinh-doanh-thanh-cong-nhat-moi-thoi-dai-p260922778.html?spid=260922780,,Times Books;260922780;96444,Nhà Sách Tiki | Sách tiếng Việt | Sách kinh tế | Bài học kinh doanh | Giàu Từ Chứng Khoán - Bài Học Từ Những Nhà Kinh Doanh Thành Công Nhất Mọi Thời Đại,
254093556,Người Giàu Có Nhất Thành Babylon - Phiên bản mới (Hàn Băng Vũ dịch),3300,39,73500,98000,98000,24500,25,0.0,0,0,,available,backorder,False,nguoi-giau-co-nhat-thanh-babylon-phien-ban-moi-han-bang-vu-dich-p254093556.html?spid=254093557,,VIETNAMBOOK;254093557;73500,Nhà Sách Tiki | Sách tiếng Việt | Sách kinh tế | Bài học kinh doanh | Người Giàu Có Nhất Thành Babylon - Phiên bản mới (Hàn Băng Vũ dịch),208
109869908,Combo 2 cuốn sách cực hay về kinh tế : Sức Mạnh Tiềm Thức 2021 + Sức Mạnh Của Hiện Tại  (Tặng Kèm Bookmark Happy Life),3300,718,264000,264000,264000,0,0,0.0,0,0,,available,backorder,False,combo-2-cuon-sach-cuc-hay-ve-kinh-te-suc-manh-tiem-thuc-2021-suc-manh-cua-hien-tai-tang-kem-bookmark-happy-life-p109869908.html?spid=116726646,,Nhà Sách Vĩnh Thụy;116726646;264000 | Phương Đông Books;109869909;251500,Nhà Sách Tiki | Sách tiếng Việt | Sách kinh tế | Bài học kinh doanh | Combo 2 cuốn sách cực hay về kinh tế : Sức Mạnh Tiềm Thức 2021 + Sức Mạnh Của Hiện Tại  (Tặng Kèm Bookmark Happy Life),
261967277,1000 Câu Chuyện Hay Thế Giới - Mưu Lược Trong Chính Trị Quân Sự Và Đời Sống,3300,26,120000,128000,128000,8000,6,0.0,0,0,,available,backorder,False,1000-cau-chuyen-hay-the-gioi-muu-luoc-trong-chinh-tri-quan-su-va-doi-song-p261967277.html?spid=261967278,,Nhân Văn;261967278;120000,Nhà Sách Tiki | Sách tiếng Việt | Sách kinh tế | Bài học kinh doanh | 1000 Câu Chuyện Hay Thế Giới - Mưu Lược Trong Chính Trị Quân Sự Và Đời Sống,
192950777,Warren Buffett - 22 Thương Vụ Đầu Tiên Và Bài Học Đắt Giá Từ Những Sai Lầm,3300,325,147030,169000,169000,21970,13,0.0,0,0,1.0,available,backorder,False,warren-buffett-22-thuong-vu-dau-tien-va-bai-hoc-dat-gia-tu-nhung-sai-lam-p192950777.html?spid=192950778,Glen Arnold,Nhà sách Fahasa;192950778;147030 | Nhà Sách Vĩnh Thụy;195772955;149000,Nhà Sách Tiki | Sách tiếng Việt | Sách kinh tế | Bài học kinh doanh | Warren Buffett - 22 Thương Vụ Đầu Tiên Và Bài Học Đắt Giá Từ Những Sai Lầm,
148071875,Bí quyết đầu tư bất động sản khôn ngoan,3300,556,122850,189000,189000,66150,35,4.0,1,0,10.0,available,backorder,False,bi-quyet-dau-tu-bat-dong-san-khon-ngoan-p148071875.html?spid=148071876,,1980 BOOKS HCM;148071876;122850 | MHbooks;160996429;161000 | Bamboo Books;215217855;160650,Nhà Sách Tiki | Sách tiếng Việt | Sách kinh tế | Bài học kinh doanh | Bí quyết đầu tư bất động sản khôn ngoan,
177086427,Cạnh Tranh Trong Thời Đại AI (Competing In The Age Of AI),3300,420,166500,185000,185000,18500,10,0.0,0,0,,available,backorder,False,canh-tranh-trong-thoi-dai-ai-competing-in-the-age-of-ai-p177086427.html?spid=247856094,,Bamboo Books;247856094;166500 | Nhà sách Anh Thành;177086428;184300,Nhà Sách Tiki | Sách tiếng Việt | Sách kinh tế | Bài học kinh doanh | Cạnh Tranh Trong Thời Đại AI (Competing In The Age Of AI),340
253461497,Tư Duy Nhanh Và Chậm,3300,41,228650,269000,269000,40350,15,0.0,0,0,,available,backorder,False,tu-duy-nhanh-va-cham-p253461497.html?spid=263318131,,FishingBook;263318131;228650 | Nhà Sách Trẻ Online;253461498;186000,Nhà Sách Tiki | Sách tiếng Việt | Sách kinh tế | Bài học kinh doanh | Tư Duy Nhanh Và Chậm,
177915452,48 Nguyên Tắc Chủ Chốt Của Quyền Lực,3300,414,197000,197000,197000,0,0,0.0,0,0,1.0,available,backorder,False,48-nguyen-tac-chu-chot-cua-quyen-luc-p177915452.html?spid=248544855,Robert Greene,Hiệu Sách Tự Do;248544855;197000,Nhà Sách Tiki | Sách tiếng Việt | Sách kinh tế | Bài học kinh doanh | 48 Nguyên Tắc Chủ Chốt Của Quyền Lực,504
77878619,Combo 2 cuốn sách: Trước khi tôi là CEO + Vỡ lòng về kinh doanh,3300,847,224400,224400,0,39600,0,0.0,0,0,,out_of_stock,backorder,False,combo-2-cuon-sach-truoc-khi-toi-la-ceo-vo-long-ve-kinh-doanh-p77878619.html,,,Nhà Sách Tiki | Sách tiếng Việt | Sách kinh tế | Bài học kinh doanh | Combo 2 cuốn sách: Trước khi tôi là CEO + Vỡ lòng về kinh doanh,
24745278,Combo HBR On: Harvard Business Review - On Innovation - Đổi Mới Sáng Tạo + Harvard Business Review - ON COMMUNICATION - Truyền Thông Giao Tiếp,3300,1419,385000,438000,438000,53000,12,0.0,0,0,,available,backorder,False,combo-hbr-on-harvard-business-review-on-innovation-doi-moi-sang-tao-harvard-business-review-on-communication-truyen-thong-giao-tiep-p24745278.html?spid=249019500,,HỆ THỐNG NHÀ SÁCH ABC;249019500;385000 | Nhà Sách Lifebooks;38454845;398000 | info book;118777174;416000,Nhà Sách Tiki | Sách tiếng Việt | Sách kinh tế | Bài học kinh doanh | Combo HBR On: Harvard Business Review - On Innovation - Đổi Mới Sáng Tạo + Harvard Business Review - ON COMMUNICATION - Truyền Thông Giao Tiếp,
190864063, Dạy Con Làm Giàu (Tập 1) - Để Không Có Tiền Vẫn Tạo Ra Tiền + Dạy Con Làm Giàu (Tập 2) - Sử Dụng Đồng Vốn (combo 2 quyển),3300,341,179000,179000,179000,0,0,4.0,1,0,1.0,available,backorder,False,day-con-lam-giau-tap-1-de-khong-co-tien-van-tao-ra-tien-day-con-lam-giau-tap-2-su-dung-dong-von-combo-2-quyen-p190864063.html?spid=190864064,Robert T Kiyosaki,AN HOA BOOK;190864064;179000 | HỆ THỐNG NHÀ SÁCH ABC;194013360;198000 | Nhà Sách Dalifa;220628533;202500,Nhà Sách Tiki | Sách tiếng Việt | Sách kinh tế | Bài học kinh doanh |  Dạy Con Làm Giàu (Tập 1) - Để Không Có Tiền Vẫn Tạo Ra Tiền + Dạy Con Làm Giàu (Tập 2) - Sử Dụng Đồng Vốn (combo 2 quyển),
625970,Suy Nghĩ Ngược,3300,2246,38000,38000,38000,0,0,0.0,0,0,1.0,available,backorder,False,suy-nghi-nguoc-p625970.html?spid=186339535,Shiratori Haruhiko,Tazano Official Store;186339535;38000 | Minhhabooks;140100780;42000 | Nhà Sách Trí Đức;186739574;42000 | Tiệm sách Minh Hằng;189945904;39000,Nhà Sách Tiki | Sách tiếng Việt | Sách kinh tế | Bài học kinh doanh | Suy Nghĩ Ngược,178
476885,Giải Pháp GRASP,3300,0,275600,358000,358000,82400,23,4.7,3,0,10.0,available,backorder,False,giai-phap-grasp-p476885.html?spid=20450284,Chris Griffiths - Melina Costi,Nhà sách Fahasa;20450284;275600 | Nhà sách Minh Tâm;17634745;286400,Nhà Sách Tiki | Sách tiếng Việt | Sách kinh tế | Bài học kinh doanh | Giải Pháp GRASP,358
262640393,Word Ứng Dụng Văn Phòng - Từ Cơ Bản Đến Nâng Cao,3300,18,178200,198000,198000,19800,10,0.0,0,0,,available,backorder,False,word-ung-dung-van-phong-tu-co-ban-den-nang-cao-p262640393.html?spid=262640394,,Nhân Văn;262640394;178200,Nhà Sách Tiki | Sách tiếng Việt | Sách kinh tế | Bài học kinh doanh | Word Ứng Dụng Văn Phòng - Từ Cơ Bản Đến Nâng Cao,
72621963,Big Data Không Xa - Dữ Liệu Lớn Chi Phối Con Người Trong Thời đại 4.0,3300,953,78000,119000,119000,41000,34,0.0,0,0,,available,backorder,False,big-data-khong-xa-du-lieu-lon-chi-phoi-con-nguoi-trong-thoi-dai-4-0-p72621963.html?spid=147337126,,Nhân Văn;147337126;78000 | Sống Official;72621964;83300 | Alpha Books Official;73313817;83000 | Omega Plus Books;74640593;83300 | ETS Books;74923410;83300 | info book;117832717;105000 | Trạm đọc;125745362;82824 | VBooks;162528659;82824 | Bamboo Books;180583080;95200 | HỆ THỐNG NHÀ SÁCH ABC;192378560;105000 | Nhà Sách Vĩnh Thụy;215135798;119000,Nhà Sách Tiki | Sách tiếng Việt | Sách kinh tế | Bài học kinh doanh | Big Data Không Xa - Dữ Liệu Lớn Chi Phối Con Người Trong Thời đại 4.0,200
109867728,Sức mạnh tiềm thức 2021( Tặng Kèm Bookmark Happy Life),3300,716,124000,124000,124000,0,0,0.0,0,0,2.0,available,backorder,False,suc-manh-tiem-thuc-2021-tang-kem-bookmark-happy-life-p109867728.html?spid=114306711,,Nhà Sách Vĩnh Thụy;114306711;124000 | Phương Đông Books;109867729;116500,Nhà Sách Tiki | Sách tiếng Việt | Sách kinh tế | Bài học kinh doanh | Sức mạnh tiềm thức 2021( Tặng Kèm Bookmark Happy Life),
262053140,Bí Mật Của Thung Lũng Silicon,3300,24,132000,165000,165000,33000,20,0.0,0,0,,available,backorder,False,bi-mat-cua-thung-lung-silicon-p262053140.html?spid=262053142,Deborah Perry Piscione,NXB TỔNG HỢP;262053142;132000,Nhà Sách Tiki | Sách tiếng Việt | Sách kinh tế | Bài học kinh doanh | Bí Mật Của Thung Lũng Silicon,
262587442,THƯƠNG HIỆU VIỆT NAM - THỜI KHẮC VÀNG (BRAND VIETNAM THE MOMENT) - Trần Tuệ Tri - (bìa mềm),3300,18,211650,249000,249000,37350,15,0.0,0,0,,available,backorder,False,thuong-hieu-viet-nam-thoi-khac-vang-brand-vietnam-the-moment-tran-tue-tri-bia-mem-p262587442.html?spid=262653760,Trần Tuệ Tri,Bamboo Books;262653760;211650 | Nhà Sách Khai Minh;262587443;224000,Nhà Sách Tiki | Sách tiếng Việt | Sách kinh tế | Bài học kinh doanh | THƯƠNG HIỆU VIỆT NAM - THỜI KHẮC VÀNG (BRAND VIETNAM THE MOMENT) - Trần Tuệ Tri - (bìa mềm),368
261035709,Sách - INFLUENCER: Phương pháp 5 bước để trở thành người có tầm ảnh hưởng nhất trong lĩnh vực của bạn,3300,28,83850,129000,129000,45150,35,0.0,0,0,,available,backorder,False,sach-influencer-phuong-phap-5-buoc-de-tro-thanh-nguoi-co-tam-anh-huong-nhat-trong-linh-vuc-cua-ban-p261035709.html?spid=261035710,Kevin Harrington,MCBooks Sài Gòn;261035710;83850,Nhà Sách Tiki | Sách tiếng Việt | Sách kinh tế | Bài học kinh doanh | Sách - INFLUENCER: Phương pháp 5 bước để trở thành người có tầm ảnh hưởng nhất trong lĩnh vực của bạn,300
