id,name,data_version,day_ago_created ,price,list_price,original_price,discount,discount_rate,rating_average,review_count,favourite_count,all_time_quantity_sold,inventory_status,inventory_type,has_ebook ,url_path,authors,seller_name;spid;price,breadcrumbs,number_of_page
59411896,"Vui Lòng Khách Đến, Vừa Lòng Khách Đi",3300,1039,111000,159000,159000,48000,30,5.0,41,0,276.0,available,instock,False,vui-long-khach-den-vua-long-khach-di-p59411896.html?spid=60218646,Bùi Xuân Phong,Tiki Trading;60218646;111000 | BOOKS AND LIFE;73721898;119250 | Zenbooks Official ;81800451;127200 | AHABOOKS;92996749;126500 | Cá Chép Bookstore;138662167;143100 | Saigon Books Official;185782845;111300 | Nhà sách NetaBooks;191005164;135000 | Nhà Sách Trẻ Online;262907321;159000 | Tiệm Sách Hoa Hồng;262907324;159000 | Times Books;262973255;159000,"Nhà Sách Tiki | Sách tiếng Việt | Sách kinh tế | Bài học kinh doanh | Vui Lòng Khách Đến, Vừa Lòng Khách Đi",376
114944931,Sách: Giá Trong Chiến Lược Kinh Doanh - Đắt mà bán chạy - rẻ mà có lãi - B75 - TSKD,3300,689,70000,80000,80000,10000,13,0.0,0,0,,available,backorder,False,sach-gia-trong-chien-luoc-kinh-doanh-dat-ma-ban-chay-re-ma-co-lai-b75-tskd-p114944931.html?spid=217640961,,Nhà Sách Vĩnh Thụy;217640961;70000 | Trao Tri thức Gặt Niềm tin;114944933;54878,Nhà Sách Tiki | Sách tiếng Việt | Sách kinh tế | Bài học kinh doanh | Sách: Giá Trong Chiến Lược Kinh Doanh - Đắt mà bán chạy - rẻ mà có lãi - B75 - TSKD,
217577368,Suối Nguồn Bìa cứng - Ayn Rand,3300,130,373500,450000,450000,76500,17,0.0,0,0,2.0,available,backorder,False,suoi-nguon-bia-cung-ayn-rand-p217577368.html?spid=217577369,Ayn Rand,Changsbook;217577369;373500,Nhà Sách Tiki | Sách tiếng Việt | Sách kinh tế | Bài học kinh doanh | Suối Nguồn Bìa cứng - Ayn Rand,1204
198746822,Biến Mọi Thứ Thành Tiền_SB,3300,265,134000,168000,168000,34000,20,0.0,0,0,8.0,available,backorder,False,bien-moi-thu-thanh-tien_sb-p198746822.html?spid=198746823,,NewShop Official;198746823;134000,Nhà Sách Tiki | Sách tiếng Việt | Sách kinh tế | Bài học kinh doanh | Biến Mọi Thứ Thành Tiền_SB,
75700739,Barbarians At The Gate - Bọn Rợ Rình Trước Cổng,3300,889,319200,399000,399000,79800,20,5.0,2,0,15.0,available,backorder,False,barbarians-at-the-gate-bon-ro-rinh-truoc-cong-p75700739.html?spid=76677321,Bryan Burrough | John Helyar,Nhà sách Fahasa;76677321;319200 | Sống Official;76145146;279300 | Times Books;77643203;239200 | Nhà Sách Lifebooks;77605786;399000 | ETS Books;88949613;279300 | Omega Plus Books;88962347;279300 | Alpha Books Official;89920280;279000 | Trạm đọc;126676646;265000 | VBooks;160586415;239400 | Bamboo Books;178788096;319200 | Tiệm Sách Hoa Hồng;188308136;239400 | HỆ THỐNG NHÀ SÁCH ABC;194075294;351000 | Nhà Sách Vĩnh Thụy;214754834;351000 | Nhà Sách Trẻ Online;254075952;238900,Nhà Sách Tiki | Sách tiếng Việt | Sách kinh tế | Bài học kinh doanh | Barbarians At The Gate - Bọn Rợ Rình Trước Cổng,816
14083858,"Sách PACE Books - 9 bước triển khai Balanced Scorecard (The Institute Way) - Howard Rohm, David Wilsey, Gail Stout Perry, Dan Montgomery",3300,1525,147000,195000,195000,48000,25,4.7,26,0,305.0,available,instock,False,sach-pace-books-9-buoc-trien-khai-balanced-scorecard-the-institute-way-howard-rohm-david-wilsey-gail-stout-perry-dan-montgomery-p14083858.html?spid=50930561,.,Balanced Scorecard Vietnam;50930561;147000 | VIETNAMBOOK;74891175;154000 | Bảo Châu Books;221353925;155000 | Bamboo Books;257914974;175500 | NHBook;263326638;156000,"Nhà Sách Tiki | Sách tiếng Việt | Sách kinh tế | Bài học kinh doanh | Sách PACE Books - 9 bước triển khai Balanced Scorecard (The Institute Way) - Howard Rohm, David Wilsey, Gail Stout Perry, Dan Montgomery",352
72965333,Bộ Sách Kết Nối Và Làm Chủ Đồng Tiền (Gồm 2 Cuốn),3300,944,498000,498000,498000,0,0,4.8,50,0,211.0,available,backorder,False,bo-sach-ket-noi-va-lam-chu-dong-tien-gom-2-cuon-p72965333.html?spid=72965334,Lynne Twist | Judy Robinett,HappyLive;72965334;498000,Nhà Sách Tiki | Sách tiếng Việt | Sách kinh tế | Bài học kinh doanh | Bộ Sách Kết Nối Và Làm Chủ Đồng Tiền (Gồm 2 Cuốn),736
163461821,Kinh doanh bằng trực giác - Sách hay mỗi ngày ,3300,485,97000,150000,150000,53000,35,0.0,0,0,2.0,available,backorder,False,kinh-doanh-bang-truc-giac-sach-hay-moi-ngay-p163461821.html?spid=183313048,,MCBooks Sài Gòn;183313048;97000 | MCBooks Hạnh Phúc;163462066;97500 | Sách Doanh Nhân;176666617;85000 | Sách TKBooks ;177911521;97500 | info book;196577540;132000 | Nhà Sách Vĩnh Thụy;202509669;132000 | HỆ THỐNG NHÀ SÁCH ABC;203016534;132000,Nhà Sách Tiki | Sách tiếng Việt | Sách kinh tế | Bài học kinh doanh | Kinh doanh bằng trực giác - Sách hay mỗi ngày ,
916571,Mô Hình Kinh Doanh Sáng Tạo,3300,2024,82800,119000,119000,36200,30,4.0,19,0,750.0,available,instock,False,mo-hinh-kinh-doanh-sang-tao-p916571.html?spid=918249,Negoro Tatsuyuki,Tiki Trading;918249;82800 | 1980 BOOKS HCM;55707465;77350 | MHbooks;92555305;129000 | Nhà Sách Vĩnh Thụy;202000222;105000 | info book;208187092;105000 | Nhà sách PLV;212962051;119000 | Trao Tri thức Gặt Niềm tin;212924909;105400,Nhà Sách Tiki | Sách tiếng Việt | Sách kinh tế | Bài học kinh doanh | Mô Hình Kinh Doanh Sáng Tạo,358
172334155,Combo 2 cuốn: Warren Buffett: 22 Thương Vụ Đầu Tiên Và Bài Học Đắt Giá Từ Những Sai Lầm + 7 Phương Pháp Đầu Tư Warren Buffet ( Bộ sách đầu tư/kinh doanh thành công),3300,449,225500,225500,225500,0,0,0.0,0,0,6.0,available,instock,False,combo-2-cuon-warren-buffett-22-thuong-vu-dau-tien-va-bai-hoc-dat-gia-tu-nhung-sai-lam-7-phuong-phap-dau-tu-warren-buffet-bo-sach-dau-tu-kinh-doanh-thanh-cong-p172334155.html?spid=172334156,,AHABOOKS;172334156;225500,Nhà Sách Tiki | Sách tiếng Việt | Sách kinh tế | Bài học kinh doanh | Combo 2 cuốn: Warren Buffett: 22 Thương Vụ Đầu Tiên Và Bài Học Đắt Giá Từ Những Sai Lầm + 7 Phương Pháp Đầu Tư Warren Buffet ( Bộ sách đầu tư/kinh doanh thành công),
107401971,SÁCH - THE POWER - SỨC MẠNH,3300,726,262000,298000,298000,36000,12,0.0,0,0,,available,backorder,False,sach-the-power-suc-manh-p107401971.html?spid=202484129,Rhonda Byrne,info book;202484129;262000 | Nhà Sách Thành An;107401972;298000 | HỆ THỐNG NHÀ SÁCH ABC;202560988;262000 | Nhà Sách Vĩnh Thụy;202597330;262000 | Times Books;206090408;238000 | Nhà Sách Trẻ Online;207011422;237500 | Nhà Sách Đinh Lễ;217388317;283100,Nhà Sách Tiki | Sách tiếng Việt | Sách kinh tế | Bài học kinh doanh | SÁCH - THE POWER - SỨC MẠNH,254
101296961,7 Bài Học Kinh Doanh Cơ Bản Dành Cho Nhà Quản Lý Thương Hiệu,3300,755,127200,159000,159000,31800,20,0.0,0,0,,available,backorder,False,7-bai-hoc-kinh-doanh-co-ban-danh-cho-nha-quan-ly-thuong-hieu-p101296961.html?spid=110204727,Kevin Harrington | Mark Timm,Nhà sách Fahasa;110204727;127200 | Tiki Trading;101296962;110700 | MHbooks;114207258;137000 | AHABOOKS;117091665;159000 | Nhà Sách Vĩnh Thụy;206268297;140000 | info book;208734369;140000 | Trao Tri thức Gặt Niềm tin;212938579;140828,Nhà Sách Tiki | Sách tiếng Việt | Sách kinh tế | Bài học kinh doanh | 7 Bài Học Kinh Doanh Cơ Bản Dành Cho Nhà Quản Lý Thương Hiệu,340
392850,Thiên Cơ Trung Quốc,3300,2090,152424,152424,152424,0,0,0.0,0,0,4.0,available,backorder,False,thien-co-trung-quoc-p392850.html?spid=161265384,Vương Mông,VBooks;161265384;152424,Nhà Sách Tiki | Sách tiếng Việt | Sách kinh tế | Bài học kinh doanh | Thiên Cơ Trung Quốc,603
69644754,Where To Play: 3 Bước Để Xác Định Thị Trường Đắt Giá Của Doanh Nghiệp,3300,984,144000,180000,180000,36000,20,4.0,2,0,14.0,available,backorder,False,where-to-play-3-buoc-de-xac-dinh-thi-truong-dat-gia-cua-doanh-nghiep-p69644754.html?spid=71682982,Marc Gruber | Sharon Tal,Nhà sách Fahasa;71682982;144000 | Tiki Trading;69644755;113800 | BOOKS AND LIFE;72742896;135000 | info book;76470023;158000 | Nhà Sách Vĩnh Thụy;76470027;173000 | Nhà sách NetaBooks;152158460;153000 | HỆ THỐNG NHÀ SÁCH ABC;194963540;158000 | Times Books;215484883;147300 | Nhà Sách Trẻ Online;253252426;147000 | Tiệm Sách Hoa Hồng;253252427;147600,Nhà Sách Tiki | Sách tiếng Việt | Sách kinh tế | Bài học kinh doanh | Where To Play: 3 Bước Để Xác Định Thị Trường Đắt Giá Của Doanh Nghiệp,232
205294139,Sách - Dốc Hết Trái Tim - Cách Starbuck Xây Dựng Công Ty Bằng Từng Tách Cà Phê - NXB Trẻ - Bìa Mềm,3300,220,135000,150000,150000,15000,10,0.0,0,0,2.0,available,backorder,False,sach-doc-het-trai-tim-cach-starbucks-xay-dung-cong-ty-bang-tung-tach-ca-phe-nxb-tre-bia-mem-p205294139.html?spid=205294140,Howard Schultz | Joanne Gordon,Bamboo Books;205294140;135000 | Hiệu Sách Tự Do;209389573;145000 | FishingBook;253107322;135000,Nhà Sách Tiki | Sách tiếng Việt | Sách kinh tế | Bài học kinh doanh | Sách - Dốc Hết Trái Tim - Cách Starbuck Xây Dựng Công Ty Bằng Từng Tách Cà Phê - NXB Trẻ - Bìa Mềm,484
577319,Nguyên Tắc 50 - Không Sợ Hãi,3300,2303,109900,109900,109900,0,0,4.5,8,0,20.0,available,backorder,False,nguyen-tac-50-khong-so-hai-p577319.html?spid=127790874,50 Cent & Robert Greene,Nhà Sách Trẻ Online;127790874;109900 | VBooks;160205708;110500,Nhà Sách Tiki | Sách tiếng Việt | Sách kinh tế | Bài học kinh doanh | Nguyên Tắc 50 - Không Sợ Hãi,334
217341662,PROFIT FIRST  - Dòng tiền gắn liền lợi nhuận – Mike Michalowicz - Alphabooks -Nhà Xuất Bản Công Thương,3300,133,104000,149000,149000,45000,30,0.0,0,0,,available,backorder,False,profit-first-dong-tien-gan-lien-loi-nhuan-mike-michalowicz-alphabooks-nha-xuat-ban-cong-thuong-p217341662.html?spid=263277458,,Alpha Books Official;263277458;104000 | BÌNH BÁN BOOK;217341665;134000 | HỆ THỐNG NHÀ SÁCH ABC;247973051;131000 | FishingBook;260921319;126650,Nhà Sách Tiki | Sách tiếng Việt | Sách kinh tế | Bài học kinh doanh | PROFIT FIRST  - Dòng tiền gắn liền lợi nhuận – Mike Michalowicz - Alphabooks -Nhà Xuất Bản Công Thương,
22299340,Luận Ngữ Và Đạo Kinh Doanh,3300,1440,99000,99000,0,0,0,5.0,6,0,,discontinued,discontinued,False,luan-ngu-va-dao-kinh-doanh-p22299340.html,Nghê Thế Hòa,,Nhà Sách Tiki | Sách tiếng Việt | Sách kinh tế | Bài học kinh doanh | Luận Ngữ Và Đạo Kinh Doanh,
136785774,Bảy Quy Luật Tinh Thần Của Thành Công,3300,594,49200,49200,49200,0,0,0.0,0,0,,available,backorder,False,bay-quy-luat-tinh-than-cua-thanh-cong-p136785774.html?spid=251520360,,SÁCH ĐẠI NAM;251520360;49200 | VBooks;155771834;50000,Nhà Sách Tiki | Sách tiếng Việt | Sách kinh tế | Bài học kinh doanh | Bảy Quy Luật Tinh Thần Của Thành Công,143
205855150,The Magic - Phép Màu (Rhonda Byrne),3300,216,174000,198000,198000,24000,12,0.0,0,0,4.0,available,backorder,False,the-magic-phep-mau-rhonda-byrne-p205855150.html?spid=207227205,Rhonda Byrne,HỆ THỐNG NHÀ SÁCH ABC;207227205;174000 | Times Books;205855151;158000 | info book;239628522;198000 | Nhà Sách Trẻ Online;249513892;157500,Nhà Sách Tiki | Sách tiếng Việt | Sách kinh tế | Bài học kinh doanh | The Magic - Phép Màu (Rhonda Byrne),
48544425,Con Đường Đi Đến Thành Công Bằng Sự Tử Tế (Tái bản),3300,1223,63000,70000,70000,7000,10,0.0,0,0,1.0,available,backorder,False,con-duong-di-den-thanh-cong-bang-su-tu-te-tai-ban-p48544425.html?spid=261952933, Inamori Kazuo,TYMBooks;261952933;63000,Nhà Sách Tiki | Sách tiếng Việt | Sách kinh tế | Bài học kinh doanh | Con Đường Đi Đến Thành Công Bằng Sự Tử Tế (Tái bản),204
176777504,Combo 2 Cuốn Chiến Lược Của Robert Greene: 33 Chiến Lược Của Chiến Tranh + 48 Nguyên Tắc Chủ Chốt Của Quyền Lực,3300,422,373500,415000,415000,41500,10,0.0,0,0,8.0,available,backorder,False,combo-2-cuon-chien-luoc-cua-robert-greene-33-chien-luoc-cua-chien-tranh-48-nguyen-tac-chu-chot-cua-quyen-luc-p176777504.html?spid=200740629,,Bamboo Books;200740629;373500,Nhà Sách Tiki | Sách tiếng Việt | Sách kinh tế | Bài học kinh doanh | Combo 2 Cuốn Chiến Lược Của Robert Greene: 33 Chiến Lược Của Chiến Tranh + 48 Nguyên Tắc Chủ Chốt Của Quyền Lực,
160671773,Thực Hành Drucker - Giải Quyết 40 Vấn Đề Của Quản Trị Hiện Đại,3300,510,143550,165000,165000,21450,13,5.0,1,0,18.0,available,backorder,False,thuc-hanh-drucker-giai-quyet-40-van-de-cua-quan-tri-hien-dai-p160671773.html?spid=160671774,,Nhà sách Fahasa;160671774;143550 | nha sach nguyet linh;160754206;157000 | Phương Đông Books;174829675;140500 | info book;180598600;159000 | Bamboo Books;188447475;148500 | VBooks;192033482;135300 | Nhà Sách Vĩnh Thụy;199895791;145000 | SÁCH ĐẠI NAM;248876927;165000 | FishingBook;253268780;148500,Nhà Sách Tiki | Sách tiếng Việt | Sách kinh tế | Bài học kinh doanh | Thực Hành Drucker - Giải Quyết 40 Vấn Đề Của Quản Trị Hiện Đại,
53978579,Carlos Slim: Bí quyết thành công của người đàn ông giàu nhất thế giới,3300,1142,147200,184000,184000,36800,20,5.0,6,0,23.0,available,backorder,False,sach-carlos-slim-bi-quyet-thanh-cong-cua-nguoi-dan-ong-giau-nhat-the-gioi-p53978579.html?spid=56003566,,Nhà sách Fahasa;56003566;147200 | Tiki Trading;54055153;111000 | Bookstores;54759026;119600 | Shop60s;57643527;184000 | The King of Books;58107740;119600 | Nhà sách Có Đủ Cả;71548546;184000 | tientien1912;75398521;132480 | SusuFamily;156189306;128800 | BizbooksJSC;164091990;99000 | MiNaBooks;169545938;107000 | Sách TKBooks ;174020854;119600 | Nicebooks;174502945;117760 | info book;173829743;162000 | Sách Doanh Nhân;178307490;114080 | MCBooks Sài Gòn;181973376;119000 | Bamboo Books;197462956;156400 | HỆ THỐNG NHÀ SÁCH ABC;203083499;162000 | Nhà Sách Vĩnh Thụy;203462564;162000 | Hiệu Sách Tự Do;212255175;182000 | The 1991 Book;247861345;119600 | Nhà sách PLV;248758093;184000,Nhà Sách Tiki | Sách tiếng Việt | Sách kinh tế | Bài học kinh doanh | Carlos Slim: Bí quyết thành công của người đàn ông giàu nhất thế giới,
249089685,Không Bao Giờ Là Thất Bại! Tất Cả Là Thử Thách (Tái Bản 2023),3300,83,166400,208000,208000,41600,20,0.0,0,0,3.0,available,backorder,False,khong-bao-gio-la-that-bai-tat-ca-la-thu-thach-tai-ban-2023-p249089685.html?spid=249089686,Chung Ju Yung,Nhà sách Fahasa;249089686;166400,Nhà Sách Tiki | Sách tiếng Việt | Sách kinh tế | Bài học kinh doanh | Không Bao Giờ Là Thất Bại! Tất Cả Là Thử Thách (Tái Bản 2023),
225914084,Thương vụ Facebook thâu tóm Instagram,3300,119,210000,248000,248000,38000,15,5.0,1,0,12.0,available,instock,False,thuong-vu-facebook-thau-tom-instagram-p225914084.html?spid=225914085,Sarah Frier,Tiki Trading;225914085;210000 | Bamboo Books;242453108;210800 | BOOKCITY;243099296;210800 | Nhà sách NetaBooks;247882454;210800,Nhà Sách Tiki | Sách tiếng Việt | Sách kinh tế | Bài học kinh doanh | Thương vụ Facebook thâu tóm Instagram,512
11301028,Combo Nghệ thuật Kinh doanh hắc ám (Luật Bố già - Bóng ma danh vọng - Sự trỗi dậy của siêu lừa Ponzi + hộp),3300,1568,289000,400000,400000,111000,28,5.0,18,0,99.0,available,instock,False,combo-nghe-thuat-kinh-doanh-hac-am-luat-bo-gia-bong-ma-danh-vong-su-troi-day-cua-sieu-lua-ponzi-hop-p11301028.html?spid=71053312,Louis Ferrante | Harry Reichenbach | Charles Ponzi,Tiki Trading;71053312;289000,Nhà Sách Tiki | Sách tiếng Việt | Sách kinh tế | Bài học kinh doanh | Combo Nghệ thuật Kinh doanh hắc ám (Luật Bố già - Bóng ma danh vọng - Sự trỗi dậy của siêu lừa Ponzi + hộp),
79110422,Lee Kun Hee -  Những Lựa Chọn Chiến Lược Và Kỳ Tích Samsung,3300,840,103200,129000,129000,25800,20,5.0,4,0,18.0,available,backorder,False,lee-kun-hee-nhung-lua-chon-chien-luoc-va-ky-tich-samsung-p79110422.html?spid=80959854,Ji Pyeong Gil,Nhà sách Fahasa;80959854;103200 | info book;122812554;114000 | Bamboo Books;180103157;103200 | HỆ THỐNG NHÀ SÁCH ABC;197833967;114000,Nhà Sách Tiki | Sách tiếng Việt | Sách kinh tế | Bài học kinh doanh | Lee Kun Hee -  Những Lựa Chọn Chiến Lược Và Kỳ Tích Samsung,260
1010610,Ngân Hàng Đột Phá,3300,2079,124020,159000,159000,34980,22,4.8,5,0,24.0,available,backorder,False,ngan-hang-dot-pha-p1010610.html?spid=20485134,Brett King,Nhà sách Fahasa;20485134;124020 | Tiki Trading;1010638;100500 | info book;120574928;140000 | Nhà Sách Vĩnh Thụy;120575105;153000 | Saigon Books Official;148047821;103350 | HỆ THỐNG NHÀ SÁCH ABC;195122937;140000 | Times Books;215730544;130080 | Nhà Sách Trẻ Online;253242102;129780 | Tiệm Sách Hoa Hồng;253242105;130380,Nhà Sách Tiki | Sách tiếng Việt | Sách kinh tế | Bài học kinh doanh | Ngân Hàng Đột Phá,386
102431114,Xây Dựng Thương Hiệu Uy Tín - Bí Quyết Tạo Nên Thương Hiệu Xuất Chúng,3300,750,99000,99000,99000,0,0,0.0,0,0,,available,backorder,False,xay-dung-thuong-hieu-uy-tin-bi-quyet-tao-nen-thuong-hieu-xuat-chung-p102431114.html?spid=189539175,Wolfgang Schaefer | J.P.Kuehlwein,Tiệm sách Minh Hằng;189539175;99000 | Minhhabooks;106546247;85000 | MHbooks;121154583;104000,Nhà Sách Tiki | Sách tiếng Việt | Sách kinh tế | Bài học kinh doanh | Xây Dựng Thương Hiệu Uy Tín - Bí Quyết Tạo Nên Thương Hiệu Xuất Chúng,492
42829039,Không Thể Bị Đánh Bại - Đừng Bao Giờ Đầu Hàng Nghịch Cảnh,3300,1299,159210,183000,183000,23790,13,0.0,0,0,6.0,available,backorder,False,khong-the-bi-danh-bai-dung-bao-gio-dau-hang-nghich-canh-p42829039.html?spid=48752956,Brian F Martin,Nhà sách Fahasa;48752956;159210 | NVP;44800846;95000 | Bookstores;48990080;92000 | trungthanh2018;49193601;146399 | NhatPham0356;49607700;146400 | The King of Books;58107553;118950 | Shop60s;57643954;183000 | tientien1912;75398500;131760 | Minhhabooks;91727506;137000 | SusuFamily;156189376;128100 | BizbooksJSC;164092452;112000 | MCBooks Hạnh Phúc;165046803;118950 | MiNaBooks;169546067;112960 | Nicebooks;174503050;92000 | info book;174121835;161000 | Sách Doanh Nhân;178302877;113460 | MCBooks Sài Gòn;181973367;118000 | MCB Chumsachhoitu;186705986;183000 | HỆ THỐNG NHÀ SÁCH ABC;203293172;161000 | Nhà Sách Vĩnh Thụy;203462282;161000,Nhà Sách Tiki | Sách tiếng Việt | Sách kinh tế | Bài học kinh doanh | Không Thể Bị Đánh Bại - Đừng Bao Giờ Đầu Hàng Nghịch Cảnh,
213568260,Combo Bất Động Sản: 100 Lời Khuyên Đầu Tư Bất Động Sản Khôn Ngoan Nhất + Đầu Tư Bất Động Sản + Bất Động Sản Căn Bản + Donald Trump - Chiến Lược Đầu Tư Bất Động Sản,3300,174,494000,706000,706000,212000,30,0.0,0,0,1.0,available,backorder,False,combo-bat-dong-san-100-loi-khuyen-dau-tu-bat-dong-san-khon-ngoan-nhat-dau-tu-bat-dong-san-bat-dong-san-can-ban-donald-trump-chien-luoc-dau-tu-bat-dong-san-p213568260.html?spid=213708081,,Alpha Books Official;213708081;494000 | Sống Official;213568261;564000 | Omega Plus Books;213708354;494200 | ETS Books;213708244;564000 | info book;213960115;706000 | VBooks;247271422;518910 | HỆ THỐNG NHÀ SÁCH ABC;253249146;595000,Nhà Sách Tiki | Sách tiếng Việt | Sách kinh tế | Bài học kinh doanh | Combo Bất Động Sản: 100 Lời Khuyên Đầu Tư Bất Động Sản Khôn Ngoan Nhất + Đầu Tư Bất Động Sản + Bất Động Sản Căn Bản + Donald Trump - Chiến Lược Đầu Tư Bất Động Sản,
192949437,Combo Sách Tạo Lập Mô Hình Kinh Doanh Cá Nhân + Tạo Lập Mô Hình Kinh Doanh + Mô Hình Kinh Doanh Nhóm + Thiết Kế Giải Pháp Giá Trị (Bộ 4 Cuốn),3300,325,889920,1236000,1236000,346080,28,0.0,0,0,25.0,available,backorder,False,combo-sach-tao-lap-mo-hinh-kinh-doanh-ca-nhan-tao-lap-mo-hinh-kinh-doanh-mo-hinh-kinh-doanh-nhom-thiet-ke-giai-phap-gia-tri-bo-4-cuon-p192949437.html?spid=192949438,Tim Clark |  Bruce Hazen |  Yves Pigneur,Nhà sách Fahasa;192949438;889920 | Nhà Sách Vĩnh Thụy;203470170;1088000 | HỆ THỐNG NHÀ SÁCH ABC;247944968;1088000,Nhà Sách Tiki | Sách tiếng Việt | Sách kinh tế | Bài học kinh doanh | Combo Sách Tạo Lập Mô Hình Kinh Doanh Cá Nhân + Tạo Lập Mô Hình Kinh Doanh + Mô Hình Kinh Doanh Nhóm + Thiết Kế Giải Pháp Giá Trị (Bộ 4 Cuốn),
11960708,Combo Dọn Dẹp Theo Phương Thức Toyota + Thất Bại Học Của Toyota,3300,1554,153000,174000,174000,21000,12,0.0,0,0,,available,backorder,False,combo-don-dep-theo-phuong-thuc-toyota-that-bai-hoc-cua-toyota-p11960708.html?spid=229726170,Yoshihito Wakamatsu,HỆ THỐNG NHÀ SÁCH ABC;229726170;153000 | Phương Đông Books;12516685;166350 | Nhà Sách Vĩnh Thụy;50702097;167000 | info book;57065867;169000 | SÁCH ĐẠI NAM;260918904;174000,Nhà Sách Tiki | Sách tiếng Việt | Sách kinh tế | Bài học kinh doanh | Combo Dọn Dẹp Theo Phương Thức Toyota + Thất Bại Học Của Toyota,
249771924,Người Bán Hàng Vĩ Đại Nhất Thế Giới - Tái Bản (Sách Bản Quyền),3300,77,78200,118000,118000,39800,34,0.0,0,0,2.0,available,instock,False,nguoi-ban-hang-vi-dai-nhat-the-gioi-tai-ban-sach-ban-quyen-p249771924.html?spid=249771933,Lâm Vọng Đạo,Tiki Trading;249771933;78200,Nhà Sách Tiki | Sách tiếng Việt | Sách kinh tế | Bài học kinh doanh | Người Bán Hàng Vĩ Đại Nhất Thế Giới - Tái Bản (Sách Bản Quyền),416
77111822,Tự Lập Không Thừa Kế - Cẩm Nang Kinh Doanh Tâm Huyết Của Một Tỷ Phú Tự Thân,3300,868,64000,88000,88000,24000,27,4.7,37,0,179.0,available,instock,False,tu-lap-khong-thua-ke-cam-nang-kinh-doanh-tam-huyet-cua-mot-ty-phu-tu-than-p77111822.html?spid=77111823,Tom Golisano,Tiki Trading;77111823;64000 | NewShop Official;104412951;74800 | Tân Việt;109956860;88000 | Minhhabooks;114399466;69999 | MHbooks;120811688;89000 | Nhà Sách Trí Đức;186743131;88000 | Tiệm sách Minh Hằng;190171559;67999,Nhà Sách Tiki | Sách tiếng Việt | Sách kinh tế | Bài học kinh doanh | Tự Lập Không Thừa Kế - Cẩm Nang Kinh Doanh Tâm Huyết Của Một Tỷ Phú Tự Thân,219
177891350,Combo Nghĩ Giàu Và Làm Giàu - Bí Mật Tư Duy Triệu Phú,3300,411,196200,218000,218000,21800,10,0.0,0,0,,available,backorder,False,combo-nghi-giau-va-lam-giau-bi-mat-tu-duy-trieu-phu-p177891350.html?spid=217523913, Napoleon Hill |  T Harv Eker,Nhà Sách Dalifa;217523913;196200 | NHASACHTRITUE;177891351;189660 | Phương Đông Books;192973937;208500 | Times Books;215796581;182820,Nhà Sách Tiki | Sách tiếng Việt | Sách kinh tế | Bài học kinh doanh | Combo Nghĩ Giàu Và Làm Giàu - Bí Mật Tư Duy Triệu Phú,
4780065,Sức Mạnh Của Đạo Đức Trong Kinh Doanh: Cách Tạo Nên Những Nhân Viên Hạnh Phúc Nhất,3300,1734,75650,89000,89000,13350,15,4.8,5,0,23.0,available,backorder,False,suc-manh-cua-dao-duc-trong-kinh-doanh-cach-tao-nen-nhung-nhan-vien-hanh-phuc-nhat-p4780065.html?spid=20491694,Akio Shibata,Nhà sách Fahasa;20491694;75650 | Haidangbooks;79008847;71200,Nhà Sách Tiki | Sách tiếng Việt | Sách kinh tế | Bài học kinh doanh | Sức Mạnh Của Đạo Đức Trong Kinh Doanh: Cách Tạo Nên Những Nhân Viên Hạnh Phúc Nhất,216
12250880,Combo Dám thất bại và Nhà lãnh đạo không chức danh,3300,1548,115000,135000,135000,20000,15,0.0,0,0,2.0,available,backorder,False,combo-dam-that-bai-va-nha-lanh-dao-khong-chuc-danh-p12250880.html?spid=89410535,,SÁCH NGHÉ;89410535;115000 | nha sach nguyet linh;12250881;154500 | Bamboo Books;193639163;154800 | FishingBook;252653296;154800,Nhà Sách Tiki | Sách tiếng Việt | Sách kinh tế | Bài học kinh doanh | Combo Dám thất bại và Nhà lãnh đạo không chức danh,
58696236,Forex 100% – Học Cách Kiếm Tiền Trên Thị Trường,3300,1056,135200,169000,169000,33800,20,5.0,12,0,35.0,available,backorder,False,forex-100-hoc-cach-kiem-tien-tren-thi-truong-p58696236.html?spid=62876077,Angel Darazhanov | Miroslav Kozarov | Vasil Banov,Nhà sách Fahasa;62876077;135200 | Times Books;59293585;116410 | Alpha Books Official;59402376;118300 | Sống Official;68107875;118300 | GOLD BOOKS;68951283;131820 | Nhà Sách Vĩnh Thụy;74537297;149000 | HaAnBooks;83493120;169000 | Nhà Sách Đinh Lễ;84440113;147250 | Nhà Sách Lifebooks;88936032;169000 | ETS Books;88950679;118300 | Omega Plus Books;88964141;118300 | info book;117400624;149000 | Trạm đọc;126744251;118300 | Bamboo Books;181981508;135200 | Đồ chơi giáo dục thông minh;192378318;118300 | Zing Books;200850583;169000 | HỆ THỐNG NHÀ SÁCH ABC;204112721;149000 | Hiệu Sách Tự Do;214737530;160550 | VBooks;248497351;116610 | Nhà Sách Trẻ Online;262045645;116110 | Tiệm Sách Hoa Hồng;262045650;116610,Nhà Sách Tiki | Sách tiếng Việt | Sách kinh tế | Bài học kinh doanh | Forex 100% – Học Cách Kiếm Tiền Trên Thị Trường,316
