id,name,data_version,day_ago_created ,price,list_price,original_price,discount,discount_rate,rating_average,review_count,favourite_count,all_time_quantity_sold,inventory_status,inventory_type,has_ebook ,url_path,authors,seller_name;spid;price,breadcrumbs,number_of_page
421620,Em Phải Đến Harvard Học Kinh Tế (Tái Bản),3300,2305,85260,98000,98000,12740,13,4.8,28,0,198.0,available,backorder,False,em-phai-den-harvard-hoc-kinh-te-tai-ban-p421620.html?spid=20426417,Lưu Vệ Hoa - Trương Hân Vũ,Nhà sách Fahasa;20426417;85260 | Tiki Trading;125311;70700 | AHABOOKS;6971163;98000 | trungthanh2018;8474456;71300 | Phương Đông Books;12500915;98000 | Nhà sách Thanh Hà;51573836;71200 | Huy Hoang Bookstore;97017287;73500 | NewShop Official;99405809;73499 | Minhhabooks;173633360;77000 | MHbooks;173945373;88000 | Nhà sách Có Đủ Cả;174207422;98000 | Tazano Official Store;191267990;77000 | Nhà Sách Trẻ Online;193721792;77800 | Times Books;194114611;78100,Nhà Sách Tiki | Sách tiếng Việt | Sách kinh tế | Sách khởi nghiệp | Em Phải Đến Harvard Học Kinh Tế (Tái Bản),459
57521324,#Hashtag 03: Retail - Khởi Sự Kinh Doanh Ngành Bán Lẻ,3300,1085,153000,220000,220000,67000,30,4.7,341,0,2204.0,available,instock,False,hashtag-03-retail-khoi-su-kinh-doanh-nganh-ban-le-p57521324.html?spid=57521325,,Tiki Trading;57521325;153000,Nhà Sách Tiki | Sách tiếng Việt | Sách kinh tế | Sách khởi nghiệp | #Hashtag 03: Retail - Khởi Sự Kinh Doanh Ngành Bán Lẻ,365
197678423,Sách: Xây Dựng Sự Độc Đáo - Cách Để Khởi Nghiệp Từ Đam Mê,3300,277,67150,85000,85000,17850,21,0.0,0,0,,available,backorder,False,sach-xay-dung-su-doc-dao-cach-de-khoi-nghiep-tu-dam-me-p197678423.html?spid=257437536,,BOOK SAI GON;257437536;67150 | Minh Long Book;197678424;67200 | Trạm đọc;202634824;69720 | Việt Thư Books;257437540;68000 | Times Books;262724431;67200 | Tiệm Sách Hoa Hồng;262724432;67200 | VBooks;262724433;67200,Nhà Sách Tiki | Sách tiếng Việt | Sách kinh tế | Sách khởi nghiệp | Sách: Xây Dựng Sự Độc Đáo - Cách Để Khởi Nghiệp Từ Đam Mê,232
75813201,Không Đến Một (Tái Bản - Bìa Cam),3300,890,76100,110000,110000,33900,31,5.0,281,0,2079.0,available,instock,False,khong-den-mot-tai-ban-bia-cam-p75813201.html?spid=75813202,Peter Thiel | Blake Masters,Tiki Trading;75813202;76100 | Geta;88246234;94000 | Nhà Xuất Bản Trẻ;107876610;88000 | Nhân Văn;147337194;99000 | Bamboo Books;192412353;99000 | VIETNAMBOOK;241906133;74800 | FishingBook;253119474;99000 | Tiệm Sách Cá Heo;263195053;90200,Nhà Sách Tiki | Sách tiếng Việt | Sách kinh tế | Sách khởi nghiệp | Không Đến Một (Tái Bản - Bìa Cam),276
252558658,"Thay Đổi Từ Tiểu Tiết Tạo Nên Sự Khác Biệt, Tiểu Tiết Quyết Định Thành Bại ",3300,61,168000,168000,168000,0,0,0.0,0,0,,available,backorder,False,thay-do-i-tu-tie-u-tie-t-ta-o-nen-su-kha-c-bie-t-tie-u-tie-t-quye-t-di-nh-tha-nh-ba-i-p252558658.html?spid=253290781,,Nhà sách PLV;253290781;168000 | NVP;252558659;168000,"Nhà Sách Tiki | Sách tiếng Việt | Sách kinh tế | Sách khởi nghiệp | Thay Đổi Từ Tiểu Tiết Tạo Nên Sự Khác Biệt, Tiểu Tiết Quyết Định Thành Bại ",
551919,Không Đến Một,3300,2305,99500,99500,99500,0,0,5.0,1,0,29.0,available,backorder,False,khong-den-mot-p551919.html?spid=12511336,Peter Thiel và Blake Masters,Phương Đông Books;12511336;99500,Nhà Sách Tiki | Sách tiếng Việt | Sách kinh tế | Sách khởi nghiệp | Không Đến Một,276
134846272,Education - Kinh Doanh Giáo Dục Tại Thị Trường Việt Nam,3300,600,180000,220000,220000,40000,18,4.6,76,0,705.0,available,instock,False,education-kinh-doanh-giao-duc-tai-thi-truong-viet-nam-p134846272.html?spid=134846273,RIO BOOK,Tiki Trading;134846273;180000,Nhà Sách Tiki | Sách tiếng Việt | Sách kinh tế | Sách khởi nghiệp | Education - Kinh Doanh Giáo Dục Tại Thị Trường Việt Nam,144
87978940,Hashtag No.4 Food - Khởi Sự Kinh Doanh Dịch Vụ Ăn Uống (2 Cuốn),3300,809,289250,325000,325000,35750,11,0.0,0,0,1.0,available,backorder,False,hashtag-no-4-food-khoi-su-kinh-doanh-dich-vu-an-uong-2-cuon-p87978940.html?spid=248610961,,Taurus 1987;248610961;289250 | Tiki Trading;87978941;289000 | AHABOOKS;202511083;291500,Nhà Sách Tiki | Sách tiếng Việt | Sách kinh tế | Sách khởi nghiệp | Hashtag No.4 Food - Khởi Sự Kinh Doanh Dịch Vụ Ăn Uống (2 Cuốn),448
74458466,Tự Truyện Ken Langone: Từ Số 0 Đến Tỷ Phú,3300,914,136000,170000,170000,34000,20,5.0,3,0,18.0,available,backorder,False,tu-truyen-ken-langone-tu-so-0-den-ty-phu-p74458466.html?spid=76152103,Ken Langone,Nhà sách Fahasa;76152103;136000 | Tiki Trading;74458467;107500 | BOOKS AND LIFE;75343244;127500 | info book;76472897;150000 | Nhà Sách Vĩnh Thụy;76472896;164000 | Nhà sách NetaBooks;152103031;144500 | HỆ THỐNG NHÀ SÁCH ABC;195060116;150000 | Times Books;215544834;84500 | Nhà Sách Trẻ Online;253240627;84000 | Tiệm Sách Hoa Hồng;253240628;85000,Nhà Sách Tiki | Sách tiếng Việt | Sách kinh tế | Sách khởi nghiệp | Tự Truyện Ken Langone: Từ Số 0 Đến Tỷ Phú,376
196284166,Khởi Nghiệp Tinh Gọn,3300,294,139000,220000,220000,81000,37,5.0,2,0,50.0,available,instock,False,khoi-nghiep-tinh-gon-p196284166.html?spid=196284168,John Mullins,Tiki Trading;196284168;139000 | Cá Chép Bookstore;197623595;198000 | HỆ THỐNG NHÀ SÁCH ABC;197863257;194000 | BOOKS CITY;198425042;154000 | info book;201671931;194000 | Nhà sách Miền Đông;203950511;187000 | Nhà Sách Vĩnh Thụy;213891830;194000 | Times Books;215377524;180100 | Nhà sách PLV;217443628;200000,Nhà Sách Tiki | Sách tiếng Việt | Sách kinh tế | Sách khởi nghiệp | Khởi Nghiệp Tinh Gọn,444
85192060,Ứng Dụng Trí Tuệ Nhân Tạo Trong Phân Tích Thị Trường Chứng Khoán,3300,819,202000,229000,229000,27000,12,0.0,0,0,,available,backorder,False,ung-dung-tri-tue-nhan-tao-trong-phan-tich-thi-truong-chung-khoan-p85192060.html?spid=201845149,Cris DoLoc,Nhà Sách Vĩnh Thụy;201845149;202000 | Tiki Trading;85192061;159400 | info book;208120019;202000 | HỆ THỐNG NHÀ SÁCH ABC;254079047;202000,Nhà Sách Tiki | Sách tiếng Việt | Sách kinh tế | Sách khởi nghiệp | Ứng Dụng Trí Tuệ Nhân Tạo Trong Phân Tích Thị Trường Chứng Khoán,452
155463014,Quốc Gia Khởi Nghiệp - Câu Chuyện Về Nền Kinh Tế Thần Kỳ Của Israel (Tái Bản),3300,531,209000,209000,209000,0,0,0.0,0,0,,available,backorder,False,quoc-gia-khoi-nghiep-cau-chuyen-ve-nen-kinh-te-than-ky-cua-israel-tai-ban-p155463014.html?spid=190087653,Dan Senor | Saul Singer,GETA SHOP;190087653;209000 | Tiki Trading;155463015;148000 | Bamboo Books;177927908;167200 | Nhà Sách Vĩnh Thụy;178998753;184000 | HỆ THỐNG NHÀ SÁCH ABC;192665874;184000 | info book;194953456;184000 | Alpha Books Official;213740878;146000 | Trạm đọc;249850289;145464 | Sống Official;262688404;145500,Nhà Sách Tiki | Sách tiếng Việt | Sách kinh tế | Sách khởi nghiệp | Quốc Gia Khởi Nghiệp - Câu Chuyện Về Nền Kinh Tế Thần Kỳ Của Israel (Tái Bản),508
87941401,Lối Tắt Khởi Nghiệp - Con Đường Ngắn Từ Tay Trắng Đến Thành Công Bền Vững,3300,809,125000,169000,169000,44000,26,4.8,495,0,2283.0,available,instock,False,loi-tat-khoi-nghiep-con-duong-ngan-tu-tay-trang-den-thanh-cong-ben-vung-p87941401.html?spid=87941402,Dane,GIVER Books;87941402;125000,Nhà Sách Tiki | Sách tiếng Việt | Sách kinh tế | Sách khởi nghiệp | Lối Tắt Khởi Nghiệp - Con Đường Ngắn Từ Tay Trắng Đến Thành Công Bền Vững,300
34869856,Bí Quyết Tay Trắng Thành Triệu Phú ( tái bản ),3300,1357,124500,150000,150000,25500,17,0.0,0,0,2.0,available,backorder,False,bi-quyet-tay-trang-thanh-trieu-phu-tai-ban-p34869856.html?spid=248416875,Adam Khoo,Việt Thư Books;248416875;124500 | trungthanh2018;34869857;140000 | Sách Hay Cho Mọi Nhà;153255358;150000 | Bảo Châu Books;184782285;149400 | Nhà sách Miền Đông;210793529;150000,Nhà Sách Tiki | Sách tiếng Việt | Sách kinh tế | Sách khởi nghiệp | Bí Quyết Tay Trắng Thành Triệu Phú ( tái bản ),436
154938614,Hơn Cả Khởi Nghiệp 2.0 - Xây Dựng Công Ty Từ Khởi Nghiệp Đến Vĩ Đại Trường Tồn,3300,536,160000,200000,200000,40000,20,5.0,25,0,211.0,available,instock,False,hon-ca-khoi-nghiep-2-0-xay-dung-cong-ty-tu-khoi-nghiep-den-vi-dai-truong-ton-p154938614.html?spid=154938631,Jim Collins,Tiki Trading;154938631;160000 | Nhà Xuất Bản Trẻ;157046487;160000 | VBooks;160203584;170000 | Times Books;174449739;169700 | Nhà Sách Vĩnh Thụy;176718099;176000 | Bamboo Books;192584898;180000 | Nhà Sách Trẻ Online;199547441;169400 | FishingBook;253350932;180000,Nhà Sách Tiki | Sách tiếng Việt | Sách kinh tế | Sách khởi nghiệp | Hơn Cả Khởi Nghiệp 2.0 - Xây Dựng Công Ty Từ Khởi Nghiệp Đến Vĩ Đại Trường Tồn,558
256500686,Podcaster - Vén Màn Hậu Trường Của Những Bước Chân 4.0,3300,35,108000,120000,120000,12000,10,0.0,0,0,6.0,available,backorder,False,podcaster-ven-man-hau-truong-cua-nhung-buoc-chan-4-0-p256500686.html?spid=256500689,Link Phượng,Nhà sách Fahasa;256500689;108000,Nhà Sách Tiki | Sách tiếng Việt | Sách kinh tế | Sách khởi nghiệp | Podcaster - Vén Màn Hậu Trường Của Những Bước Chân 4.0,
252878921,COACH - Khởi nghiệp độc lập bằng kỹ năng khai vấn,3300,55,242000,285000,285000,43000,15,0.0,0,0,27.0,available,backorder,False,coach-khoi-nghiep-doc-lap-bang-ky-nang-khai-van-p252878921.html?spid=252878922,Trần Tiến Công,RIObook Store;252878922;242000,Nhà Sách Tiki | Sách tiếng Việt | Sách kinh tế | Sách khởi nghiệp | COACH - Khởi nghiệp độc lập bằng kỹ năng khai vấn,312
94878710,Triệu phú thần tốc,3300,771,399000,399000,399000,0,0,4.7,133,0,930.0,available,instock,False,trieu-phu-than-toc-p94878710.html?spid=94878711,MJ DeMarco,Nền Tảng Thành Công;94878711;399000,Nhà Sách Tiki | Sách tiếng Việt | Sách kinh tế | Sách khởi nghiệp | Triệu phú thần tốc,258
50359874,Sứ mệnh khởi nghiệp,3300,1188,399000,399000,399000,0,0,4.8,142,0,882.0,available,instock,False,su-menh-khoi-nghiep-p50359874.html?spid=50359875,MJ DeMarco,Nền Tảng Thành Công;50359875;399000,Nhà Sách Tiki | Sách tiếng Việt | Sách kinh tế | Sách khởi nghiệp | Sứ mệnh khởi nghiệp,335
21430148,Để Xây Dựng Doanh Nghiệp Hiệu Quả (Tái Bản 2019),3300,1449,97000,139000,139000,42000,30,4.3,3,0,22.0,available,backorder,False,de-xay-dung-doanh-nghiep-hieu-qua-tai-ban-2019-p21430148.html?spid=70775429,Michael E. Gerber,Alpha Books Official;70775429;97000 | nha sach nguyet linh;44849397;130000 | Phương Đông Books;50495593;119500 | GOLD BOOKS;51727543;108420 | Times Books;55726091;96444 | Omega Plus Books;73767337;97300 | HaAnBooks;83491451;139000 | Nhà Sách Lifebooks;88942881;139000 | Trạm đọc;138336868;97000 | Bamboo Books;177893865;111200 | HỆ THỐNG NHÀ SÁCH ABC;193038634;122000 | info book;195167786;122000 | Nhà Sách Vĩnh Thụy;205113796;122000 | Nhà Sách Trẻ Online;262030754;96144,Nhà Sách Tiki | Sách tiếng Việt | Sách kinh tế | Sách khởi nghiệp | Để Xây Dựng Doanh Nghiệp Hiệu Quả (Tái Bản 2019),324
16610187,"Sprint - 5 Ngày ""Thổi Bay"" Mọi Vấn Đề Và ""Lên Gân"" Ý Tưởng Startup (Tái bản 2019)",3300,1470,97300,139000,139000,41700,30,4.5,14,0,163.0,available,backorder,False,sprint-5-ngay-thoi-bay-moi-van-de-va-len-gan-y-tuong-startup-tai-ban-2019-p16610187.html?spid=58521363,Jake Knapp - John Zeratsky - Braden Kowitz,Nhà Sách Minh Đức;58521363;97300 | Tazano Official Store;16610188;125000,"Nhà Sách Tiki | Sách tiếng Việt | Sách kinh tế | Sách khởi nghiệp | Sprint - 5 Ngày ""Thổi Bay"" Mọi Vấn Đề Và ""Lên Gân"" Ý Tưởng Startup (Tái bản 2019)",367
244168758,English Business Email - Viết Email Từ A-Z,3300,103,231000,289000,289000,58000,20,5.0,2,0,14.0,available,instock,False,english-business-email-viet-email-tu-a-z-p244168758.html?spid=244168759,Kevin Kyung,Tiki Trading;244168759;231000 | Bamboo Books;261963254;231200,Nhà Sách Tiki | Sách tiếng Việt | Sách kinh tế | Sách khởi nghiệp | English Business Email - Viết Email Từ A-Z,600
75585401,Doanh Nghiệp Siêu Nhỏ (for Dummies),3300,894,175200,219000,219000,43800,20,4.8,6,0,24.0,available,backorder,False,doanh-nghiep-sieu-nho-for-dummies-p75585401.html?spid=76152282,Paul Mladjenovic,Nhà sách Fahasa;76152282;175200 | Tiki Trading;75585402;140000 | THAIHABOOKS;75994271;170820 | VIETNAMBOOK;76008670;181770 | Phương Đông Books;84283373;174500 | NewShop Official;106708283;190530 | Nhà Sách Vĩnh Thụy;119688158;210000 | info book;119688031;193000 | Times Books;120432065;168330 | Nhà Sách Trẻ Online;134708653;168030 | Tiệm Sách Hoa Hồng;142671967;168630 | Nhân Văn;147337128;153000 | Bamboo Books;184579011;197100 | HỆ THỐNG NHÀ SÁCH ABC;204419797;193000,Nhà Sách Tiki | Sách tiếng Việt | Sách kinh tế | Sách khởi nghiệp | Doanh Nghiệp Siêu Nhỏ (for Dummies),512
160397655,101 Bí Quyết Làm Giàu Của Người Do Thái_ Sách_ Bizbooks_ Sách hay mỗi ngày ,3300,513,128700,198000,198000,69300,35,0.0,0,0,5.0,available,backorder,False,101-bi-quyet-lam-giau-cua-nguoi-do-thai_-sach_-bizbooks_-sach-hay-moi-ngay-p160397655.html?spid=160397656,,MCBooks Hạnh Phúc;160397656;128700,Nhà Sách Tiki | Sách tiếng Việt | Sách kinh tế | Sách khởi nghiệp | 101 Bí Quyết Làm Giàu Của Người Do Thái_ Sách_ Bizbooks_ Sách hay mỗi ngày ,
45653142,Thủ Lĩnh Bộ Lạc – Thuật Lãnh Đạo Xuất Chúng Để Đưa Tổ Chức Vươn Tới Một Tầm Cao Mới,3300,1270,158340,182000,182000,23660,13,5.0,8,0,59.0,available,backorder,False,thu-linh-bo-lac-thuat-lanh-dao-xuat-chung-de-dua-to-chuc-vuon-toi-mot-tam-cao-moi-p45653142.html?spid=48754421,Nhiều tác giả,Nhà sách Fahasa;48754421;158340 | NVP;46640976;127400 | Bookstores;48990093;103000 | SusuFamily;156189351;127400 | BizbooksJSC;164091984;106000 | Sách Doanh Nhân;176652526;112840,Nhà Sách Tiki | Sách tiếng Việt | Sách kinh tế | Sách khởi nghiệp | Thủ Lĩnh Bộ Lạc – Thuật Lãnh Đạo Xuất Chúng Để Đưa Tổ Chức Vươn Tới Một Tầm Cao Mới,
340631,Bí Quyết Gây Dựng Cơ Nghiệp Bạc Tỷ  ,3300,2305,111200,139000,139000,27800,20,0.0,0,0,9.0,available,backorder,False,bi-quyet-gay-dung-co-nghiep-bac-ty-p340631.html?spid=153255359,,Sách Hay Cho Mọi Nhà;153255359;111200 | trungthanh2018;8060418;115000 | AHABOOKS;11583741;125500 | Phương Đông Books;12501522;122500 | Bảo Châu Books;184782287;121800 | BOOK SAI GON;248414260;118150 | Việt Thư Books;248414524;118150,Nhà Sách Tiki | Sách tiếng Việt | Sách kinh tế | Sách khởi nghiệp | Bí Quyết Gây Dựng Cơ Nghiệp Bạc Tỷ  ,300
87452980,Airbnb - Cách một startup tái thiết kế du lịch và xã hội,3300,809,269000,269000,269000,0,0,4.6,22,0,133.0,available,instock,False,airbnb-cach-mot-startup-tai-thiet-ke-du-lich-va-xa-hoi-p87452980.html?spid=87452981,Leigh Gallagher,HappyLive;87452981;269000,Nhà Sách Tiki | Sách tiếng Việt | Sách kinh tế | Sách khởi nghiệp | Airbnb - Cách một startup tái thiết kế du lịch và xã hội,402
363376,Khởi Nghiệp Với 100$,3300,2305,101000,115000,115000,14000,12,0.0,0,0,4.0,available,backorder,False,khoi-nghiep-voi-100-p363376.html?spid=242875237,Chris Guillebeau,HỆ THỐNG NHÀ SÁCH ABC;242875237;101000 | Nhà Sách Vĩnh Thụy;55152009;111000 | info book;121245851;111000,Nhà Sách Tiki | Sách tiếng Việt | Sách kinh tế | Sách khởi nghiệp | Khởi Nghiệp Với 100$,
56819706,Khởi Nghiệp Với 100 Đô La (Tái Bản 2020),3300,1097,101000,115000,115000,14000,12,0.0,0,0,,available,backorder,False,khoi-nghiep-voi-100-do-la-tai-ban-2020-p56819706.html?spid=237879211,Chris Guillebeau,HỆ THỐNG NHÀ SÁCH ABC;237879211;101000 | info book;120476244;101000,Nhà Sách Tiki | Sách tiếng Việt | Sách kinh tế | Sách khởi nghiệp | Khởi Nghiệp Với 100 Đô La (Tái Bản 2020),383
197047868,Bí Quyết Gây Dựng Cơ Nghiệp Bạc Tỷ (Tái Bản),3300,286,139000,139000,139000,0,0,5.0,1,0,19.0,available,backorder,False,bi-quyet-gay-dung-co-nghiep-bac-ty-tai-ban-p197047868.html?spid=197047869,Adam Khoo,NHASACHTRITUE;197047869;139000,Nhà Sách Tiki | Sách tiếng Việt | Sách kinh tế | Sách khởi nghiệp | Bí Quyết Gây Dựng Cơ Nghiệp Bạc Tỷ (Tái Bản),
39854398,Youtube Secrets - Hướng Dẫn Căn Bản Cách Kiếm Tiền Từ Youtube (Tặng Sổ Tay A6 Dày 200 Trang),3300,1322,158000,179000,179000,21000,12,0.0,0,0,,available,backorder,False,youtube-secrets-huong-dan-can-ban-cach-kiem-tien-tu-youtube-tang-so-tay-a6-day-200-trang-p39854398.html?spid=254093240,Benji Travis | Sean Canell,HỆ THỐNG NHÀ SÁCH ABC;254093240;158000 | 1980Books Official;97843619;116350,Nhà Sách Tiki | Sách tiếng Việt | Sách kinh tế | Sách khởi nghiệp | Youtube Secrets - Hướng Dẫn Căn Bản Cách Kiếm Tiền Từ Youtube (Tặng Sổ Tay A6 Dày 200 Trang),308
253376358,Sách công thức TikTokk Ads 1000 đơn,3300,42,192500,250000,250000,57500,23,4.5,2,0,9.0,available,backorder,False,sach-cong-thuc-tiktokk-ads-1000-don-p253376358.html?spid=253376359,,Diepnguyet;253376359;192500,Nhà Sách Tiki | Sách tiếng Việt | Sách kinh tế | Sách khởi nghiệp | Sách công thức TikTokk Ads 1000 đơn,
50074646,Khởi Nghiệp Thông Minh (Tái Bản 2019),3300,1197,95200,119000,119000,23800,20,0.0,0,0,1.0,available,backorder,False,khoi-nghiep-thong-minh-tai-ban-2019-p50074646.html?spid=177915436,Ngô Công Trường,Bamboo Books;177915436;95200 | Nhà Sách Lifebooks;88941697;119000 | Trạm đọc;198648362;119000 | HỆ THỐNG NHÀ SÁCH ABC;207291809;105000,Nhà Sách Tiki | Sách tiếng Việt | Sách kinh tế | Sách khởi nghiệp | Khởi Nghiệp Thông Minh (Tái Bản 2019),220
229957281,Cẩm Nang Tuyển Sinh Đại Học & Cao Đẳng 2023,3300,116,24000,30000,30000,6000,20,0.0,0,0,22.0,available,backorder,False,cam-nang-tuyen-sinh-dai-hoc-cao-dang-2023-p229957281.html?spid=229957282,nhieu tac gia,Nhân Văn;229957282;24000,Nhà Sách Tiki | Sách tiếng Việt | Sách kinh tế | Sách khởi nghiệp | Cẩm Nang Tuyển Sinh Đại Học & Cao Đẳng 2023,
34870074,"Làm Chủ Tư Duy, Thay Đổi Vận Mệnh ( 2019)",3300,1357,132000,165000,165000,33000,20,5.0,68,0,616.0,available,backorder,False,lam-chu-tu-duy-thay-doi-van-menh-2019-p34870074.html?spid=34870075,Adam Khoo,trungthanh2018;34870075;132000 | Phương Đông Books;14195622;159000 | HỆ THỐNG NHÀ SÁCH ABC;203935790;165000,"Nhà Sách Tiki | Sách tiếng Việt | Sách kinh tế | Sách khởi nghiệp | Làm Chủ Tư Duy, Thay Đổi Vận Mệnh ( 2019)",433
244168746,200+ Bộ Câu Hỏi Và Trả Lời Phỏng Vấn Tiếng Anh,3300,103,269000,269000,269000,0,0,5.0,1,0,15.0,available,instock,False,200-bo-cau-hoi-va-tra-loi-phong-van-tieng-anh-p244168746.html?spid=244168747,Aran Kim,Tiki Trading;244168747;269000 | Nhà Sách Vĩnh Thụy;253400535;269000,Nhà Sách Tiki | Sách tiếng Việt | Sách kinh tế | Sách khởi nghiệp | 200+ Bộ Câu Hỏi Và Trả Lời Phỏng Vấn Tiếng Anh,404
249922965,XÂY DỰNG THƯƠNG HIỆU CÁ NHÂN CHO NGƯỜI LÀM KINH DOANH,3300,75,150000,150000,150000,0,0,5.0,1,0,12.0,available,backorder,False,xay-dung-thuong-hieu-ca-nhan-cho-nguoi-lam-kinh-doanh-p249922965.html?spid=249922966,nhieu tac gia,Hiệu Sách Kim Thái;249922966;150000,Nhà Sách Tiki | Sách tiếng Việt | Sách kinh tế | Sách khởi nghiệp | XÂY DỰNG THƯƠNG HIỆU CÁ NHÂN CHO NGƯỜI LÀM KINH DOANH,168
1057428,Bách Khoa Toàn Thư Về Khởi Nghiệp,3300,2064,319200,399000,399000,79800,20,5.0,8,0,31.0,available,backorder,False,bach-khoa-toan-thu-ve-khoi-nghiep-p1057428.html?spid=20441826,Steve Blank | Bob Dorf,Nhà sách Fahasa;20441826;319200 | Omega Plus Books;68982911;279300 | Nhà Sách Lifebooks;88936103;399000 | HaAnBooks;102876213;399000 | Nhà Sách Vĩnh Thụy;162151366;376000 | Bamboo Books;179029806;319200 | Đồ chơi giáo dục thông minh;186318583;280000 | Trạm đọc;188045258;279000 | HỆ THỐNG NHÀ SÁCH ABC;248904143;351000,Nhà Sách Tiki | Sách tiếng Việt | Sách kinh tế | Sách khởi nghiệp | Bách Khoa Toàn Thư Về Khởi Nghiệp,686
250020252,Đến Sahara Mở Quán Trà Đá - Bí Quyết Tìm Kiếm Mặt Bằng Kinh Doanh,3300,74,147260,199000,199000,51740,26,0.0,0,0,4.0,available,backorder,False,den-sahara-mo-quan-tra-da-bi-quyet-tim-kiem-mat-bang-kinh-doanh-p250020252.html?spid=250020253,Minh Phan,Nhà sách Fahasa;250020253;147260,Nhà Sách Tiki | Sách tiếng Việt | Sách kinh tế | Sách khởi nghiệp | Đến Sahara Mở Quán Trà Đá - Bí Quyết Tìm Kiếm Mặt Bằng Kinh Doanh,
246853817,Bầu Trời Không Chỉ Có Màu xanh _TRE,3300,101,54600,65000,65000,10400,16,3.0,2,0,3.0,available,backorder,False,bau-troi-khong-chi-co-mau-xanh-_tre-p246853817.html?spid=246853818,TS Lý Quí Trung,NewShop Official;246853818;54600,Nhà Sách Tiki | Sách tiếng Việt | Sách kinh tế | Sách khởi nghiệp | Bầu Trời Không Chỉ Có Màu xanh _TRE,182
20086333,Hướng Dẫn Căn Bản Cách Kiếm Tiền Từ Youtube,3300,1467,116350,179000,179000,62650,35,5.0,10,0,114.0,available,backorder,False,huong-dan-can-ban-cach-kiem-tien-tu-youtube-p20086333.html?spid=55716039,Benji Travis | Sean Canell,1980 BOOKS HCM;55716039;116350 | AHABOOKS;65814615;133500 | 1980Books Official;101468743;116350 | Nhà Sách Vĩnh Thụy;201165021;131000 | info book;208068826;131000 | Nhà sách PLV;210880662;149000 | Trao Tri thức Gặt Niềm tin;212231329;147973 | HỆ THỐNG NHÀ SÁCH ABC;254093222;158000,Nhà Sách Tiki | Sách tiếng Việt | Sách kinh tế | Sách khởi nghiệp | Hướng Dẫn Căn Bản Cách Kiếm Tiền Từ Youtube,308
167031429,Bộ Sách Để Trở Thành Bậc Thầy Đầu Tư Bất Động Sản - SB,3300,473,879040,1072000,1072000,192960,18,5.0,1,0,8.0,available,backorder,False,combo-4-cuon-bac-thay-dau-tu-bat-dong-san-101-cau-hoi-va-giai-dap-bat-dong-san-p167031429.html?spid=167031430,,NewShop Official;167031430;879040,Nhà Sách Tiki | Sách tiếng Việt | Sách kinh tế | Sách khởi nghiệp | Bộ Sách Để Trở Thành Bậc Thầy Đầu Tư Bất Động Sản - SB,
74236579,"Không Đến Một - Bài Học Về Khởi Nghiệp, Hay Cách Xây Dựng Tương Lai (Tái Bản)",3300,916,93500,110000,110000,16500,15,0.0,0,0,5.0,available,backorder,False,khong-den-mot-bai-hoc-ve-khoi-nghiep-hay-cach-xay-dung-tuong-lai-tai-ban-p74236579.html?spid=202849151,,Alpha Books Official;202849151;93500 | Bamboo Books;193859652;99000 | Omega Plus Books;202849403;93500 | ATP Book;242424002;99000 | FishingBook;253119483;99000,"Nhà Sách Tiki | Sách tiếng Việt | Sách kinh tế | Sách khởi nghiệp | Không Đến Một - Bài Học Về Khởi Nghiệp, Hay Cách Xây Dựng Tương Lai (Tái Bản)",276
51286732,Con Đường Khởi Nghiệp,3300,1183,144500,170000,170000,25500,15,4.6,5,0,21.0,available,backorder,False,con-duong-khoi-nghiep-p51286732.html?spid=51518836,Eric Ries,Nhà sách Fahasa;51518836;144500 | Tiki Trading;51286733;136000 | Nhà Xuất Bản Trẻ;112695412;136000 | Nhà Sách Trẻ Online;127706644;143900 | AHABOOKS;183527219;160500 | Bamboo Books;192412774;153000 | VBooks;208568568;144500 | Hiệu Sách Tự Do;242501424;161500 | FishingBook;262699612;153000 | Tiệm Sách Cá Heo;263195220;139400,Nhà Sách Tiki | Sách tiếng Việt | Sách kinh tế | Sách khởi nghiệp | Con Đường Khởi Nghiệp,420
260672929,"Sách công thức đa kênh x3 doanh thu, x2 lợi nhuận Tikk.Tok, Shop.ee , face.ebook",3300,29,197500,250000,250000,52500,21,0.0,0,0,3.0,available,backorder,False,sach-cong-thuc-da-kenh-x3-doanh-thu-x2-loi-nhuan-tikk-tok-shop-ee-face-ebook-p260672929.html?spid=260672930,,Diepnguyet;260672930;197500,"Nhà Sách Tiki | Sách tiếng Việt | Sách kinh tế | Sách khởi nghiệp | Sách công thức đa kênh x3 doanh thu, x2 lợi nhuận Tikk.Tok, Shop.ee , face.ebook",230
193994147,MADE IN VIETNAM ,3300,314,279000,279000,279000,0,0,5.0,16,0,139.0,available,instock,False,made-in-vietnam-p193994147.html?spid=194021940,,TGS BOOKS;194021940;279000,Nhà Sách Tiki | Sách tiếng Việt | Sách kinh tế | Sách khởi nghiệp | MADE IN VIETNAM ,328
248789044,13 Nguyên Tắc Nghĩ Giàu Làm Giàu - Think And Grow Rich (Tái Bản 2023),3300,87,111200,139000,139000,27800,20,0.0,0,0,2.0,available,backorder,False,13-nguyen-tac-nghi-giau-lam-giau-think-and-grow-rich-tai-ban-2023-p248789044.html?spid=248789045,Napoleon Hill,Nhà sách Fahasa;248789045;111200,Nhà Sách Tiki | Sách tiếng Việt | Sách kinh tế | Sách khởi nghiệp | 13 Nguyên Tắc Nghĩ Giàu Làm Giàu - Think And Grow Rich (Tái Bản 2023),
