id,name,data_version,day_ago_created ,price,list_price,original_price,discount,discount_rate,rating_average,review_count,favourite_count,all_time_quantity_sold,inventory_status,inventory_type,has_ebook ,url_path,authors,seller_name;spid;price,breadcrumbs,number_of_page
82935808,Làm Thế Nào Để Kiếm Tiềm Từ Số Tiền 100$ Thành 1.000.000$,3300,826,115370,139000,139000,23630,17,5.0,1,0,8.0,available,backorder,False,lam-the-nao-de-kiem-tiem-tu-so-tien-100-thanh-1-000-000-p82935808.html?spid=82935809,James McKenna |  Jeannine Glista |  Matt Fontaine,Nhà sách Fahasa;82935809;115370,Nhà Sách Tiki | Sách tiếng Việt | Sách kinh tế | Sách khởi nghiệp | Làm Thế Nào Để Kiếm Tiềm Từ Số Tiền 100$ Thành 1.000.000$,
262664313,19 kênh thu hút khách hàng dành cho công ty khởi nghiệp,3300,11,119200,149000,149000,29800,20,0.0,0,0,,available,backorder,False,sach-19-kenh-thu-hut-khach-hang-danh-cho-cong-ty-khoi-nghiep-p262664313.html?spid=262664314,,GOLD BOOKS;262664314;119200,Nhà Sách Tiki | Sách tiếng Việt | Sách kinh tế | Sách khởi nghiệp | 19 kênh thu hút khách hàng dành cho công ty khởi nghiệp,
253293671,Khởi Nghiệp Bán Lẻ - Bí Quyết Thành Công Và Giàu Có Bằng Những Cửa Hàng Đông Khách,3300,45,179100,199000,199000,19900,10,0.0,0,0,,available,backorder,False,khoi-nghiep-ban-le-bi-quyet-thanh-cong-va-giau-co-bang-nhung-cua-hang-dong-khach-p253293671.html?spid=253293672,Trần Thanh Phong,Nhà sách Fahasa;253293672;179100,Nhà Sách Tiki | Sách tiếng Việt | Sách kinh tế | Sách khởi nghiệp | Khởi Nghiệp Bán Lẻ - Bí Quyết Thành Công Và Giàu Có Bằng Những Cửa Hàng Đông Khách,
207933141,Dạy Con Làm Giàu 4 - Con Giàu Con Thông Minh - Để Có Khởi Đầu Thuận Lợi Về Tài Chính (Tái Bản 2022),3300,200,80000,100000,100000,20000,20,0.0,0,0,1.0,available,backorder,False,day-con-lam-giau-4-con-giau-con-thong-minh-de-co-khoi-dau-thuan-loi-ve-tai-chinh-tai-ban-2022-p207933141.html?spid=207933142,Robert T Kiyosaki,Nhà sách Fahasa;207933142;80000,Nhà Sách Tiki | Sách tiếng Việt | Sách kinh tế | Sách khởi nghiệp | Dạy Con Làm Giàu 4 - Con Giàu Con Thông Minh - Để Có Khởi Đầu Thuận Lợi Về Tài Chính (Tái Bản 2022),
137047664,"Giải Mã Doanh Nhân - Những Lầm Tưởng Trong Công Việc, Cuộc Sống Và Tâm Hồn Của Các Nhà Khởi Nghiệp",3300,593,127600,145000,145000,17400,12,0.0,0,0,2.0,available,backorder,False,giai-ma-doanh-nhan-nhung-lam-tuong-trong-cong-viec-cuoc-song-va-tam-hon-cua-cac-nha-khoi-nghiep-p137047664.html?spid=142405452,David Sax,NewShop Official;142405452;127600 | Minhhabooks;137562402;115000 | MHbooks;141266976;124000 | Tiệm sách Minh Hằng;190182117;115000,"Nhà Sách Tiki | Sách tiếng Việt | Sách kinh tế | Sách khởi nghiệp | Giải Mã Doanh Nhân - Những Lầm Tưởng Trong Công Việc, Cuộc Sống Và Tâm Hồn Của Các Nhà Khởi Nghiệp",304
92004367,Sách - Chiến Lược Kết Nối (Bìa cứng),3300,776,140000,199000,199000,59000,30,0.0,0,0,,available,backorder,False,sach-chien-luoc-ket-noi-bia-cung-p92004367.html?spid=189603504,,Đồ chơi giáo dục thông minh;189603504;140000 | Tiệm Sách Hoa Hồng;92004368;119400 | Nhà Sách Trẻ Online;108968132;118900 | Omega Plus Books;98575170;139300 | info book;119465449;190000 | ETS Books;104877965;139300 | Nhà Sách Vĩnh Thụy;122194483;190000 | Bamboo Books;178788218;159200 | Hiệu Sách Tự Do;214659031;189050 | FishingBook;260791672;169150 | Times Books;262030535;119200 | VBooks;262030536;119400,Nhà Sách Tiki | Sách tiếng Việt | Sách kinh tế | Sách khởi nghiệp | Sách - Chiến Lược Kết Nối (Bìa cứng),288
29248666,Connection - Kết Nối (Lời Khuyên Sinh Viên Việt Nam - Tái Bản 2019),3300,1393,62000,70000,70000,8000,11,0.0,0,0,1.0,available,backorder,False,connection-ket-noi-loi-khuyen-sinh-vien-viet-nam-tai-ban-2019-p29248666.html?spid=124953658,Giáo sư John Vũ,info book;124953658;62000 | Nhà Sách Trẻ Online;112322090;57500 | Times Books;113230425;57800 | VBooks;159974577;58100 | Nhà Sách Vĩnh Thụy;197643425;69000,Nhà Sách Tiki | Sách tiếng Việt | Sách kinh tế | Sách khởi nghiệp | Connection - Kết Nối (Lời Khuyên Sinh Viên Việt Nam - Tái Bản 2019),192
12081477,Combo Thành Công Theo Cách Khác (Bản Tiếng Việt + Tiếng Anh),3300,1552,194000,220000,220000,26000,12,0.0,0,0,,available,backorder,False,combo-thanh-cong-theo-cach-khac-ban-tieng-viet-tieng-anh-p12081477.html?spid=200924110,Nguyễn Hữu Phùng Nguyên | Nguyễn Ngọc Long | Nguyễn Thị Quỳnh Giang | Đinh Đức Hoàng,HỆ THỐNG NHÀ SÁCH ABC;200924110;194000 | Nhà Xuất Bản Phụ Nữ Việt Nam;243037655;60000,Nhà Sách Tiki | Sách tiếng Việt | Sách kinh tế | Sách khởi nghiệp | Combo Thành Công Theo Cách Khác (Bản Tiếng Việt + Tiếng Anh),
196202663,Business Coaching - Xây Dựng Đế Chế Kinh Doanh Từ Con Số 0,3300,297,263000,299000,299000,36000,12,0.0,0,0,2.0,available,backorder,False,business-coaching-xay-dung-de-che-kinh-doanh-tu-con-so-0-p196202663.html?spid=196578782,Jack Welch,info book;196578782;263000 | Nhà Sách Vĩnh Thụy;206722237;264000,Nhà Sách Tiki | Sách tiếng Việt | Sách kinh tế | Sách khởi nghiệp | Business Coaching - Xây Dựng Đế Chế Kinh Doanh Từ Con Số 0,406
7663055,"Combo Tối đa hóa năng lực bản thân, Sức mạnh của tập trung, Đánh Thức Con Người Phi Thường Trong Bạn, 15 Nguyên tắc vàng về phát triển bản thân",3300,1669,476000,541000,541000,65000,12,0.0,0,0,,available,backorder,False,combo-toi-da-hoa-nang-luc-ban-than-suc-manh-cua-tap-trung-danh-thuc-con-nguoi-phi-thuong-trong-ban-15-nguyen-tac-vang-ve-phat-trien-ban-than-p7663055.html?spid=76168001,Nhiều Tác Giả,info book;76168001;476000 | Times Books;71920800;450450,"Nhà Sách Tiki | Sách tiếng Việt | Sách kinh tế | Sách khởi nghiệp | Combo Tối đa hóa năng lực bản thân, Sức mạnh của tập trung, Đánh Thức Con Người Phi Thường Trong Bạn, 15 Nguyên tắc vàng về phát triển bản thân",
118419929,Sách - Không chịu nỗ lực đừng mơ trưởng thành - Booklife,3300,671,121431,121431,121431,0,0,0.0,0,0,,available,backorder,False,sach-khong-chiu-no-luc-dung-mo-truong-thanh-booklife-p118419929.html?spid=118419935,,Nhà Sách Trẻ Online;118419935;121431,Nhà Sách Tiki | Sách tiếng Việt | Sách kinh tế | Sách khởi nghiệp | Sách - Không chịu nỗ lực đừng mơ trưởng thành - Booklife,
202529504,Sách- Dạy Con Làm Giàu Tập 8 :(Để Có Những Đồng Tiền Tích Cực) - NXB Trẻ,3300,236,45000,45000,45000,0,0,0.0,0,0,,available,backorder,False,sach_day-con-lam-giau-tap-8-de-co-nhung-dong-tien-tich-cuc-p202529504.html?spid=202529514,,Nhà Sách Trẻ Online;202529514;45000,Nhà Sách Tiki | Sách tiếng Việt | Sách kinh tế | Sách khởi nghiệp | Sách- Dạy Con Làm Giàu Tập 8 :(Để Có Những Đồng Tiền Tích Cực) - NXB Trẻ,
248703902,Doanh Nghiệp Siêu Nhỏ (for Dummies),3300,88,219000,219000,219000,0,0,0.0,0,0,,available,backorder,False,doanh-nghiep-sieu-nho-for-dummies-p248703902.html?spid=252671835,,Nhà Sách Vĩnh Thụy;252671835;219000 | Nhà Sách Trẻ Online;248703903;168030,Nhà Sách Tiki | Sách tiếng Việt | Sách kinh tế | Sách khởi nghiệp | Doanh Nghiệp Siêu Nhỏ (for Dummies),
261799401,19 Kênh Thu Hút Khách Hàng Dành Cho Công Ty Khởi Nghiệp,3300,27,89200,89200,89200,0,0,0.0,0,0,,available,backorder,False,19-kenh-thu-hut-khach-hang-danh-cho-cong-ty-khoi-nghiep-p261799401.html?spid=261799402,,Times Books;261799402;89200,Nhà Sách Tiki | Sách tiếng Việt | Sách kinh tế | Sách khởi nghiệp | 19 Kênh Thu Hút Khách Hàng Dành Cho Công Ty Khởi Nghiệp,
249575662,Sách - Combo Tôi tài giỏi bạn cũng thế + Bí quyết gây dựng cơ nghiệp bạc tỷ,3300,80,235200,280000,280000,44800,16,0.0,0,0,,available,backorder,False,sach-combo-toi-tai-gioi-ban-cung-the-bi-quyet-gay-dung-co-nghiep-bac-ty-p249575662.html?spid=249575663,,Bảo Châu Books;249575663;235200,Nhà Sách Tiki | Sách tiếng Việt | Sách kinh tế | Sách khởi nghiệp | Sách - Combo Tôi tài giỏi bạn cũng thế + Bí quyết gây dựng cơ nghiệp bạc tỷ,456
161245760,Blockchain - Cơ Hội Hay Bong Bóng - Chiến Lược Ico Thành Công,3300,496,179000,219000,219000,40000,18,4.0,1,0,6.0,available,backorder,False,blockchain-co-hoi-hay-bong-bong-chien-luoc-ico-thanh-cong-p161245760.html?spid=161245761,,Nhà sách Fahasa;161245761;179000 | info book;208073930;219000,Nhà Sách Tiki | Sách tiếng Việt | Sách kinh tế | Sách khởi nghiệp | Blockchain - Cơ Hội Hay Bong Bóng - Chiến Lược Ico Thành Công,
26170140,Combo Sách Kinh Doanh Khởi Nghiệp: Khởi Nghiệp Táo Bạo + Khởi Nghiệp Thông Min,3300,1401,214200,306000,306000,91800,30,0.0,0,0,,available,backorder,False,combo-sach-kinh-doanh-khoi-nghiep-khoi-nghiep-tao-bao-khoi-nghiep-thong-min-p26170140.html?spid=98578732,,Omega Plus Books;98578732;214200 | Bamboo Books;179030030;244800,Nhà Sách Tiki | Sách tiếng Việt | Sách kinh tế | Sách khởi nghiệp | Combo Sách Kinh Doanh Khởi Nghiệp: Khởi Nghiệp Táo Bạo + Khởi Nghiệp Thông Min,
217418684,Dạy Con Làm Giàu ( Tập 10 ) - Trước Khi Bạn Thôi Việc,3300,132,90000,90000,90000,0,0,0.0,0,0,,available,backorder,False,day-con-lam-giau-tap-10-truoc-khi-ban-thoi-viec-p217418684.html?spid=217418686, Robert T. Kiyosaki,Nemobook;217418686;90000,Nhà Sách Tiki | Sách tiếng Việt | Sách kinh tế | Sách khởi nghiệp | Dạy Con Làm Giàu ( Tập 10 ) - Trước Khi Bạn Thôi Việc,316
186693316,Sách Bí Mật Tiền Bạc Của Giới Siêu Giàu - Lằn Ranh Mong Manh Giữa Giàu Và Siêu Giàu,3300,365,96000,108000,108000,12000,11,5.0,1,0,1.0,available,backorder,False,sach-bi-mat-tien-bac-cua-gioi-sieu-giau-lan-ranh-mong-manh-giua-giau-va-sieu-giau-p186693316.html?spid=186693317,,Nhà Sách Thành An;186693317;96000,Nhà Sách Tiki | Sách tiếng Việt | Sách kinh tế | Sách khởi nghiệp | Sách Bí Mật Tiền Bạc Của Giới Siêu Giàu - Lằn Ranh Mong Manh Giữa Giàu Và Siêu Giàu,270
199647346,Từ Tay Trắng Đến Tỷ Đô,3300,257,86100,86100,86100,0,0,0.0,0,0,,available,backorder,False,tu-tay-trang-den-ty-do-p199647346.html?spid=200833245,Andres Pira,VIETNAMBOOK;200833245;86100 | Nhà Sách Thành An;199647347;93000,Nhà Sách Tiki | Sách tiếng Việt | Sách kinh tế | Sách khởi nghiệp | Từ Tay Trắng Đến Tỷ Đô,272
248703896,Doanh Nghiệp Siêu Nhỏ (for Dummies),3300,88,219000,219000,219000,0,0,0.0,0,0,,available,backorder,False,doanh-nghiep-sieu-nho-for-dummies-p248703896.html?spid=252671834,,Nhà Sách Vĩnh Thụy;252671834;219000 | Nhà Sách Trẻ Online;248703897;168030,Nhà Sách Tiki | Sách tiếng Việt | Sách kinh tế | Sách khởi nghiệp | Doanh Nghiệp Siêu Nhỏ (for Dummies),
202529695,Sách_Dạy Con Làm Giàu Tập 9(Những Bí Mật Về Tiền Bạc Mà Bạn Không Học Ở Nhà Trường),3300,236,40000,40000,40000,0,0,0.0,0,0,,available,backorder,False,sach_day-con-lam-giau-tap-9-nhung-bi-mat-ve-tien-bac-ma-ban-khong-hoc-o-nha-truong-p202529695.html?spid=207901326,,Hiệu Sách Tự Do;207901326;40000,Nhà Sách Tiki | Sách tiếng Việt | Sách kinh tế | Sách khởi nghiệp | Sách_Dạy Con Làm Giàu Tập 9(Những Bí Mật Về Tiền Bạc Mà Bạn Không Học Ở Nhà Trường),
191265218,Doanh Nghiệp Nho Nhỏ Món Hời To To,3300,340,73100,86000,86000,12900,15,0.0,0,0,1.0,available,backorder,False,doanh-nghiep-nho-nho-mon-hoi-to-to-p191265218.html?spid=191265219,Kantana,Bảo Châu Books;191265219;73100,Nhà Sách Tiki | Sách tiếng Việt | Sách kinh tế | Sách khởi nghiệp | Doanh Nghiệp Nho Nhỏ Món Hời To To,216
38290597,Đến Starbucks Mua Cà Phê Cốc Lớn (Tái Bản) - Cuốn Sách Dành Cho Những Con Buôn Tặng BookMark Romantic,3300,1327,116000,116000,116000,0,0,0.0,0,0,,available,backorder,False,den-starbucks-mua-ca-phe-coc-lon-tai-ban-cuon-sach-danh-cho-nhung-con-buon-tang-bookmark-romantic-p38290597.html?spid=117028384,Yoshimoto Yoshio,Nhà Sách Vĩnh Thụy;117028384;116000 | Times Books;55726592;103404 | HỆ THỐNG NHÀ SÁCH ABC;192297154;131000 | info book;194811652;131000,Nhà Sách Tiki | Sách tiếng Việt | Sách kinh tế | Sách khởi nghiệp | Đến Starbucks Mua Cà Phê Cốc Lớn (Tái Bản) - Cuốn Sách Dành Cho Những Con Buôn Tặng BookMark Romantic,128
163566588,"Dám thất bại - Những nỗ lực ""không thành công"" của bạn đáng giá bao nhiêu? - Sách hay mỗi ngày ",3300,485,119000,135000,135000,16000,12,0.0,0,0,,available,backorder,False,dam-that-bai-nhung-no-luc-khong-thanh-cong-cua-ban-dang-gia-bao-nhieu-sach-hay-moi-ngay-p163566588.html?spid=203015133,,HỆ THỐNG NHÀ SÁCH ABC;203015133;119000 | MCBooks Hạnh Phúc;163566589;87750 | Nhà Sách Vĩnh Thụy;203085198;119000,"Nhà Sách Tiki | Sách tiếng Việt | Sách kinh tế | Sách khởi nghiệp | Dám thất bại - Những nỗ lực ""không thành công"" của bạn đáng giá bao nhiêu? - Sách hay mỗi ngày ",
11423569,Combo  Cú Hích + Bí Mật Tư Duy Triệu Phú,3300,1564,197200,232000,232000,34800,15,0.0,0,0,,available,backorder,False,combo-cu-hich-bi-mat-tu-duy-trieu-phu-p11423569.html?spid=197498171,.,Bamboo Books;197498171;197200 | NhatPham0356;12103584;207000 | Nhà Sách Vĩnh Thụy;68370544;204000 | Tiệm Sách Hoa Hồng;72709403;194880 | VBooks;159390851;194880 | info book;200006838;212000,Nhà Sách Tiki | Sách tiếng Việt | Sách kinh tế | Sách khởi nghiệp | Combo  Cú Hích + Bí Mật Tư Duy Triệu Phú,596
119064759,Quốc Gia Khởi Nghiệp ( Tái Bản ),3300,669,146000,209000,209000,63000,30,0.0,0,0,,available,backorder,False,quoc-gia-khoi-nghiep-tai-ban-p119064759.html?spid=213740946,"Dan Senor, Saul Singer ",Alpha Books Official;213740946;146000 | HỆ THỐNG NHÀ SÁCH ABC;192665876;184000 | Trạm đọc;249851183;145464 | Sống Official;262688419;146000,Nhà Sách Tiki | Sách tiếng Việt | Sách kinh tế | Sách khởi nghiệp | Quốc Gia Khởi Nghiệp ( Tái Bản ),506
210760868,Dạy Con Quản Lý Tài Chính Cá Nhân,3300,183,135200,169000,169000,33800,20,0.0,0,0,,available,backorder,False,day-con-quan-ly-tai-chinh-ca-nhan-p210760868.html?spid=210760869,Will Rainey,Nhà sách Fahasa;210760869;135200 | Minhhabooks;212299815;134000 | Nhà Sách Vĩnh Thụy;216280752;149000 | Tiệm sách Minh Hằng;221775705;134000 | HỆ THỐNG NHÀ SÁCH ABC;253346992;149000,Nhà Sách Tiki | Sách tiếng Việt | Sách kinh tế | Sách khởi nghiệp | Dạy Con Quản Lý Tài Chính Cá Nhân,
14168900,10 Lời Khuyên Khởi Nghiệp (Tái Bản 2019),3300,1525,79200,99000,99000,19800,20,5.0,1,0,5.0,available,backorder,False,10-loi-khuyen-khoi-nghiep-tai-ban-2019-p14168900.html?spid=22651841,Caspian Woods,Nhà sách Fahasa;22651841;79200 | Times Books;55550043;59200 | Sống Official;72032356;69300 | ETS Books;73220182;69300 | info book;76128672;87000 | Trạm đọc;126306362;68903 | VBooks;163281527;59400 | Bamboo Books;177915434;89100 | HỆ THỐNG NHÀ SÁCH ABC;195516037;87000,Nhà Sách Tiki | Sách tiếng Việt | Sách kinh tế | Sách khởi nghiệp | 10 Lời Khuyên Khởi Nghiệp (Tái Bản 2019),256
193524643,Sách:Những Bậc Thầy Đổi Mới,3300,320,139000,158000,158000,19000,12,0.0,0,0,,available,backorder,False,sach-nhung-bac-thay-doi-moi-p193524643.html?spid=195573721,,info book;195573721;139000 | HỆ THỐNG NHÀ SÁCH ABC;195872432;139000 | Bamboo Books;196368844;142200 | Nhà Sách Vĩnh Thụy;199647386;139000,Nhà Sách Tiki | Sách tiếng Việt | Sách kinh tế | Sách khởi nghiệp | Sách:Những Bậc Thầy Đổi Mới,
104267936,"Sách - Lãnh Đạo, Phục Tùng Hoặc Cuốn Xéo ",3300,736,126650,149000,149000,22350,15,0.0,0,0,,available,backorder,False,sach-lanh-dao-phuc-tung-hoac-cuon-xeo-p104267936.html?spid=258929184,Jocko Willink,FishingBook;258929184;126650 | Times Books;104267940;89200 | info book;119083974;131000 | Nhà Sách Trẻ Online;260806704;88900 | Tiệm Sách Hoa Hồng;260806705;89400 | VBooks;260806707;89400,"Nhà Sách Tiki | Sách tiếng Việt | Sách kinh tế | Sách khởi nghiệp | Sách - Lãnh Đạo, Phục Tùng Hoặc Cuốn Xéo ",304
178057402,Triệu Phú Khu Ổ Chuột,3300,412,111000,126000,126000,15000,12,0.0,0,0,,available,backorder,False,trieu-phu-khu-o-chuot-p178057402.html?spid=190552586,Vikas Swarup,info book;190552586;111000 | Bamboo Books;185996781;113400 | Tiệm Sách Hoa Hồng;190304976;103320 | HỆ THỐNG NHÀ SÁCH ABC;195902210;111000,Nhà Sách Tiki | Sách tiếng Việt | Sách kinh tế | Sách khởi nghiệp | Triệu Phú Khu Ổ Chuột,446
141315591,Thay Đổi Hay Là Chết - Bí Quyết Giúp Các Thương Hiệu Huyền Thoai Luôn Dẫn Đầu,3300,579,148000,168000,168000,20000,12,0.0,0,0,,available,backorder,False,thay-doi-hay-la-chet-bi-quyet-giup-cac-thuong-hieu-huyen-thoai-luon-dan-dau-p141315591.html?spid=208136919,Jason Jennings,HỆ THỐNG NHÀ SÁCH ABC;208136919;148000 | trungthanh2018;144507304;107520 | Hiệu Sách Tự Do;212237392;159000,Nhà Sách Tiki | Sách tiếng Việt | Sách kinh tế | Sách khởi nghiệp | Thay Đổi Hay Là Chết - Bí Quyết Giúp Các Thương Hiệu Huyền Thoai Luôn Dẫn Đầu,348
192705082,Sách: Ba Bước Đến Vàng - Biến Trở Ngại Thành Cơ Hội,3300,327,110200,110200,110200,0,0,0.0,0,0,4.0,available,backorder,False,sach-ba-buoc-den-vang-bien-tro-ngai-thanh-co-hoi-p192705082.html?spid=192705083,,Tiệm Sách Hoa Hồng;192705083;110200 | Minhhabooks;197624397;114000,Nhà Sách Tiki | Sách tiếng Việt | Sách kinh tế | Sách khởi nghiệp | Sách: Ba Bước Đến Vàng - Biến Trở Ngại Thành Cơ Hội,
52616196,"Bộ sách 3 cuốn: Soup công thức nuôi dưỡng và xây dựng văn hóa đội ngũ cho bạn, 10 suy nghĩ không bằng 1 hành động, Doanh nhân khởi nghiệp tinh gọn",3300,1162,287250,287250,287250,0,0,0.0,0,0,3.0,available,backorder,False,bo-sach-3-cuon-soup-cong-thuc-nuoi-duong-va-xay-dung-van-hoa-doi-ngu-cho-ban-10-suy-nghi-khong-bang-1-hanh-dong-doanh-nhan-khoi-nghiep-tinh-gon-p52616196.html?spid=52616197, Nhiều Tác Giả,Pandabooks Hiệu Sách;52616197;287250,"Nhà Sách Tiki | Sách tiếng Việt | Sách kinh tế | Sách khởi nghiệp | Bộ sách 3 cuốn: Soup công thức nuôi dưỡng và xây dựng văn hóa đội ngũ cho bạn, 10 suy nghĩ không bằng 1 hành động, Doanh nhân khởi nghiệp tinh gọn",
177890965,Bí Mật Tư Duy Triệu Phú - Sức Mạnh Niềm Tin Combo 2 Cuốn,3300,411,166600,196000,196000,29400,15,4.0,1,0,6.0,available,backorder,False,bi-mat-tu-duy-trieu-phu-suc-manh-niem-tin-combo-2-cuon-p177890965.html?spid=177890966,Claude M Bristol |  T Harv Eker,NHASACHTRITUE;177890966;166600,Nhà Sách Tiki | Sách tiếng Việt | Sách kinh tế | Sách khởi nghiệp | Bí Mật Tư Duy Triệu Phú - Sức Mạnh Niềm Tin Combo 2 Cuốn,
198517090,Xây Dựng Sự Độc Đáo - Cách Để Khởi Nghiệp Từ Đam Mê,3300,269,66000,66000,66000,0,0,0.0,0,0,,available,backorder,False,xay-dung-su-doc-dao-cach-de-khoi-nghiep-tu-dam-me-p198517090.html?spid=200851785,Riccardo Pozzoll,MHbooks;200851785;66000 | Trao Tri thức Gặt Niềm tin;202526500;67200 | Times Books;262724413;67200 | Tiệm Sách Hoa Hồng;262724414;67200 | VBooks;262724415;67200,Nhà Sách Tiki | Sách tiếng Việt | Sách kinh tế | Sách khởi nghiệp | Xây Dựng Sự Độc Đáo - Cách Để Khởi Nghiệp Từ Đam Mê,232
486949,Doanh Nghiệp Nhỏ Ý Tưởng Lớn (Tái Bản 2016),3300,2174,60000,68000,68000,8000,12,5.0,1,0,9.0,available,backorder,False,doanh-nghiep-nho-y-tuong-lon-tai-ban-2016-p486949.html?spid=147337334,Cynthia Kay,Nhân Văn;147337334;60000,Nhà Sách Tiki | Sách tiếng Việt | Sách kinh tế | Sách khởi nghiệp | Doanh Nghiệp Nhỏ Ý Tưởng Lớn (Tái Bản 2016),206
369249,36 Lời Khuyên Dành Cho Người Khởi Nghiệp,3300,2305,151050,151050,151050,0,0,0.0,0,0,,available,backorder,False,36-loi-khuyen-danh-cho-nguoi-khoi-nghiep-p369249.html?spid=214599037,Tôn Đào Nhiên,Hiệu Sách Tự Do;214599037;151050,Nhà Sách Tiki | Sách tiếng Việt | Sách kinh tế | Sách khởi nghiệp | 36 Lời Khuyên Dành Cho Người Khởi Nghiệp,420
127033283,Sách-Không Đến Một (NXB Trẻ),3300,624,99000,110000,110000,11000,10,0.0,0,0,1.0,available,backorder,False,sach-khong-den-mot-nxb-tre-p127033283.html?spid=193859675,,Bamboo Books;193859675;99000 | Times Books;127033295;93200 | Hiệu Sách Tự Do;207723976;98000 | FishingBook;253119467;99000,Nhà Sách Tiki | Sách tiếng Việt | Sách kinh tế | Sách khởi nghiệp | Sách-Không Đến Một (NXB Trẻ),
171584528,Startup Trong Thời Kỳ Bình Thường Mới,3300,454,87000,100000,100000,13000,13,0.0,0,0,,available,backorder,False,startup-trong-thoi-ky-binh-thuong-moi-p171584528.html?spid=171584529,Lý Quí Trung,Nhà sách Fahasa;171584529;87000 | Bamboo Books;196685247;95000 | FishingBook;253114195;90000,Nhà Sách Tiki | Sách tiếng Việt | Sách kinh tế | Sách khởi nghiệp | Startup Trong Thời Kỳ Bình Thường Mới,
202604361, Combo Cà Phê Cùng Tony Và Trên Đường Băng ( Tony Buổi Sáng ) - NXB Trẻ,3300,237,186825,186825,186825,0,0,0.0,0,0,,available,backorder,False,sach-combo-ca-phe-cung-tony-va-tren-duong-bang-p202604361.html?spid=202604363,,Nhà Sách Trẻ Online;202604363;186825,Nhà Sách Tiki | Sách tiếng Việt | Sách kinh tế | Sách khởi nghiệp |  Combo Cà Phê Cùng Tony Và Trên Đường Băng ( Tony Buổi Sáng ) - NXB Trẻ,
208137721,Ineternet Vạn Vật (IoT) - Chuyển Đổi Số Hay Là Chết,3300,196,198000,198000,198000,0,0,0.0,0,0,,available,backorder,False,ineternet-van-vat-iot-chuyen-doi-so-hay-la-chet-p208137721.html?spid=208137722,,Nhà Sách Pháp Luật;208137722;198000,Nhà Sách Tiki | Sách tiếng Việt | Sách kinh tế | Sách khởi nghiệp | Ineternet Vạn Vật (IoT) - Chuyển Đổi Số Hay Là Chết,312
262392136,Sách - Combo 2 Tác Phẩm Của Mike Michalowicz:  Kế Hoạch Bí Ngô + Khởi Nghiệp Từ Khốn Khó - Alphabooks,3300,21,214400,268000,268000,53600,20,0.0,0,0,,available,backorder,False,sach-combo-2-tac-pham-cua-mike-michalowicz-ke-hoach-bi-ngo-khoi-nghiep-tu-khon-kho-alphabooks-p262392136.html?spid=262392137, Mike Michalowicz | Mike Michalowicz,Bamboo Books;262392137;214400,Nhà Sách Tiki | Sách tiếng Việt | Sách kinh tế | Sách khởi nghiệp | Sách - Combo 2 Tác Phẩm Của Mike Michalowicz:  Kế Hoạch Bí Ngô + Khởi Nghiệp Từ Khốn Khó - Alphabooks,560
247678556,Kinh thánh cho người tìm việc ,3300,97,55100,58000,58000,2900,5,0.0,0,0,1.0,available,backorder,False,kinh-thanh-cho-nguoi-tim-viec-cay-du-cua-ban-mau-gi-p247678556.html?spid=247678557,,Nhà Sách Minh Đức;247678557;55100,Nhà Sách Tiki | Sách tiếng Việt | Sách kinh tế | Sách khởi nghiệp | Kinh thánh cho người tìm việc ,304
260806322,Khởi Nghiệp Từ Khốn Khó,3300,29,101150,119000,119000,17850,15,0.0,0,0,,available,backorder,False,khoi-nghiep-tu-khon-kho-p260806322.html?spid=260921854,,FishingBook;260921854;101150 | Times Books;260806323;71200,Nhà Sách Tiki | Sách tiếng Việt | Sách kinh tế | Sách khởi nghiệp | Khởi Nghiệp Từ Khốn Khó,
260806326,Khởi Nghiệp Từ Khốn Khó,3300,29,101150,119000,119000,17850,15,0.0,0,0,,available,backorder,False,khoi-nghiep-tu-khon-kho-p260806326.html?spid=260921863,,FishingBook;260921863;101150 | VBooks;260806327;71400,Nhà Sách Tiki | Sách tiếng Việt | Sách kinh tế | Sách khởi nghiệp | Khởi Nghiệp Từ Khốn Khó,
262802218,Cuốn cẩm nang đỉnh cao dành cho những quý cô đầy khát vọng  : Quý Cô Khởi Nghiệp,3300,13,108060,108060,108060,0,0,0.0,0,0,,available,backorder,False,cuon-cam-nang-dinh-cao-danh-cho-nhung-quy-co-day-khat-vong-quy-co-khoi-nghiep-p262802218.html?spid=262802219,,Times Books;262802219;108060,Nhà Sách Tiki | Sách tiếng Việt | Sách kinh tế | Sách khởi nghiệp | Cuốn cẩm nang đỉnh cao dành cho những quý cô đầy khát vọng  : Quý Cô Khởi Nghiệp,
15000365,Combo 2 Cuốn: Cú Hích + Khởi Hành (Tái Bản) ,3300,1508,163200,192000,192000,28800,15,0.0,0,0,,available,backorder,False,combo-cu-hich-khoi-hanh-p15000365.html?spid=197412138,Richard H. Thaler | Cass R. Sunstein | Gs. John Vũ,Bamboo Books;197412138;163200 | Nhà Sách Vĩnh Thụy;71082521;181000 | First News;111000694;192000,Nhà Sách Tiki | Sách tiếng Việt | Sách kinh tế | Sách khởi nghiệp | Combo 2 Cuốn: Cú Hích + Khởi Hành (Tái Bản) ,
259483366,Sách - Bí Mật Tiền Bạc Của Giới Siêu Giàu - Lằn Ranh Mong Manh Giữa Giàu Và Siêu Giàu,3300,32,102600,108000,108000,5400,5,0.0,0,0,,available,backorder,False,sach-bi-mat-tien-bac-cua-gioi-sieu-giau-lan-ranh-mong-manh-giua-giau-va-sieu-giau-p259483366.html?spid=259483367,Paul Sullivan,Nhà sách Anh Thành;259483367;102600,Nhà Sách Tiki | Sách tiếng Việt | Sách kinh tế | Sách khởi nghiệp | Sách - Bí Mật Tiền Bạc Của Giới Siêu Giàu - Lằn Ranh Mong Manh Giữa Giàu Và Siêu Giàu,270
