id,name,data_version,day_ago_created ,price,list_price,original_price,discount,discount_rate,rating_average,review_count,favourite_count,all_time_quantity_sold,inventory_status,inventory_type,has_ebook ,url_path,authors,seller_name;spid;price,breadcrumbs,number_of_page
215544789,Tự Truyện Ken Langone: Từ Số 0 Đến Tỷ Phú - Câu chuyện về một người dám mơ lớn và kiên trì theo đuổi đến cùng ước mơ,3300,153,150000,170000,170000,20000,12,0.0,0,0,,available,backorder,False,tu-truyen-ken-langone-tu-so-0-den-ty-phu-cau-chuyen-ve-mot-nguoi-dam-mo-lon-va-kien-tri-theo-duoi-den-cung-uoc-mo-p215544789.html?spid=247539927,,HỆ THỐNG NHÀ SÁCH ABC;247539927;150000 | Times Books;215544790;84500 | Nhà Sách Trẻ Online;253240667;84000 | Tiệm Sách Hoa Hồng;253240668;85000,Nhà Sách Tiki | Sách tiếng Việt | Sách kinh tế | Sách khởi nghiệp | Tự Truyện Ken Langone: Từ Số 0 Đến Tỷ Phú - Câu chuyện về một người dám mơ lớn và kiên trì theo đuổi đến cùng ước mơ,
77222275,Sách - Bạn sẽ làm gì... Giúp em giải quyết 44 tình huống khó xử thường gặp (tặng kèm bookmark thiết kế),3300,801,87000,99000,99000,12000,12,0.0,0,0,,available,backorder,False,sach-ban-se-lam-gi-giup-em-giai-quyet-44-tinh-huong-kho-xu-thuong-gap-tang-kem-bookmark-thiet-ke-p77222275.html?spid=180607430,Nhiều Tác Giả,info book;180607430;87000 | Nhà Sách Trẻ Online;77222279;80580 | VBooks;191045004;81180,Nhà Sách Tiki | Sách tiếng Việt | Sách kinh tế | Sách khởi nghiệp | Sách - Bạn sẽ làm gì... Giúp em giải quyết 44 tình huống khó xử thường gặp (tặng kèm bookmark thiết kế),
36700833,Đến Starbucks Mua Cà Phê Cốc Lớn (Tái Bản) - Cuốn Sách Dành Cho Những Con Buôn (Quà Tặng Tickbook),3300,1342,116000,116000,116000,0,0,0.0,0,0,,available,backorder,False,den-starbucks-mua-ca-phe-coc-lon-tai-ban-cuon-sach-danh-cho-nhung-con-buon-qua-tang-tickbook-p36700833.html?spid=117028361,Yoshimoto Yoshio,Nhà Sách Vĩnh Thụy;117028361;116000 | Times Books;55726589;103404 | Nhà Sách Lifebooks;146214613;149000 | HỆ THỐNG NHÀ SÁCH ABC;192297147;131000 | info book;194811615;131000,Nhà Sách Tiki | Sách tiếng Việt | Sách kinh tế | Sách khởi nghiệp | Đến Starbucks Mua Cà Phê Cốc Lớn (Tái Bản) - Cuốn Sách Dành Cho Những Con Buôn (Quà Tặng Tickbook),128
185966418,"BÌA CỨNG - [15 năm Thaihabooks] THINK AND GROW RICH - 13 nguyên tắc nghĩ giàu, làm giàu – Napoleon Hill",3300,372,140000,159000,159000,19000,12,0.0,0,0,,available,backorder,False,bia-cung-15-nam-thaihabooks-think-and-grow-rich-13-nguyen-tac-nghi-giau-lam-giau-napoleon-hill-p185966418.html?spid=210129291, Napoleon Hill,Nhà Sách Vĩnh Thụy;210129291;140000 | BÌNH BÁN BOOK;185966419;138000 | Phương Đông Books;188378135;145500 | Muki;196425412;159000,"Nhà Sách Tiki | Sách tiếng Việt | Sách kinh tế | Sách khởi nghiệp | BÌA CỨNG - [15 năm Thaihabooks] THINK AND GROW RICH - 13 nguyên tắc nghĩ giàu, làm giàu – Napoleon Hill",398
168900778,Lột Được Vỏ Chanh Mở Được Tiệm Nail,3300,466,119200,149000,149000,29800,20,5.0,1,0,10.0,available,backorder,False,lot-duoc-vo-chanh-mo-duoc-tiem-nail-p168900778.html?spid=168900779,,Nhà sách Fahasa;168900779;119200,Nhà Sách Tiki | Sách tiếng Việt | Sách kinh tế | Sách khởi nghiệp | Lột Được Vỏ Chanh Mở Được Tiệm Nail,
202964100,Khởi Nghiệp Tinh Gọn,3300,236,194000,220000,220000,26000,12,0.0,0,0,,available,backorder,False,khoi-nghiep-tinh-gon-p202964100.html?spid=205319003,John Mullins,HỆ THỐNG NHÀ SÁCH ABC;205319003;194000 | Nhà Sách Thành An;202964101;195000,Nhà Sách Tiki | Sách tiếng Việt | Sách kinh tế | Sách khởi nghiệp | Khởi Nghiệp Tinh Gọn,444
181799162,Kinh Điển Về Khởi Nghiệp - 24 Bước Khởi Sự Kinh Doanh Thành Công,3300,396,330000,375000,375000,45000,12,0.0,0,0,,available,backorder,False,kinh-dien-ve-khoi-nghiep-24-buoc-khoi-su-kinh-doanh-thanh-cong-p181799162.html?spid=196234059,Bill Aulet,HỆ THỐNG NHÀ SÁCH ABC;196234059;330000,Nhà Sách Tiki | Sách tiếng Việt | Sách kinh tế | Sách khởi nghiệp | Kinh Điển Về Khởi Nghiệp - 24 Bước Khởi Sự Kinh Doanh Thành Công,367
43950751,14 Bài Học Khởi Nghiệp Jack Ma Dành Tặng Các Bạn Trẻ: Ở Đâu Có Phàn Nàn Ở Đó Có Cơ Hội,3300,1293,178450,215000,215000,36550,17,4.5,8,0,31.0,available,backorder,False,14-bai-hoc-khoi-nghiep-jack-ma-danh-tang-cac-ban-tre-o-dau-co-phan-nan-o-do-co-co-hoi-p43950751.html?spid=44858827,Lý Gia,Nhà sách Fahasa;44858827;178450 | AHABOOKS;44866293;153002 | Phương Đông Books;44887523;172001 | tientien1912;74912146;154800 | Trao Tri thức Gặt Niềm tin;151712973;154800 | Nhà Sách Vĩnh Thụy;173696996;189000 | info book;173884888;189000 | MCB Chumsachhoitu;187590798;215000,Nhà Sách Tiki | Sách tiếng Việt | Sách kinh tế | Sách khởi nghiệp | 14 Bài Học Khởi Nghiệp Jack Ma Dành Tặng Các Bạn Trẻ: Ở Đâu Có Phàn Nàn Ở Đó Có Cơ Hội,567
262688574,Khởi Sự Kinh Doanh,3300,17,150000,150000,150000,0,0,0.0,0,0,1.0,available,backorder,False,khoi-su-kinh-doanh-p262688574.html?spid=262688575,,SACH32;262688575;150000,Nhà Sách Tiki | Sách tiếng Việt | Sách kinh tế | Sách khởi nghiệp | Khởi Sự Kinh Doanh,
252043598,Box Set Dạy Con Làm Giàu - Trọn Bộ 13 Cuốn - Tái Bản 2022,3300,66,983000,1480000,1480000,497000,34,0.0,0,0,,available,backorder,False,box-set-day-con-lam-giau-tron-bo-13-cuon-tai-ban-2022-p252043598.html?spid=252043599,,Nhân Văn;252043599;983000,Nhà Sách Tiki | Sách tiếng Việt | Sách kinh tế | Sách khởi nghiệp | Box Set Dạy Con Làm Giàu - Trọn Bộ 13 Cuốn - Tái Bản 2022,
48202144,Để Chú Voi Cất Cánh - Quy Trình Đổi Mới Sáng Tạo Căn Bản,3300,1232,139000,139000,139000,0,0,0.0,0,0,,available,backorder,False,de-chu-voi-cat-canh-quy-trinh-doi-moi-sang-tao-can-ban-p48202144.html?spid=115226457,,Minhhabooks;115226457;139000 | Tazano Official Store;48202145;140000 | MHbooks;121153863;149000 | Tân Việt;124276889;175000,Nhà Sách Tiki | Sách tiếng Việt | Sách kinh tế | Sách khởi nghiệp | Để Chú Voi Cất Cánh - Quy Trình Đổi Mới Sáng Tạo Căn Bản,445
32412536,Combo Kỹ Năng Xây Dựng Đội Nhóm Mạnh : Đội Nhóm Bất Khả Chiến Đại - Thành Công Từ Kỷ Luật Đến Trách Nhiệm + 100 Phương Động Lực Cho Đội Nhóm Chiến Thắng ( Tặng Kèm Bookmark Thiết Kế ) ,3300,1372,279000,317000,317000,38000,12,0.0,0,0,,available,backorder,False,combo-ky-nang-xay-dung-doi-nhom-manh-doi-nhom-bat-kha-chien-dai-thanh-cong-tu-ky-luat-den-trach-nhiem-100-phuong-dong-luc-cho-doi-nhom-chien-thang-tang-kem-bookmark-thiet-ke-p32412536.html?spid=203468707,Nhiều Tác Giả,Nhà Sách Vĩnh Thụy;203468707;279000 | AHABOOKS;32412537;228243,Nhà Sách Tiki | Sách tiếng Việt | Sách kinh tế | Sách khởi nghiệp | Combo Kỹ Năng Xây Dựng Đội Nhóm Mạnh : Đội Nhóm Bất Khả Chiến Đại - Thành Công Từ Kỷ Luật Đến Trách Nhiệm + 100 Phương Động Lực Cho Đội Nhóm Chiến Thắng ( Tặng Kèm Bookmark Thiết Kế ) ,436
252079153,Sách - Phục Hình Răng Cố Định Dùng cho Sinh viên Răng Hàm Mặt (KL),3300,55,140000,140000,140000,0,0,0.0,0,0,1.0,available,backorder,False,sach-phuc-hinh-rang-co-dinh-dung-cho-sinh-vien-rang-ham-mat-kl-p252079153.html?spid=252079154,,huongbooks;252079154;140000,Nhà Sách Tiki | Sách tiếng Việt | Sách kinh tế | Sách khởi nghiệp | Sách - Phục Hình Răng Cố Định Dùng cho Sinh viên Răng Hàm Mặt (KL),
118582618,Sách - Kinh Doanh Nhỏ Thu Lợi Lớn - Công Thức Thành Công Của Những Triệu Phú Thầm Lặng,3300,671,70000,79000,79000,9000,11,0.0,0,0,2.0,available,backorder,False,sach-kinh-doanh-nho-thu-loi-lon-cong-thuc-thanh-cong-cua-nhung-trieu-phu-tham-lang-p118582618.html?spid=121604853,,info book;121604853;70000 | Nhà Sách Trẻ Online;118582619;68700 | Nhà Sách Vĩnh Thụy;176941726;78000 | Bamboo Books;177914650;80100 | HỆ THỐNG NHÀ SÁCH ABC;192293168;78000 | Zing Books;200762244;99000 | Tiệm Sách Hoa Hồng;261973916;69300 | VBooks;261973917;69300 | FishingBook;262699683;89100,Nhà Sách Tiki | Sách tiếng Việt | Sách kinh tế | Sách khởi nghiệp | Sách - Kinh Doanh Nhỏ Thu Lợi Lớn - Công Thức Thành Công Của Những Triệu Phú Thầm Lặng,
149653467,"Lột được vỏ chanh, mở được tiệm nail - 17 câu chuyện giúp bạn mở và vận hành tiệm nail thành công. ",3300,552,126650,149000,149000,22350,15,1.0,1,0,14.0,available,instock,False,lot-duoc-vo-chanh-mo-duoc-tiem-nail-17-cau-chuyen-giup-ban-mo-va-van-hanh-tiem-nail-thanh-cong-p149653467.html?spid=149653468,,Du Bút;149653468;126650,"Nhà Sách Tiki | Sách tiếng Việt | Sách kinh tế | Sách khởi nghiệp | Lột được vỏ chanh, mở được tiệm nail - 17 câu chuyện giúp bạn mở và vận hành tiệm nail thành công. ",136
257859359,"60 Giây ""Vàng"" Trong Bán Hàng",3300,34,139440,168000,168000,28560,17,0.0,0,0,,available,backorder,False,60-giay-vang-trong-ban-hang-p257859359.html?spid=257859360,,Taurus 1987;257859360;139440,"Nhà Sách Tiki | Sách tiếng Việt | Sách kinh tế | Sách khởi nghiệp | 60 Giây ""Vàng"" Trong Bán Hàng",416
248800950,Sách - Trước Bình Minh Luôn Là Đêm Tối - Tạ Minh Tuấn - Alphabooks - Tặng Kèm Bookmark Bamboo Books,3300,87,143200,179000,179000,35800,20,5.0,2,0,4.0,available,backorder,False,sach-truoc-binh-minh-luon-la-dem-toi-ta-minh-tuan-alphabooks-tang-kem-bookmark-bamboo-books-p248800950.html?spid=248800951,Tạ Minh Tuấn,Bamboo Books;248800951;143200,Nhà Sách Tiki | Sách tiếng Việt | Sách kinh tế | Sách khởi nghiệp | Sách - Trước Bình Minh Luôn Là Đêm Tối - Tạ Minh Tuấn - Alphabooks - Tặng Kèm Bookmark Bamboo Books,380
207829155,Hướng Dẫn Khởi Nghiệp Với Nghề Luật Sư ,3300,201,440000,490000,490000,50000,10,0.0,0,0,21.0,available,backorder,False,huong-dan-khoi-nghiep-voi-nghe-luat-su-p207829155.html?spid=207829156,Luật sư Nguyễn Hữu Phước,Luatvietbook;207829156;440000,Nhà Sách Tiki | Sách tiếng Việt | Sách kinh tế | Sách khởi nghiệp | Hướng Dẫn Khởi Nghiệp Với Nghề Luật Sư ,723
192349299,Sách - Vỡ Lòng Về Tiền Tệ - Money For Beginner,3300,329,132000,150000,150000,18000,12,0.0,0,0,,available,backorder,False,sach-vo-long-ve-tien-te-money-for-beginner-p192349299.html?spid=203597853,,HỆ THỐNG NHÀ SÁCH ABC;203597853;132000 | Phương Đông Books;192349300;135500 | SÁCH ĐẠI NAM;248521913;150000,Nhà Sách Tiki | Sách tiếng Việt | Sách kinh tế | Sách khởi nghiệp | Sách - Vỡ Lòng Về Tiền Tệ - Money For Beginner,
973536,Cuộc Chơi Khởi Nghiệp Phần 2,3300,2092,135200,169000,169000,33800,20,0.0,0,0,2.0,available,backorder,False,cuoc-choi-khoi-nghiep-phan-2-p973536.html?spid=20479475,Jeffrey Bussgang,Nhà sách Fahasa;20479475;135200 | Phương Đông Books;54621745;116179 | Times Books;55835465;101200 | Alpha Books Official;59394129;118000 | Sống Official;68310348;118300 | Omega Plus Books;68985867;118300 | ETS Books;71084353;118300 | Nhà Sách Lifebooks;88936687;169000 | info book;119510725;149000 | VBooks;161524476;101400 | Bamboo Books;177915425;135200 | HỆ THỐNG NHÀ SÁCH ABC;207179651;149000 | Nhà Sách Vĩnh Thụy;207192525;149000,Nhà Sách Tiki | Sách tiếng Việt | Sách kinh tế | Sách khởi nghiệp | Cuộc Chơi Khởi Nghiệp Phần 2,302
181799374,Bài Học Từ Người Quét Rác,3300,396,105000,119000,119000,14000,12,0.0,0,0,,available,backorder,False,bai-hoc-tu-nguoi-quet-rac-p181799374.html?spid=195961849,Nguyễn Mạnh Hùng,info book;195961849;105000 | HỆ THỐNG NHÀ SÁCH ABC;196704362;105000 | Bamboo Books;218755111;107100,Nhà Sách Tiki | Sách tiếng Việt | Sách kinh tế | Sách khởi nghiệp | Bài Học Từ Người Quét Rác,338
199034288,"Công việc thành công - Cuộc đời như ý -  Tác giả Megan Hyatt Miller , Michael Hyatt",3300,263,97500,150000,150000,52500,35,0.0,0,0,2.0,available,backorder,False,cong-viec-thanh-cong-cuoc-doi-nhu-y-tac-gia-megan-hyatt-miller-michael-hyatt-p199034288.html?spid=199034289,Michael Hyatt | Megan Hyatt Miller,Saigon Books Official;199034289;97500 | Nhà sách Miền Đông;203923268;127500 | HỆ THỐNG NHÀ SÁCH ABC;205246366;132000 | info book;209299741;150000 | Nhà Sách Vĩnh Thụy;213723705;132000 | Times Books;215293765;122700 | Nhà Sách Trẻ Online;217771969;123000 | Bamboo Books;263066086;127500,"Nhà Sách Tiki | Sách tiếng Việt | Sách kinh tế | Sách khởi nghiệp | Công việc thành công - Cuộc đời như ý -  Tác giả Megan Hyatt Miller , Michael Hyatt",252
146262229,Sách - Tái khởi đời mới,3300,561,46000,115000,115000,69000,60,0.0,0,0,1.0,available,backorder,False,sach-tai-khoi-doi-moi-p146262229.html?spid=146262230,Scott Allan,Bách Việt Bookstore;146262230;46000 | Tiệm Sách Hoa Hồng;195510327;77050 | Times Books;215122920;76750,Nhà Sách Tiki | Sách tiếng Việt | Sách kinh tế | Sách khởi nghiệp | Sách - Tái khởi đời mới,292
206576724,Quý Cô Khởi Nghiệp,3300,210,114000,129000,129000,15000,12,0.0,0,0,,available,backorder,False,quy-co-khoi-nghiep-p206576724.html?spid=220874008,Angelica Malin,Nhà Sách Vĩnh Thụy;220874008;114000 | Times Books;206675421;108060 | Skybooks Official Store;207493411;103200 | Nhà Sách Trẻ Online;262802241;107760 | Tiệm Sách Hoa Hồng;262802242;108360 | VBooks;262802243;108360,Nhà Sách Tiki | Sách tiếng Việt | Sách kinh tế | Sách khởi nghiệp | Quý Cô Khởi Nghiệp,336
90523814,Thành Công Tức Thì - Tư Duy Tỷ Phú,3300,799,139300,199000,199000,59700,30,0.0,0,0,15.0,available,backorder,False,thanh-cong-tuc-thi-tu-duy-ty-phu-p90523814.html?spid=192451185,,Đồ chơi giáo dục thông minh;192451185;139300 | VBooks;161383445;138504 | info book;195183538;175000 | HỆ THỐNG NHÀ SÁCH ABC;204333627;175000,Nhà Sách Tiki | Sách tiếng Việt | Sách kinh tế | Sách khởi nghiệp | Thành Công Tức Thì - Tư Duy Tỷ Phú,248
59344690,Start-Up Theo Cách Của Bạn,3300,1040,137750,145000,145000,7250,5,5.0,1,0,6.0,available,backorder,False,start-up-theo-cach-cua-ban-p59344690.html?spid=67241870,Tom Hogan | Carol Broadbent,Nhà sách Fahasa;67241870;137750 | Tiki Trading;59344691;118000 | Nhà Sách Trẻ Online;82732671;118300 | Times Books;139349705;118600 | VBooks;140865742;118900 | Zing Books;170266831;145000 | Nhà Sách Vĩnh Thụy;199565338;128000 | HỆ THỐNG NHÀ SÁCH ABC;207933209;128000 | FishingBook;253268789;130500,Nhà Sách Tiki | Sách tiếng Việt | Sách kinh tế | Sách khởi nghiệp | Start-Up Theo Cách Của Bạn,408
692692,Bí Quyết Của Các Tỷ Phú Tư Thân Lập Nghiệp,3300,2190,105000,119000,119000,14000,12,0.0,0,0,2.0,available,backorder,False,bi-quyet-cua-cac-ty-phu-tu-than-lap-nghiep-p692692.html?spid=117354442,John Sviokla | Mitch Cohen,info book;117354442;105000 | HỆ THỐNG NHÀ SÁCH ABC;203973666;118000,Nhà Sách Tiki | Sách tiếng Việt | Sách kinh tế | Sách khởi nghiệp | Bí Quyết Của Các Tỷ Phú Tư Thân Lập Nghiệp,360
118694771,Bí Quyết Của Các Tỷ Phú Tự Thân Lập Nghiệp (Tái Bản ),3300,670,119000,119000,119000,0,0,0.0,0,0,4.0,available,backorder,False,bi-quyet-cua-cac-ty-phu-tu-than-lap-nghiep-tai-ban-p118694771.html?spid=215557976,"John Sviokla, Mitch Cohen",info book;215557976;119000 | HỆ THỐNG NHÀ SÁCH ABC;248891792;122000,Nhà Sách Tiki | Sách tiếng Việt | Sách kinh tế | Sách khởi nghiệp | Bí Quyết Của Các Tỷ Phú Tự Thân Lập Nghiệp (Tái Bản ),360
973538,Cuộc Chơi Khởi Nghiệp Phần 3,3300,2092,135200,169000,169000,33800,20,0.0,0,0,,available,backorder,False,cuoc-choi-khoi-nghiep-phan-3-p973538.html?spid=20479489,William H. Draper III,Nhà sách Fahasa;20479489;135200 | Times Books;55835462;101200 | Alpha Books Official;59394082;118000 | Sống Official;68309907;118300 | Omega Plus Books;68985869;118300 | ETS Books;71083423;118300 | Nhà Sách Lifebooks;88936680;169000 | info book;119510774;149000 | VBooks;161524484;101400 | Bamboo Books;177915427;135200 | HỆ THỐNG NHÀ SÁCH ABC;207181798;149000,Nhà Sách Tiki | Sách tiếng Việt | Sách kinh tế | Sách khởi nghiệp | Cuộc Chơi Khởi Nghiệp Phần 3,410
34751366,Combo Cuộc Chơi Khởi Nghiệp (Bộ 3 Cuốn),3300,1359,405600,507000,507000,101400,20,0.0,0,0,1.0,available,backorder,False,combo-cuoc-choi-khoi-nghiep-bo-3-cuon-p34751366.html?spid=34751367,Nhiều Tác Giả | Nhiều Tác Giả | Nhiều tác giả | Nhiều Tác Giả  | Nhiều Tác giả,Nhà sách Fahasa;34751367;405600 | Times Books;55835457;352572 | info book;119510752;479000 | Zing Books;200996291;507000 | Nhà Sách Vĩnh Thụy;207192574;446000,Nhà Sách Tiki | Sách tiếng Việt | Sách kinh tế | Sách khởi nghiệp | Combo Cuộc Chơi Khởi Nghiệp (Bộ 3 Cuốn),
196853350,Dẫn Đầu Hay Là Chết (Tái Bản 2022),3300,288,114000,129000,129000,15000,12,0.0,0,0,,available,backorder,False,dan-dau-hay-la-chet-tai-ban-2022-p196853350.html?spid=197739834,Grant Cardone,HỆ THỐNG NHÀ SÁCH ABC;197739834;114000 | info book;201114825;114000 | Nhà Sách Trẻ Online;253665532;88510 | Tiệm Sách Hoa Hồng;253665533;89010 | Times Books;261972525;88810 | VBooks;261972526;89010,Nhà Sách Tiki | Sách tiếng Việt | Sách kinh tế | Sách khởi nghiệp | Dẫn Đầu Hay Là Chết (Tái Bản 2022),248
113117430,Combo Sách Marketing Bán Hàng: Ai Lấy Miếng Pho Mát Của Tôi + Câu Hỏi Là Câu Trả Lời,3300,705,114000,130000,130000,16000,12,0.0,0,0,,available,backorder,False,combo-sach-marketing-ban-hang-ai-lay-mieng-pho-mat-cua-toi-cau-hoi-la-cau-tra-loi-p113117430.html?spid=216959003,,Nhà Sách Vĩnh Thụy;216959003;114000 | Nhà Sách Dalifa;217571450;130000,Nhà Sách Tiki | Sách tiếng Việt | Sách kinh tế | Sách khởi nghiệp | Combo Sách Marketing Bán Hàng: Ai Lấy Miếng Pho Mát Của Tôi + Câu Hỏi Là Câu Trả Lời,
161383981,Xiaomi - Hành trình một công ty khởi nghiệp trở thành thương hiệu toàn cầu,3300,495,91000,91000,91000,0,0,0.0,0,0,1.0,available,backorder,False,xiaomi-hanh-trinh-mot-cong-ty-khoi-nghiep-tro-thanh-thuong-hieu-toan-cau-p161383981.html?spid=189688743,,Tiệm sách Minh Hằng;189688743;91000 | Tân Việt;161383982;115000 | Minhhabooks;162342437;91000 | MHbooks;162392110;101000,Nhà Sách Tiki | Sách tiếng Việt | Sách kinh tế | Sách khởi nghiệp | Xiaomi - Hành trình một công ty khởi nghiệp trở thành thương hiệu toàn cầu,248
194860985,SÁNG TẠO KHÔNG GIỚI HẠN TRONG KINH DOANH,3300,308,96000,96000,96000,0,0,0.0,0,0,2.0,available,backorder,False,sang-tao-khong-gioi-han-trong-kinh-doanh-p194860985.html?spid=194860986,,Nhà sách THĂNG LONG;194860986;96000,Nhà Sách Tiki | Sách tiếng Việt | Sách kinh tế | Sách khởi nghiệp | SÁNG TẠO KHÔNG GIỚI HẠN TRONG KINH DOANH,284
170466517,Xiaomi - Hành Trình Một Công Ty Khởi Nghiệp Trở Thành Thương Hiệu Toàn Cầu,3300,459,100050,115000,115000,14950,13,0.0,0,0,,available,backorder,False,xiaomi-hanh-trinh-mot-cong-ty-khoi-nghiep-tro-thanh-thuong-hieu-toan-cau-p170466517.html?spid=170466518,,Nhà sách Fahasa;170466518;100050 | Minhhabooks;171551571;91000 | Tiệm sách Minh Hằng;189688753;91000,Nhà Sách Tiki | Sách tiếng Việt | Sách kinh tế | Sách khởi nghiệp | Xiaomi - Hành Trình Một Công Ty Khởi Nghiệp Trở Thành Thương Hiệu Toàn Cầu,
21435640,Sự Lên Ngôi Của Các Nền Tảng Đa Chiều,3300,1449,109650,129000,129000,19350,15,0.0,0,0,7.0,available,backorder,False,su-len-ngoi-cua-cac-nen-tang-da-chieu-p21435640.html?spid=23426439,Richard Schmalensee,Nhà sách Fahasa;23426439;109650 | Tiki Trading;21435641;105000 | GOLD BOOKS;23053500;129000 | Times Books;139441393;105480 | VBooks;155151847;105780 | Zing Books;170324468;129000 | FishingBook;253268779;116100 | HỆ THỐNG NHÀ SÁCH ABC;262304884;114000,Nhà Sách Tiki | Sách tiếng Việt | Sách kinh tế | Sách khởi nghiệp | Sự Lên Ngôi Của Các Nền Tảng Đa Chiều,308
215746452,Công Ty Vĩ Đại Nhờ Tinh Thần Khởi Nghiệp - giải pháp của các doanh nghiệp trong thế kỷ 21 và là động lực chính cho tăng trưởng bền vững,3300,146,196500,196500,196500,0,0,0.0,0,0,,available,backorder,False,cong-ty-vi-dai-nho-tinh-than-khoi-nghiep-giai-phap-cua-cac-doanh-nghiep-trong-the-ky-21-va-la-dong-luc-chinh-cho-tang-truong-ben-vung-p215746452.html?spid=215746453,,Times Books;215746453;196500,Nhà Sách Tiki | Sách tiếng Việt | Sách kinh tế | Sách khởi nghiệp | Công Ty Vĩ Đại Nhờ Tinh Thần Khởi Nghiệp - giải pháp của các doanh nghiệp trong thế kỷ 21 và là động lực chính cho tăng trưởng bền vững,
1052710,Nói Không Với Chiến Binh Giao Thông - Mười Chìa Khóa Để Khởi Nghiệp Và Làm Giàu,3300,2065,73950,85000,85000,11050,13,4.5,2,0,13.0,available,backorder,False,noi-khong-voi-chien-binh-giao-thong-muoi-chia-khoa-de-khoi-nghiep-va-lam-giau-p1052710.html?spid=20441136,Alex Becker,Nhà sách Fahasa;20441136;73950 | Nhà Xuất Bản Trẻ;114263454;68000 | FishingBook;253350935;80750,Nhà Sách Tiki | Sách tiếng Việt | Sách kinh tế | Sách khởi nghiệp | Nói Không Với Chiến Binh Giao Thông - Mười Chìa Khóa Để Khởi Nghiệp Và Làm Giàu,396
225195628,Em Phải Đến Harvard Học Kinh Tế (Tái Bản),3300,121,78100,78100,78100,0,0,0.0,0,0,,available,backorder,False,em-phai-den-harvard-hoc-kinh-te-tai-ban-p225195628.html?spid=225195629,,Times Books;225195629;78100,Nhà Sách Tiki | Sách tiếng Việt | Sách kinh tế | Sách khởi nghiệp | Em Phải Đến Harvard Học Kinh Tế (Tái Bản),
115520922,"Combo Sách Tự Động Hoá Doanh Nghiệp ( Tập 1 + Tập 2 ) - Sách Xây Dựng Hệ Thống, Chiến Lược Cho Doanh Nghiệp",3300,693,1207140,1298000,1298000,90860,7,5.0,1,0,11.0,available,backorder,False,combo-sach-tu-dong-hoa-doanh-nghiep-tap-1-tap-2-sach-xay-dung-he-thong-chien-luoc-cho-doanh-nghiep-p115520922.html?spid=115520925,,CEO BOOK STORE;115520925;1207140,"Nhà Sách Tiki | Sách tiếng Việt | Sách kinh tế | Sách khởi nghiệp | Combo Sách Tự Động Hoá Doanh Nghiệp ( Tập 1 + Tập 2 ) - Sách Xây Dựng Hệ Thống, Chiến Lược Cho Doanh Nghiệp",
345684,Nghiệt Ngã & Thành Công (Tự Truyện Của Vikrom Kromadit - Người Sáng Lập Tập Đoàn Amata),3300,2305,73040,73040,73040,0,0,0.0,0,0,5.0,available,backorder,False,nghiet-nga-thanh-cong-tu-truyen-cua-vikrom-kromadit-nguoi-sang-lap-tap-doan-amata-p345684.html?spid=159824833,Vikrom Kromadit,VBooks;159824833;73040,Nhà Sách Tiki | Sách tiếng Việt | Sách kinh tế | Sách khởi nghiệp | Nghiệt Ngã & Thành Công (Tự Truyện Của Vikrom Kromadit - Người Sáng Lập Tập Đoàn Amata),287
44968156,Nỗ Lực Không Ngừng - Từ Tốt Đến Vĩ Đại Đến Không Thể Bị Đánh Bại,3300,1276,164430,189000,189000,24570,13,4.6,9,0,70.0,available,backorder,False,no-luc-khong-ngung-tu-tot-den-vi-dai-den-khong-the-bi-danh-bai-p44968156.html?spid=48754516,Tim S.Grover | Shari Wenk,Nhà sách Fahasa;48754516;164430 | NhatPham0356;47133274;151200 | trungthanh2018;53134756;151000 | Nhà Sách Vĩnh Thụy;173700989;182000 | info book;175213343;189000,Nhà Sách Tiki | Sách tiếng Việt | Sách kinh tế | Sách khởi nghiệp | Nỗ Lực Không Ngừng - Từ Tốt Đến Vĩ Đại Đến Không Thể Bị Đánh Bại,
212553281,Con Đường Trở Thành Freelance Writer - Tôi Đã Kiếm 800.000.000 Một Năm Từ Viết Lách Như Thế Nào? (Tái Bản),3300,179,199500,199500,199500,0,0,0.0,0,0,1.0,available,backorder,False,con-duong-tro-thanh-freelance-writer-toi-da-kiem-800-000-000-mot-nam-tu-viet-lach-nhu-the-nao-tai-ban-p212553281.html?spid=212553282,,Phương Đông Books;212553282;199500,Nhà Sách Tiki | Sách tiếng Việt | Sách kinh tế | Sách khởi nghiệp | Con Đường Trở Thành Freelance Writer - Tôi Đã Kiếm 800.000.000 Một Năm Từ Viết Lách Như Thế Nào? (Tái Bản),
127031560,Sách-48 Nguyên Tắc Chủ Chốt Của Quyền Lực,3300,626,197000,197000,197000,0,0,0.0,0,0,8.0,available,backorder,False,sach-48-nguyen-tac-chu-chot-cua-quyen-luc-p127031560.html?spid=208589541,,Hiệu Sách Tự Do;208589541;197000,Nhà Sách Tiki | Sách tiếng Việt | Sách kinh tế | Sách khởi nghiệp | Sách-48 Nguyên Tắc Chủ Chốt Của Quyền Lực,502
252062259,Khởi Nghiệp Phiêu Lưu Ký (Tái Bản 2023),3300,66,145530,189000,189000,43470,23,0.0,0,0,,available,backorder,False,khoi-nghiep-phieu-luu-ky-tai-ban-2023-p252062259.html?spid=252062260,Tạ Minh Tuấn,Nhà sách Fahasa;252062260;145530 | Alpha Books Official;257859512;150500 | Nhà Sách Trẻ Online;260234386;149800 | Times Books;260234387;150000 | Tiệm Sách Hoa Hồng;260234388;150500 | VBooks;260234389;150500,Nhà Sách Tiki | Sách tiếng Việt | Sách kinh tế | Sách khởi nghiệp | Khởi Nghiệp Phiêu Lưu Ký (Tái Bản 2023),
