id,name,data_version,day_ago_created ,price,list_price,original_price,discount,discount_rate,rating_average,review_count,favourite_count,all_time_quantity_sold,inventory_status,inventory_type,has_ebook ,url_path,authors,seller_name;spid;price,breadcrumbs,number_of_page
158761986,CHIẾN ĐẠO - LÀM CHỦ TƯƠNG LAI & KIẾN TẠO SỰ NGHIỆP,3300,520,88000,88000,88000,0,0,0.0,0,0,2.0,available,backorder,False,chien-dao-lam-chu-tuong-lai-kien-tao-su-nghiep-p158761986.html?spid=158761987,,Nhà sách Đạo Hạnh;158761987;88000,Nhà Sách Tiki | Sách tiếng Việt | Sách kinh tế | Bài học kinh doanh | CHIẾN ĐẠO - LÀM CHỦ TƯƠNG LAI & KIẾN TẠO SỰ NGHIỆP,
160759011,Trí Tuệ Siêu Việt Của Người Do Thái (Tái Bản),3300,509,103500,138000,138000,34500,25,0.0,0,0,,available,backorder,False,tri-tue-sieu-viet-cua-nguoi-do-thai-tai-ban-p160759011.html?spid=253614168,Hòa Thổ,WTBOOKS;253614168;103500 | VIETNAMBOOK;160822251;111780,Nhà Sách Tiki | Sách tiếng Việt | Sách kinh tế | Bài học kinh doanh | Trí Tuệ Siêu Việt Của Người Do Thái (Tái Bản),344
68033335,"Combo Sách : Startup, Scaleup, Screwup - Khởi Nghiệp Tinh Gọn, Mở Rộng Linh Hoạt, Tăng Trưởng Đột Phá + Radical Focus: OKRs - Bí Mật Của Tăng Trưởng",3300,1001,187000,268000,268000,81000,30,0.0,0,0,1.0,available,backorder,False,combo-sach-startup-scaleup-screwup-khoi-nghiep-tinh-gon-mo-rong-linh-hoat-tang-truong-dot-pha-radical-focus-okrs-bi-mat-cua-tang-truong-p68033335.html?spid=89920992,nhieu tac gia,Alpha Books Official;89920992;187000 | Nhà Sách Lifebooks;68033336;295000 | Phương Đông Books;73600744;229500 | Omega Plus Books;88963873;187600 | info book;117505556;236000 | Nhà Sách Vĩnh Thụy;192014639;236000 | HỆ THỐNG NHÀ SÁCH ABC;192293088;236000 | Bamboo Books;250250269;214400,"Nhà Sách Tiki | Sách tiếng Việt | Sách kinh tế | Bài học kinh doanh | Combo Sách : Startup, Scaleup, Screwup - Khởi Nghiệp Tinh Gọn, Mở Rộng Linh Hoạt, Tăng Trưởng Đột Phá + Radical Focus: OKRs - Bí Mật Của Tăng Trưởng",
535959,Ludwig Von Mises - Lược Khảo,3300,2305,45000,45000,45000,0,0,0.0,0,0,,available,backorder,False,ludwig-von-mises-luoc-khao-p535959.html?spid=247770096,Eamonn Butler,DEMEDI Bookshop;247770096;45000,Nhà Sách Tiki | Sách tiếng Việt | Sách kinh tế | Bài học kinh doanh | Ludwig Von Mises - Lược Khảo,179
251513184,Sách - Người Giàu Có Nhất Thành Babylon,3300,69,78400,98000,98000,19600,20,0.0,0,0,1.0,available,backorder,False,sach-nguoi-giau-co-nhat-thanh-babylon-p251513184.html?spid=262733066, George S Clason,SEA BOOKS;262733066;78400 | Thiện Ngôn Book;251513185;98000,Nhà Sách Tiki | Sách tiếng Việt | Sách kinh tế | Bài học kinh doanh | Sách - Người Giàu Có Nhất Thành Babylon,214
15709106,Combo Sách Kinh Tế Hay - Lời Từ Chối Hoàn Hảo (Tái Bản 2018) + Đừng Bao Giờ Đi Ăn Một Mình (Tái Bản) - (Tặng Kèm Postcard GreenLife AHA),3300,1497,239502,239502,239502,0,0,5.0,1,0,34.0,available,backorder,False,combo-sach-kinh-te-hay-loi-tu-choi-hoan-hao-tai-ban-2018-dung-bao-gio-di-an-mot-minh-tai-ban-tang-kem-postcard-greenlife-aha-p15709106.html?spid=15709107,Nhiều Tác Giả,AHABOOKS;15709107;239502 | VBooks;162537009;253470,Nhà Sách Tiki | Sách tiếng Việt | Sách kinh tế | Bài học kinh doanh | Combo Sách Kinh Tế Hay - Lời Từ Chối Hoàn Hảo (Tái Bản 2018) + Đừng Bao Giờ Đi Ăn Một Mình (Tái Bản) - (Tặng Kèm Postcard GreenLife AHA),
506325,Giao Tiếp Hiệu Quả Trong Kinh Doanh,3300,0,29000,34000,34000,5000,15,5.0,1,0,11.0,available,backorder,False,giao-tiep-hieu-qua-trong-kinh-doanh-p506325.html?spid=586488,Peter E. Friedes & David H. Maister,Nhân Văn;586488;29000,Nhà Sách Tiki | Sách tiếng Việt | Sách kinh tế | Bài học kinh doanh | Giao Tiếp Hiệu Quả Trong Kinh Doanh,212
189177278,Quản Trị Kinh Doanh Bán Lẻ Trực Tuyến,3300,355,72250,72250,72250,0,0,0.0,0,0,1.0,available,backorder,False,quan-tri-kinh-doanh-ban-le-truc-tuyen-p189177278.html?spid=208193789,,Nhà Sách Pháp Luật;208193789;72250 | Bảo Châu Books;189177279;85000,Nhà Sách Tiki | Sách tiếng Việt | Sách kinh tế | Bài học kinh doanh | Quản Trị Kinh Doanh Bán Lẻ Trực Tuyến,272
189413717,Những Mô Hình Coach Thành Công Nhất Hiện Nay,3300,353,170000,200000,200000,30000,15,0.0,0,0,,available,backorder,False,nhung-mo-hinh-coach-thanh-cong-nhat-hien-nay-p189413717.html?spid=244178132,Jonathan Passmore,Bamboo Books;244178132;170000,Nhà Sách Tiki | Sách tiếng Việt | Sách kinh tế | Bài học kinh doanh | Những Mô Hình Coach Thành Công Nhất Hiện Nay,360
252760978,Kỹ Năng Bán Hàng Bất Động Sản Trong Kỷ Nguyên Mới _AL,3300,57,175000,219000,219000,44000,20,0.0,0,0,,available,backorder,False,ky-nang-ban-hang-bat-dong-san-trong-ky-nguyen-moi-_al-p252760978.html?spid=252760979,,NewShop Official;252760979;175000 | Nhà Sách Vĩnh Thụy;253388744;219000,Nhà Sách Tiki | Sách tiếng Việt | Sách kinh tế | Bài học kinh doanh | Kỹ Năng Bán Hàng Bất Động Sản Trong Kỷ Nguyên Mới _AL,200
95039278,Sách - Tỷ Phú Bán Giày (Tái Bản 2018) - Alphabooks,3300,776,127200,159000,159000,31800,20,0.0,0,0,,available,backorder,False,sach-ty-phu-ban-giay-tai-ban-2018-alphabooks-p95039278.html?spid=177897794,,Bamboo Books;177897794;127200 | Nhà Sách Vĩnh Thụy;116594706;133000 | Trạm đọc;125172470;111000 | HỆ THỐNG NHÀ SÁCH ABC;193062685;140000,Nhà Sách Tiki | Sách tiếng Việt | Sách kinh tế | Bài học kinh doanh | Sách - Tỷ Phú Bán Giày (Tái Bản 2018) - Alphabooks,368
152705176,Tỷ Phú Bán Giày (Tái Bản),3300,543,138330,159000,159000,20670,13,5.0,1,0,13.0,available,backorder,False,ty-phu-ban-giay-tai-ban-p152705176.html?spid=152705177,Tony Hsieh,Nhà sách Fahasa;152705177;138330 | Bamboo Books;177897783;127200 | Nhà Sách Vĩnh Thụy;184520593;140000 | HỆ THỐNG NHÀ SÁCH ABC;193062748;140000,Nhà Sách Tiki | Sách tiếng Việt | Sách kinh tế | Bài học kinh doanh | Tỷ Phú Bán Giày (Tái Bản),
37975725,Luật Thành Công - Chìa Khóa Vàng Đánh Thức Uớc Mơ Của Bạn Tập 2,3300,1331,174300,210000,210000,35700,17,5.0,6,0,40.0,available,backorder,False,luat-thanh-cong-chia-khoa-vang-danh-thuc-uoc-mo-cua-ban-tap-2-p37975725.html?spid=36836381,Napoleon Hill,Nhà sách Fahasa;36836381;174300 | Tiki Trading;37975726;157000 | The King of Books;58107499;136500 | Minhhabooks;91727453;168000 | Trao Tri thức Gặt Niềm tin;151661409;151200 | MCBooks Sài Gòn;181973432;136000 | MCB Chumsachhoitu;188007956;210000 | HỆ THỐNG NHÀ SÁCH ABC;202630899;185000 | Hiệu Sách Tự Do;212263618;210000 | The 1991 Book;247861969;136500,Nhà Sách Tiki | Sách tiếng Việt | Sách kinh tế | Bài học kinh doanh | Luật Thành Công - Chìa Khóa Vàng Đánh Thức Uớc Mơ Của Bạn Tập 2,463
38436480,Dịch Vụ Khách Hàng Thương Vụ 1 Vốn 4 Lời - Át Chủ Bài Vượt Xa Mọi Đối Thủ Của Các Đại Doanh Nghiệp Hàng Đầu Thế Giới,3300,1329,181770,219000,219000,37230,17,5.0,3,0,25.0,available,backorder,False,dich-vu-khach-hang-thuong-vu-1-von-4-loi-at-chu-bai-vuot-xa-moi-doi-thu-cua-cac-dai-doanh-nghiep-hang-dau-the-gioi-p38436480.html?spid=46773108,Ngọc Thanh | Thảo Nguyên,Nhà sách Fahasa;46773108;181770 | Nhà Sách Vĩnh Thụy;54687373;193000 | info book;123217525;193000 | Sách Hay Cho Mọi Nhà;141677590;110000 | Bảo Châu Books;177120523;190530 | HỆ THỐNG NHÀ SÁCH ABC;201035905;193000 | Việt Thư Books;243165104;186150 | BOOK SAI GON;243165187;173010,Nhà Sách Tiki | Sách tiếng Việt | Sách kinh tế | Bài học kinh doanh | Dịch Vụ Khách Hàng Thương Vụ 1 Vốn 4 Lời - Át Chủ Bài Vượt Xa Mọi Đối Thủ Của Các Đại Doanh Nghiệp Hàng Đầu Thế Giới,584
77777778,The Samsung Way - Đế Chế Công Nghệ Và Phương Thức Samsung,3300,847,132000,189000,189000,57000,30,0.0,0,0,9.0,available,backorder,False,the-samsung-way-de-che-cong-nghe-va-phuong-thuc-samsung-p77777778.html?spid=89920614,Jaeyong Song | Kyungmook Lee,Alpha Books Official;89920614;132000 | Nhà Sách Lifebooks;88933756;189000 | info book;119719556;166000 | Bamboo Books;180106072;151200 | HỆ THỐNG NHÀ SÁCH ABC;197833940;166000 | Hiệu Sách Tự Do;208685126;151200 | FishingBook;262699644;160650,Nhà Sách Tiki | Sách tiếng Việt | Sách kinh tế | Bài học kinh doanh | The Samsung Way - Đế Chế Công Nghệ Và Phương Thức Samsung,380
183037397,Sách - Những gã khổng lồ và bài học tỉ đô,3300,391,103250,103250,103250,0,0,0.0,0,0,1.0,available,backorder,False,sach-nhung-ga-khong-lo-va-bai-hoc-ti-do-p183037397.html?spid=243154632,,Nhà Sách Trẻ Online;243154632;103250 | Times Books;215122399;103550 | VBooks;230339020;103850 | Tiệm Sách Hoa Hồng;243146065;103850,Nhà Sách Tiki | Sách tiếng Việt | Sách kinh tế | Bài học kinh doanh | Sách - Những gã khổng lồ và bài học tỉ đô,
478640,Ngôn Ngữ Trong Kinh Doanh,3300,2305,112500,125000,125000,12500,10,0.0,0,0,1.0,available,backorder,False,ngon-ngu-trong-kinh-doanh-p478640.html?spid=252605570,Kevin Hogan,FishingBook;252605570;112500,Nhà Sách Tiki | Sách tiếng Việt | Sách kinh tế | Bài học kinh doanh | Ngôn Ngữ Trong Kinh Doanh,338
25163560,Nguyên Tắc Của Thịnh Vượng,3300,1418,100000,125000,125000,25000,20,3.7,3,0,14.0,available,backorder,False,nguyen-tac-cua-thinh-vuong-p25163560.html?spid=26146132,Daniel Crosby,Nhà sách Fahasa;26146132;100000 | Tiệm Sách Hoa Hồng;195506694;83750 | Times Books;195715927;83450 | Nhà Sách Trẻ Online;195715961;83150 | Bamboo Books;197525990;100000,Nhà Sách Tiki | Sách tiếng Việt | Sách kinh tế | Bài học kinh doanh | Nguyên Tắc Của Thịnh Vượng,408
181808895,Combo Sách Thế Giới Phẳng + Từ Tốt Đến Vĩ Đại (Bộ 2 Cuốn),3300,396,338800,440000,440000,101200,23,0.0,0,0,,available,backorder,False,combo-sach-the-gioi-phang-tu-tot-den-vi-dai-bo-2-cuon-p181808895.html?spid=181808896,Thomas L Friedman,Nhà sách Fahasa;181808896;338800 | Bamboo Books;197522404;396000,Nhà Sách Tiki | Sách tiếng Việt | Sách kinh tế | Bài học kinh doanh | Combo Sách Thế Giới Phẳng + Từ Tốt Đến Vĩ Đại (Bộ 2 Cuốn),
247944016,Combo 2Q:  Bí Mật Tư Duy Triệu Phú + Nghĩ Giàu Và Làm Giàu (Top Sách Bán Chạy Nhất Mọi Thời Đại) ,3300,94,194500,194500,194500,0,0,0.0,0,0,1.0,available,backorder,False,combo-2q-bi-mat-tu-duy-trieu-phu-nghi-giau-va-lam-giau-top-sach-ban-chay-nhat-moi-thoi-dai-p247944016.html?spid=247944017,,AHABOOKS;247944017;194500,Nhà Sách Tiki | Sách tiếng Việt | Sách kinh tế | Bài học kinh doanh | Combo 2Q:  Bí Mật Tư Duy Triệu Phú + Nghĩ Giàu Và Làm Giàu (Top Sách Bán Chạy Nhất Mọi Thời Đại) ,
196186870,Sách: Người giàu có thành Babylon,3300,294,38900,38900,38900,0,0,0.0,0,0,,available,backorder,False,sach-nguoi-giau-co-thanh-babylon-p196186870.html?spid=196186871,,Times Books;196186871;38900,Nhà Sách Tiki | Sách tiếng Việt | Sách kinh tế | Bài học kinh doanh | Sách: Người giàu có thành Babylon,
220684542,"Mối quan hệ 5.0 - Trí tuệ nhân tạo, thực tế ảo và robot",3300,126,175000,199000,199000,24000,12,0.0,0,0,,available,backorder,False,moi-quan-he-5-0-tri-tue-nhan-tao-thuc-te-ao-va-robot-p220684542.html?spid=231675112,Elyakim Kislev,HỆ THỐNG NHÀ SÁCH ABC;231675112;175000 | THAIHABOOKS;220684543;155220 | Nhà Sách Vĩnh Thụy;225202703;175000 | Tiệm sách Minh Hằng;229699163;158000 | Bamboo Books;229810647;179100,"Nhà Sách Tiki | Sách tiếng Việt | Sách kinh tế | Bài học kinh doanh | Mối quan hệ 5.0 - Trí tuệ nhân tạo, thực tế ảo và robot",360
48586859,Sách : Thủ Lĩnh Bộ Lạc ,3300,1222,160000,182000,182000,22000,12,0.0,0,0,,available,backorder,False,sach-thu-linh-bo-lac-p48586859.html?spid=203448800,,HỆ THỐNG NHÀ SÁCH ABC;203448800;160000 | NVP;146372108;113000,Nhà Sách Tiki | Sách tiếng Việt | Sách kinh tế | Bài học kinh doanh | Sách : Thủ Lĩnh Bộ Lạc ,
215727147,The Master COACH: Con Đường Trở Thành Nhà Khai Vấn Tài Ba (SGB),3300,151,127500,150000,150000,22500,15,0.0,0,0,,available,backorder,False,the-master-coach-con-duong-tro-thanh-nha-khai-van-tai-ba-sgb-p215727147.html?spid=257835899,,Bamboo Books;257835899;127500 | Tiệm Sách Hoa Hồng;215727148;123000 | HỆ THỐNG NHÀ SÁCH ABC;247353573;132000,Nhà Sách Tiki | Sách tiếng Việt | Sách kinh tế | Bài học kinh doanh | The Master COACH: Con Đường Trở Thành Nhà Khai Vấn Tài Ba (SGB),
117551574,"Cẩm Nang Xây Dựng Bộ Phận Kế Toán Chuyên Nghiệp – Tài Liệu Kế Toán, Tài Chính Kế Toán ",3300,676,499000,499000,499000,0,0,5.0,1,0,8.0,available,backorder,False,cam-nang-xay-dung-bo-phan-ke-toan-chuyen-nghiep-tai-lieu-ke-toan-tai-chinh-ke-toan-p117551574.html?spid=117551575,,PDCA Hoàng Đình Trọng;117551575;499000 | CEO BOOK STORE;125257307;499000,"Nhà Sách Tiki | Sách tiếng Việt | Sách kinh tế | Bài học kinh doanh | Cẩm Nang Xây Dựng Bộ Phận Kế Toán Chuyên Nghiệp – Tài Liệu Kế Toán, Tài Chính Kế Toán ",
130757144,Phép tắc loài sói - Kỷ luật thép của bầy sói,3300,575,84000,84000,84000,0,0,0.0,0,0,1.0,available,backorder,False,phep-tac-loai-soi-ky-luat-thep-cua-bay-soi-p130757144.html?spid=190190256,,Tiệm sách Minh Hằng;190190256;84000 | Minhhabooks;130757145;84000 | MHbooks;146940774;95999,Nhà Sách Tiki | Sách tiếng Việt | Sách kinh tế | Bài học kinh doanh | Phép tắc loài sói - Kỷ luật thép của bầy sói,
559913,Nhảy Lên Đường Cong Chữ S,3300,2305,100000,125000,125000,25000,20,0.0,0,0,1.0,available,backorder,False,nhay-len-duong-cong-chu-s-p559913.html?spid=35444441,Paul Nunes - Tim Breene,Nhà sách Fahasa;35444441;100000 | trungthanh2018;7234879;30000 | DTBOOKS;9349364;75000 | Nhà sách PLV;244299222;125000,Nhà Sách Tiki | Sách tiếng Việt | Sách kinh tế | Bài học kinh doanh | Nhảy Lên Đường Cong Chữ S,256
127032747,Sách-Ngôn Ngữ Bí Mật Trong Kinh Doanh,3300,624,112500,125000,125000,12500,10,0.0,0,0,,available,backorder,False,sach-ngon-ngu-bi-mat-trong-kinh-doanh-p127032747.html?spid=249030233,,Bamboo Books;249030233;112500 | FishingBook;252605573;112500,Nhà Sách Tiki | Sách tiếng Việt | Sách kinh tế | Bài học kinh doanh | Sách-Ngôn Ngữ Bí Mật Trong Kinh Doanh,
262060224,Độc Tôn Để Trường Tồn,3300,23,89400,89400,89400,0,0,0.0,0,0,,available,backorder,False,doc-ton-de-truong-ton-p262060224.html?spid=262060225,,Tiệm Sách Hoa Hồng;262060225;89400,Nhà Sách Tiki | Sách tiếng Việt | Sách kinh tế | Bài học kinh doanh | Độc Tôn Để Trường Tồn,
77231102, Sách - Nghề Tay Trái - 100 Cách Kiếm Tiền Thời Bão Giá,3300,708,166000,189000,189000,23000,12,0.0,0,0,,available,backorder,False,sach-nghe-tay-trai-100-cach-kiem-tien-thoi-bao-gia-p77231102.html?spid=205968198,Chris Guillebeau,Nhà Sách Vĩnh Thụy;205968198;166000 | Minhhabooks;165947519;150000 | info book;208188390;166000,Nhà Sách Tiki | Sách tiếng Việt | Sách kinh tế | Bài học kinh doanh |  Sách - Nghề Tay Trái - 100 Cách Kiếm Tiền Thời Bão Giá,
23262063,Combo Sách Kĩ Năng Kinh Doanh: Mặt Trái Của Công Nghệ  + Phương Thức Amazon ,3300,1432,316000,359000,359000,43000,12,0.0,0,0,,available,backorder,False,combo-sach-ki-nang-kinh-doanh-mat-trai-cua-cong-nghe-phuong-thuc-amazon-p23262063.html?spid=242698956,,HỆ THỐNG NHÀ SÁCH ABC;242698956;316000 | Phương Đông Books;23391271;312299,Nhà Sách Tiki | Sách tiếng Việt | Sách kinh tế | Bài học kinh doanh | Combo Sách Kĩ Năng Kinh Doanh: Mặt Trái Của Công Nghệ  + Phương Thức Amazon ,
177962512,Combo Mô Hình Kinh Doanh Tối Ưu + Mô Hình Phân Phối Và Bán Lẻ + Mô Hình Chất Lượng Dịch Vụ Trong Bán Lẻ (Bộ 3 Cuốn),3300,413,235000,267000,267000,32000,12,0.0,0,0,,available,backorder,False,combo-mo-hinh-kinh-doanh-toi-uu-mo-hinh-phan-phoi-va-ban-le-mo-hinh-chat-luong-dich-vu-trong-ban-le-bo-3-cuon-p177962512.html?spid=232729267,Đào Xuân Khương,HỆ THỐNG NHÀ SÁCH ABC;232729267;235000 | Nhà Sách Vĩnh Thụy;178745059;235000 | info book;242622365;240000,Nhà Sách Tiki | Sách tiếng Việt | Sách kinh tế | Bài học kinh doanh | Combo Mô Hình Kinh Doanh Tối Ưu + Mô Hình Phân Phối Và Bán Lẻ + Mô Hình Chất Lượng Dịch Vụ Trong Bán Lẻ (Bộ 3 Cuốn),
215739121,Leo Ra Khỏi Hang Thỏ _Saigon Books,3300,141,153000,180000,180000,27000,15,0.0,0,0,,available,backorder,False,leo-ra-khoi-hang-tho-_saigon-books-p215739121.html?spid=262886362,,Bamboo Books;262886362;153000 | Tiệm Sách Hoa Hồng;215739122;147600 | HỆ THỐNG NHÀ SÁCH ABC;247896100;158000 | Nhà Sách Trẻ Online;253146989;147000,Nhà Sách Tiki | Sách tiếng Việt | Sách kinh tế | Bài học kinh doanh | Leo Ra Khỏi Hang Thỏ _Saigon Books,
114945465,Sách: 28 Cách Để Trở Thành Người Phụ Nữ Giàu Có - TSKN,3300,687,36585,36585,36585,0,0,0.0,0,0,2.0,available,backorder,False,sach-28-cach-de-tro-thanh-nguoi-phu-nu-giau-co-tskn-p114945465.html?spid=114945468,,Trao Tri thức Gặt Niềm tin;114945468;36585 | Tiệm sách Minh Hằng;252558651;55000,Nhà Sách Tiki | Sách tiếng Việt | Sách kinh tế | Bài học kinh doanh | Sách: 28 Cách Để Trở Thành Người Phụ Nữ Giàu Có - TSKN,
261961715,Kiểm Chứng Ý Tưởng Kinh Doanh (Testing Business Ideas),3300,26,179400,179400,179400,0,0,0.0,0,0,,available,backorder,False,kiem-chung-y-tuong-kinh-doanh-testing-business-ideas-p261961715.html?spid=261961716,,Tiệm Sách Hoa Hồng;261961716;179400,Nhà Sách Tiki | Sách tiếng Việt | Sách kinh tế | Bài học kinh doanh | Kiểm Chứng Ý Tưởng Kinh Doanh (Testing Business Ideas),
97876282,Thấy trước doanh thu,3300,765,238000,238000,238000,0,0,4.7,13,0,117.0,available,backorder,False,thay-truoc-doanh-thu-p97876282.html?spid=97876283,,trungthanh2018;97876283;238000 | Times Books;205894178;190000 | Nhà Sách Trẻ Online;205846151;189500,Nhà Sách Tiki | Sách tiếng Việt | Sách kinh tế | Bài học kinh doanh | Thấy trước doanh thu,
176752865,Trump - Đừng Bao Giờ Bỏ Cuộc (Tái Bản 2022),3300,422,69600,80000,80000,10400,13,4.0,1,0,16.0,available,backorder,False,trump-dung-bao-gio-bo-cuoc-tai-ban-2022-p176752865.html?spid=176752867,Donald J Trump,Nhà sách Fahasa;176752867;69600 | Nhà Xuất Bản Trẻ;182753958;64000 | Nhà Sách Trẻ Online;190857086;67400 | VIETNAMBOOK;217476529;60800 | FishingBook;253107318;72000,Nhà Sách Tiki | Sách tiếng Việt | Sách kinh tế | Bài học kinh doanh | Trump - Đừng Bao Giờ Bỏ Cuộc (Tái Bản 2022),
261839417,Dòng Tiền Gắn Liền Lợi Nhuận,3300,26,104000,149000,149000,45000,30,0.0,0,0,,available,backorder,False,dong-tien-gan-lien-loi-nhuan-p261839417.html?spid=262042794,,Alpha Books Official;262042794;104000 | Sống Official;262804832;104000,Nhà Sách Tiki | Sách tiếng Việt | Sách kinh tế | Bài học kinh doanh | Dòng Tiền Gắn Liền Lợi Nhuận,
58023085,Từ Bỏ Thói Quen Giảm Giá - Pricing With Confidence,3300,1071,175000,199000,199000,24000,12,0.0,0,0,,available,backorder,False,tu-bo-thoi-quen-giam-gia-pricing-with-confidence-p58023085.html?spid=249676854,Nhiều Tác Giả ,HỆ THỐNG NHÀ SÁCH ABC;249676854;175000 | Times Books;77774551;119200 | Nhà Sách Vĩnh Thụy;116617808;190000,Nhà Sách Tiki | Sách tiếng Việt | Sách kinh tế | Bài học kinh doanh | Từ Bỏ Thói Quen Giảm Giá - Pricing With Confidence,276
159951457,Bắt đầu với câu hỏi tại sao,3300,516,85020,109000,109000,23980,22,0.0,0,0,19.0,available,backorder,False,bat-dau-voi-cau-hoi-tai-sao-p159951457.html?spid=159951458,Simon Sinek,THAIHABOOKS;159951458;85020 | Nhà Sách Vĩnh Thụy;160850336;106000 | Bamboo Books;184488596;98100 | Phương Đông Books;184772817;92500 | GETA SHOP;196548247;109000 | HỆ THỐNG NHÀ SÁCH ABC;196705278;96000 | Sống Official;205840470;87200 | Omega Plus Books;205927382;87000 | Alpha Books Official;205927894;87200 | info book;213877084;109000 | Tiệm sách Minh Hằng;230051155;86000 | Minhhabooks;241745555;86000 | Nhà Sách Trẻ Online;247058943;83330 | MHbooks;252102868;86000 | Times Books;253229836;83630 | Tiệm Sách Hoa Hồng;253229837;83930 | VBooks;253229838;83930 | BOOK SAI GON;253661664;86110 | Việt Thư Books;253662216;87200,Nhà Sách Tiki | Sách tiếng Việt | Sách kinh tế | Bài học kinh doanh | Bắt đầu với câu hỏi tại sao,346
229962951,Dám Làm Giàu (Tái Bản ),3300,116,80740,80740,80740,0,0,0.0,0,0,1.0,available,backorder,False,dam-lam-giau-tai-ban-p229962951.html?spid=229962952,,Nhà Sách Trẻ Online;229962952;80740,Nhà Sách Tiki | Sách tiếng Việt | Sách kinh tế | Bài học kinh doanh | Dám Làm Giàu (Tái Bản ),
117400561,"Cẩm Nang Phòng Kinh Doanh – Quy Trình Xây Dựng Phòng Kinh Doanh Bài Bản, Tài Liệu Bán Hàng, Tài Liệu Kinh Doanh, Tài Liệu Chăm Sóc Khách Hàng, Dịch Vụ Khách Hàng",3300,678,499000,499000,499000,0,0,0.0,0,0,15.0,available,backorder,False,cam-nang-phong-kinh-doanh-quy-trinh-xay-dung-phong-kinh-doanh-bai-ban-tai-lieu-ban-hang-tai-lieu-kinh-doanh-tai-lieu-cham-soc-khach-hang-dich-vu-khach-hang-pdca-p117400561.html?spid=117400562,,PDCA Hoàng Đình Trọng;117400562;499000 | CEO BOOK STORE;118208272;500000,"Nhà Sách Tiki | Sách tiếng Việt | Sách kinh tế | Bài học kinh doanh | Cẩm Nang Phòng Kinh Doanh – Quy Trình Xây Dựng Phòng Kinh Doanh Bài Bản, Tài Liệu Bán Hàng, Tài Liệu Kinh Doanh, Tài Liệu Chăm Sóc Khách Hàng, Dịch Vụ Khách Hàng",
193045195,Đạo Kinh Doanh: 7 Triết Lý Kinh Doanh Quan Trọng Nhất Được Các Doanh Nhân Từ Cổ Chí Kim Áp Dụng Để Thành Công,3300,323,172260,198000,198000,25740,13,0.0,0,0,2.0,available,backorder,False,dao-kinh-doanh-7-triet-ly-kinh-doanh-quan-trong-nhat-duoc-cac-doanh-nhan-tu-co-chi-kim-ap-dung-de-thanh-cong-p193045195.html?spid=193045196,Nguyễn Anh Dũng,Nhà sách Fahasa;193045196;172260,Nhà Sách Tiki | Sách tiếng Việt | Sách kinh tế | Bài học kinh doanh | Đạo Kinh Doanh: 7 Triết Lý Kinh Doanh Quan Trọng Nhất Được Các Doanh Nhân Từ Cổ Chí Kim Áp Dụng Để Thành Công,
250804668,Đời Ngắn Đừng Ngủ Dài ( tái bản - NXB Trẻ ),3300,69,65250,75000,75000,9750,13,0.0,0,0,,available,backorder,False,doi-ngan-dung-ngu-dai-tai-ban-nxb-tre-p250804668.html?spid=250804669, Robin Sharma,Bảo Châu Books;250804669;65250,Nhà Sách Tiki | Sách tiếng Việt | Sách kinh tế | Bài học kinh doanh | Đời Ngắn Đừng Ngủ Dài ( tái bản - NXB Trẻ ),228
251942844,Phong Thái Của Bậc Thầy Thuyết Phục,3300,67,59400,99000,99000,39600,40,0.0,0,0,,available,backorder,False,phong-thai-cua-bac-thay-thuyet-phuc-p251942844.html?spid=251942845,Dave Lakhani,4Ubooks;251942845;59400,Nhà Sách Tiki | Sách tiếng Việt | Sách kinh tế | Bài học kinh doanh | Phong Thái Của Bậc Thầy Thuyết Phục,244
100033065,Người Giàu Có Thành Babylon - Cuốn Sách Làm Giàu Hiệu Quả,3300,756,45920,45920,45920,0,0,0.0,0,0,6.0,available,backorder,False,nguoi-giau-co-thanh-babylon-cuon-sach-lam-giau-hieu-qua-p100033065.html?spid=100033066,,VIETNAMBOOK;100033066;45920 | Tiệm Sách Hoa Hồng;196190146;39200,Nhà Sách Tiki | Sách tiếng Việt | Sách kinh tế | Bài học kinh doanh | Người Giàu Có Thành Babylon - Cuốn Sách Làm Giàu Hiệu Quả,224
203401772,ALWAYS DAY ONE - CÔNG THỨC THÀNH CÔNG,3300,234,158000,179000,179000,21000,12,5.0,1,0,7.0,available,backorder,False,always-day-one-cong-thuc-thanh-cong-p203401772.html?spid=203401773,Alex Kantrowitz,Nhà Sách Thành An;203401773;158000,Nhà Sách Tiki | Sách tiếng Việt | Sách kinh tế | Bài học kinh doanh | ALWAYS DAY ONE - CÔNG THỨC THÀNH CÔNG,336
185448087,"The Bitcoin standard: Quá khứ biến động, hiện tại bùng nổ, tương lai đột phá",3300,377,148850,229000,229000,80150,35,3.5,2,0,3.0,available,backorder,False,the-bitcoin-standard-qua-khu-bien-dong-hien-tai-bung-no-tuong-lai-dot-pha-p185448087.html?spid=185448089,Saifedean Ammous,1980 BOOKS HCM;185448089;148850 | Nhà Sách Vĩnh Thụy;201475757;194000,"Nhà Sách Tiki | Sách tiếng Việt | Sách kinh tế | Bài học kinh doanh | The Bitcoin standard: Quá khứ biến động, hiện tại bùng nổ, tương lai đột phá",552
36744082,Nền Tảng Công Nghệ - Hướng Đi Mới Cho Doanh Nghiệp Trong Thời Đại 4.0,3300,1342,119200,149000,149000,29800,20,0.0,0,0,13.0,available,backorder,False,nen-tang-cong-nghe-huong-di-moi-cho-doanh-nghiep-trong-thoi-dai-4-0-p36744082.html?spid=40723170,Anthony Stevens | Louis Strauss,Nhà sách Fahasa;40723170;119200 | Tiki Trading;36744083;103700 | 1980 BOOKS HCM;55704682;96850 | AHABOOKS;65789281;133500 | Minhhabooks;92493402;119000 | MHbooks;92556082;159000 | Nhà Sách Vĩnh Thụy;201843047;131000 | info book;208208451;131000 | Nhà sách PLV;210967892;149000 | Trao Tri thức Gặt Niềm tin;212321108;131971,Nhà Sách Tiki | Sách tiếng Việt | Sách kinh tế | Bài học kinh doanh | Nền Tảng Công Nghệ - Hướng Đi Mới Cho Doanh Nghiệp Trong Thời Đại 4.0,
