id,name,data_version,day_ago_created ,price,list_price,original_price,discount,discount_rate,rating_average,review_count,favourite_count,all_time_quantity_sold,inventory_status,inventory_type,has_ebook ,url_path,authors,seller_name;spid;price,breadcrumbs,number_of_page
483957,Dạy Con Làm Giàu (Tập 9) - Tái Bản 2016,3300,2305,45000,45000,45000,0,0,0.0,0,0,3.0,available,backorder,False,day-con-lam-giau-tap-9-tai-ban-2016-p483957.html?spid=194013353,Robert T. Kiyosaki,HỆ THỐNG NHÀ SÁCH ABC;194013353;45000 | Geta;88241576;60000 | VBooks;190504948;54200 | Nhà Sách Trẻ Online;204662252;54000 | Times Books;205717688;54400,Nhà Sách Tiki | Sách tiếng Việt | Sách kinh tế | Bài học kinh doanh | Dạy Con Làm Giàu (Tập 9) - Tái Bản 2016,
106362131,Sách - 100 Lời Khuyên Đầu Tư Bất Động Sản Khôn Ngoan Nhất,3300,732,119000,169000,169000,50000,30,5.0,1,0,4.0,available,backorder,False,sach-100-loi-khuyen-dau-tu-bat-dong-san-khon-ngoan-nhat-p106362131.html?spid=191353949,Donald J. Trump,Đồ chơi giáo dục thông minh;191353949;119000 | Nhà Sách Trẻ Online;106362135;117024 | info book;115170287;122000 | Nhà Sách Vĩnh Thụy;115972876;133000 | Bamboo Books;177914694;135200 | HỆ THỐNG NHÀ SÁCH ABC;192177630;149000 | Hodico;199223877;169000 | Zing Books;200994557;169000,Nhà Sách Tiki | Sách tiếng Việt | Sách kinh tế | Bài học kinh doanh | Sách - 100 Lời Khuyên Đầu Tư Bất Động Sản Khôn Ngoan Nhất,356
766595,"50 Ý Tưởng Kinh Doanh ""Đỉnh"" Nhất",3300,2146,131000,149000,149000,18000,12,0.0,0,0,,available,backorder,False,50-y-tuong-kinh-doanh-dinh-nhat-p766595.html?spid=205353966,Ian Wallis,HỆ THỐNG NHÀ SÁCH ABC;205353966;131000 | BOOKS AND LIFE;72745580;111750 | Times Books;215079092;121880,"Nhà Sách Tiki | Sách tiếng Việt | Sách kinh tế | Bài học kinh doanh | 50 Ý Tưởng Kinh Doanh ""Đỉnh"" Nhất",487
45123837,Liên Tục Tăng Trưởng 2 Con Số - Những Công Ty Lớn Đã Thành Công Như Thế Nào? Bạn Cũng Có Thể Làm Được!,3300,1279,153850,181000,181000,27150,15,4.5,5,0,28.0,available,backorder,False,lien-tuc-tang-truong-2-con-so-nhung-cong-ty-lon-da-thanh-cong-nhu-the-nao-ban-cung-co-the-lam-duoc-p45123837.html?spid=45461358,Michael Treacy,Nhà sách Fahasa;45461358;153850 | NhatPham0356;45359137;129900 | NVP;45807145;99000 | trungthanh2018;46472023;144800 | Bookstores;48990088;117650 | The King of Books;58107591;117650 | Shop60s;57643649;181000 | tientien1912;75398505;130320 | Minhhabooks;91727541;135000 | Nhà sách Có Đủ Cả;147976257;181000 | SusuFamily;156189361;126700 | BizbooksJSC;164092014;111000 | Trao Tri thức Gặt Niềm tin;151745084;130320 | MiNaBooks;169545861;99000 | Nicebooks;174502904;91000 | info book;173807744;159000 | Sách TKBooks ;177908069;117650 | Sách Doanh Nhân;178299357;112220 | MCBooks Sài Gòn;181973219;117000 | MCB Chumsachhoitu;186710557;181000 | HỆ THỐNG NHÀ SÁCH ABC;203049146;159000 | Nhà Sách Vĩnh Thụy;203471434;159000 | Hiệu Sách Tự Do;212555701;181000 | The 1991 Book;247861882;117650,Nhà Sách Tiki | Sách tiếng Việt | Sách kinh tế | Bài học kinh doanh | Liên Tục Tăng Trưởng 2 Con Số - Những Công Ty Lớn Đã Thành Công Như Thế Nào? Bạn Cũng Có Thể Làm Được!,438
357844,Những Thương Vụ Thành Công Và Thất Bại,3300,2305,73040,73040,73040,0,0,0.0,0,0,1.0,available,backorder,False,nhung-thuong-vu-thanh-cong-va-that-bai-p357844.html?spid=191740267,Michael Ledwidge,VBooks;191740267;73040 | Tiệm Sách Hoa Hồng;72850158;73040 | Times Books;84592202;72740 | Nhà Sách Trẻ Online;112530962;72440,Nhà Sách Tiki | Sách tiếng Việt | Sách kinh tế | Bài học kinh doanh | Những Thương Vụ Thành Công Và Thất Bại,360
261799009,David Ogilvy - Triều Đại Của Một Ông Hoàng Quảng Cáo,3300,27,89200,89200,89200,0,0,0.0,0,0,1.0,available,backorder,False,david-ogilvy-trieu-dai-cua-mot-ong-hoang-quang-cao-p261799009.html?spid=261799010,,Times Books;261799010;89200,Nhà Sách Tiki | Sách tiếng Việt | Sách kinh tế | Bài học kinh doanh | David Ogilvy - Triều Đại Của Một Ông Hoàng Quảng Cáo,
207910676,CHIẾN LƯỢC – CƠ CHẾ – CON NGƯỜI: Thế Kiềng 3C Của Tồn Vinh Doanh Nghiệp - Tôn Thất Nguyễn Thiêm - NXB Trẻ - bìa mềm,3300,200,121500,135000,135000,13500,10,0.0,0,0,,available,backorder,False,chien-luoc-co-che-con-nguoi-the-kieng-3c-cua-ton-vinh-doanh-nghiep-ton-that-nguyen-thiem-nxb-tre-bia-mem-p207910676.html?spid=252601851,,FishingBook;252601851;121500 | BÌNH BÁN BOOK;207910677;118000 | Hiệu Sách Tự Do;222383328;133000,Nhà Sách Tiki | Sách tiếng Việt | Sách kinh tế | Bài học kinh doanh | CHIẾN LƯỢC – CƠ CHẾ – CON NGƯỜI: Thế Kiềng 3C Của Tồn Vinh Doanh Nghiệp - Tôn Thất Nguyễn Thiêm - NXB Trẻ - bìa mềm,
113932805,Những Ông Trùm Tư Bản Cuối Cùng Của Thượng Hải    Hai Đế Chế Kinh Tế Do Thái Cạnh Tranh Giúp Tạo Nên Trung Quốc Hiện Đại,3300,701,165000,195000,195000,30000,15,5.0,1,0,3.0,available,backorder,False,nhung-ong-trum-tu-ban-cuoi-cung-cua-thuong-hai-hai-de-che-kinh-te-do-thai-canh-tranh-giup-tao-nen-trung-quoc-hien-dai-p113932805.html?spid=155613871,,Cá Chép Bookstore;155613871;165000 | Tân Việt;113932806;195000 | Minhhabooks;114566590;154999 | MHbooks;120553410;166000 | Tiệm sách Minh Hằng;190119050;145000 | SÁCH ĐẠI NAM;253950830;195000,Nhà Sách Tiki | Sách tiếng Việt | Sách kinh tế | Bài học kinh doanh | Những Ông Trùm Tư Bản Cuối Cùng Của Thượng Hải    Hai Đế Chế Kinh Tế Do Thái Cạnh Tranh Giúp Tạo Nên Trung Quốc Hiện Đại,436
217385431,"Sách Nghiến Răng Nỗ Lực, Vươn Lên Dẫn Đầu",3300,132,144500,170000,170000,25500,15,0.0,0,0,,available,backorder,False,sach-nghien-rang-no-luc-vuon-len-dan-dau-p217385431.html?spid=246773100,,Bamboo Books;246773100;144500 | Nhà Sách Trẻ Online;217385432;139400 | Tiệm Sách Hoa Hồng;242140267;139400 | HỆ THỐNG NHÀ SÁCH ABC;247422544;150000,"Nhà Sách Tiki | Sách tiếng Việt | Sách kinh tế | Bài học kinh doanh | Sách Nghiến Răng Nỗ Lực, Vươn Lên Dẫn Đầu",
90679270,MBA - 100 Kỹ Thuật Xử Lý Tình Huống Trong Kinh Doanh Của Người Nhật,3300,799,119200,149000,149000,29800,20,0.0,0,0,1.0,available,backorder,False,mba-100-ky-thuat-xu-ly-tinh-huong-trong-kinh-doanh-cua-nguoi-nhat-p90679270.html?spid=101870413,Shimada Tsuyoshi | GLOBIS,Nhà sách Fahasa;101870413;119200 | Minhhabooks;96027063;118999 | 1980Books Official;99518853;96850 | 1980 BOOKS HCM;100965284;96850 | Nhà Sách Vĩnh Thụy;201475521;131000 | info book;208219131;131000 | Nhà sách PLV;212963670;149000 | Trao Tri thức Gặt Niềm tin;212934331;131971,Nhà Sách Tiki | Sách tiếng Việt | Sách kinh tế | Bài học kinh doanh | MBA - 100 Kỹ Thuật Xử Lý Tình Huống Trong Kinh Doanh Của Người Nhật,352
68398639,Vùng Lợi Nhuận,3300,999,139300,199000,199000,59700,30,0.0,0,0,2.0,available,backorder,False,vung-loi-nhuan-p68398639.html?spid=192783754,,Đồ chơi giáo dục thông minh;192783754;139300 | Alpha Books Official;68398640;174000 | AHABOOKS;72219118;223500 | Times Books;73172663;119200 | info book;117808106;175000 | ETS Books;104878780;174300 | Bamboo Books;180607210;159200 | HỆ THỐNG NHÀ SÁCH ABC;193741707;175000 | nha sach nguyet linh;213862710;199000 | Nhà sách PLV;229972567;199000 | Nhà Sách Trẻ Online;262043698;118900 | Tiệm Sách Hoa Hồng;262043699;119400 | VBooks;262043700;119400,Nhà Sách Tiki | Sách tiếng Việt | Sách kinh tế | Bài học kinh doanh | Vùng Lợi Nhuận,
225250939,Đầu tư thông minh,3300,120,163740,163740,163740,0,0,0.0,0,0,1.0,available,backorder,False,dau-tu-thong-minh-p225250939.html?spid=225250940,,Nhà Sách Trẻ Online;225250940;163740,Nhà Sách Tiki | Sách tiếng Việt | Sách kinh tế | Bài học kinh doanh | Đầu tư thông minh,
138183576,Tinh Thần Chiến Đấu Rực Lửa,3300,589,90250,95000,95000,4750,5,0.0,0,0,3.0,available,backorder,False,tinh-than-chien-dau-ruc-lua-p138183576.html?spid=195791703,Inamori Kazuo,Bamboo Books;195791703;90250 | FishingBook;253642660;90250,Nhà Sách Tiki | Sách tiếng Việt | Sách kinh tế | Bài học kinh doanh | Tinh Thần Chiến Đấu Rực Lửa,183
230348777,My Vision - Tầm Nhìn Thay Đổi Quốc Gia (Tái Bản 2022),3300,114,227800,268000,268000,40200,15,0.0,0,0,1.0,available,backorder,False,my-vision-tam-nhin-thay-doi-quoc-gia-tai-ban-2022-p230348777.html?spid=255338221,,Bamboo Books;255338221;227800 | Nhà Sách Trẻ Online;230348778;221840 | SEA BOOKS;262806413;198320,Nhà Sách Tiki | Sách tiếng Việt | Sách kinh tế | Bài học kinh doanh | My Vision - Tầm Nhìn Thay Đổi Quốc Gia (Tái Bản 2022),
181782943,Giáo Trình Cao Học Hệ Thống Thông Tin Quản Trị - Từ Góc Nhìn Kinh Doanh,3300,397,81000,115000,115000,34000,30,0.0,0,0,5.0,available,backorder,False,giao-trinh-cao-hoc-he-thong-thong-tin-quan-tri-tu-goc-nhin-kinh-doanh-p181782943.html?spid=181782944,,Nhân Văn;181782944;81000 | Bảo Châu Books;210154563;103000,Nhà Sách Tiki | Sách tiếng Việt | Sách kinh tế | Bài học kinh doanh | Giáo Trình Cao Học Hệ Thống Thông Tin Quản Trị - Từ Góc Nhìn Kinh Doanh,
246160177,Khi Bạn Tắc Đường Thì Tôi Đang Chơi Golf (*** Sách Chính Hãng ***),3300,102,75800,75800,75800,0,0,0.0,0,0,1.0,available,backorder,False,khi-ban-tac-duong-thi-toi-dang-choi-golf-sach-chinh-hang-p246160177.html?spid=246160178,,Tiệm Sách Hoa Hồng;246160178;75800 | nha sach nguyet linh;251099279;96000,Nhà Sách Tiki | Sách tiếng Việt | Sách kinh tế | Bài học kinh doanh | Khi Bạn Tắc Đường Thì Tôi Đang Chơi Golf (*** Sách Chính Hãng ***),
214837517,Tư Duy Giàu Nghèo: Tư Duy Quyết Định Mức Độ Giàu Có Của Bạn _AZ,3300,161,86000,109000,109000,23000,21,0.0,0,0,2.0,available,backorder,False,tu-duy-giau-ngheo-tu-duy-quyet-dinh-muc-do-giau-co-cua-ban-_az-p214837517.html?spid=214837518,Lý Nhược Vấn,NewShop Official;214837518;86000 | info book;215034656;109000 | Times Books;215140004;88700 | Tiệm Sách Hoa Hồng;235621749;89000 | Nhà Sách Trẻ Online;235631374;88400,Nhà Sách Tiki | Sách tiếng Việt | Sách kinh tế | Bài học kinh doanh | Tư Duy Giàu Nghèo: Tư Duy Quyết Định Mức Độ Giàu Có Của Bạn _AZ,272
253168620,Những Nhà Tư Tưởng Lớn - Plato In 60 Minuten - Plato Trong 60 Phút,3300,49,85000,85000,85000,0,0,0.0,0,0,1.0,available,backorder,False,nhung-nha-tu-tuong-lon-plato-in-60-minuten-plato-trong-60-phut-p253168620.html?spid=253168621,Walther Ziegler,Nhà sách Anh Thành;253168621;85000,Nhà Sách Tiki | Sách tiếng Việt | Sách kinh tế | Bài học kinh doanh | Những Nhà Tư Tưởng Lớn - Plato In 60 Minuten - Plato Trong 60 Phút,142
215779073,Tư Duy Nhanh Và Chậm (Tái Bản),3300,145,228650,269000,269000,40350,15,0.0,0,0,,available,backorder,False,tu-duy-nhanh-va-cham-tai-ban-p215779073.html?spid=263318109,,FishingBook;263318109;228650 | Times Books;215779074;186300 | Nhà Sách Trẻ Online;253461903;186000 | Tiệm Sách Hoa Hồng;253461906;186600 | VBooks;253461907;186600,Nhà Sách Tiki | Sách tiếng Việt | Sách kinh tế | Bài học kinh doanh | Tư Duy Nhanh Và Chậm (Tái Bản),
885456,Nghệ Thuật Làm Việc Cho Ra Kết Quả Của Toyota,3300,2113,106250,125000,125000,18750,15,0.0,0,0,,available,backorder,False,nghe-thuat-lam-viec-cho-ra-ket-qua-cua-toyota-p885456.html?spid=197497976,Yoshihito Wakamatsu,Bamboo Books;197497976;106250 | trungthanh2018;7163829;100000 | Nhà Sách Vĩnh Thụy;50701379;110000 | info book;56703331;110000 | info book;56703153;110000 | HỆ THỐNG NHÀ SÁCH ABC;200843408;110000 | Việt Thư Books;212556628;97500 | BOOK SAI GON;241947075;98750 | SÁCH ĐẠI NAM;260882355;124000,Nhà Sách Tiki | Sách tiếng Việt | Sách kinh tế | Bài học kinh doanh | Nghệ Thuật Làm Việc Cho Ra Kết Quả Của Toyota,148
119284166,Tạo Lập Mô Hình Kinh Doanh  (Tái bản 2021),3300,666,209000,299000,299000,90000,30,0.0,0,0,2.0,available,backorder,False,tao-lap-mo-hinh-kinh-doanh-tai-ban-2021-p119284166.html?spid=146197563,nhieu tac gia,Omega Plus Books;146197563;209000 | Nhà Sách Vĩnh Thụy;121301188;286000 | info book;121313944;263000 | HỆ THỐNG NHÀ SÁCH ABC;192294400;263000 | Bamboo Books;192306944;239200 | Trạm đọc;249878622;207899,Nhà Sách Tiki | Sách tiếng Việt | Sách kinh tế | Bài học kinh doanh | Tạo Lập Mô Hình Kinh Doanh  (Tái bản 2021),260
483943,Dạy Con Làm Giàu (Tập 4) - Con Giàu Con Thông Minh (Tái Bản 2016),3300,2305,75000,75000,75000,0,0,5.0,2,0,28.0,available,backorder,False,day-con-lam-giau-tap-4-con-giau-con-thong-minh-tai-ban-2016-p483943.html?spid=52615140,Robert T. Kiyosaki,Phương Đông Books;52615140;75000 | Geta;88245524;85000 | Nhà Sách Trẻ Online;129728071;84400 | HỆ THỐNG NHÀ SÁCH ABC;194013357;88000 | VBooks;207167751;85000 | Nhà Sách Dalifa;220628537;90000 | FishingBook;252607045;90000,Nhà Sách Tiki | Sách tiếng Việt | Sách kinh tế | Bài học kinh doanh | Dạy Con Làm Giàu (Tập 4) - Con Giàu Con Thông Minh (Tái Bản 2016),
12622541,Top 1 Toyota - Những Bài Học Về Nghệ Thuật Lãnh Đạo Từ Công Ty Sản Xuất Ô Tô Lớn Nhất Thế Giới,3300,1545,139440,168000,168000,28560,17,3.8,4,0,23.0,available,backorder,False,top-1-toyota-nhung-bai-hoc-ve-nghe-thuat-lanh-dao-tu-cong-ty-san-xuat-o-to-lon-nhat-the-gioi-p12622541.html?spid=20491741,David Magee,Nhà sách Fahasa;20491741;139440 | NhatPham0356;14232595;128700 | Bookstores;49102234;109200 | The King of Books;58112667;109200 | SusuFamily;156189192;117600 | BizbooksJSC;164092020;91000 | MiNaBooks;169545946;103660 | Nhà Sách Vĩnh Thụy;173702853;148000 | Nicebooks;174502902;84000 | Sách Doanh Nhân;178228203;104160 | HỆ THỐNG NHÀ SÁCH ABC;203016318;148000,Nhà Sách Tiki | Sách tiếng Việt | Sách kinh tế | Bài học kinh doanh | Top 1 Toyota - Những Bài Học Về Nghệ Thuật Lãnh Đạo Từ Công Ty Sản Xuất Ô Tô Lớn Nhất Thế Giới,420
196932306,Bộ Lạc Doanh Nghiệp – Corporate Tribe - Những bài học nhân học áp dụng cho doanh nghiệp,3300,287,175000,215000,215000,40000,19,5.0,5,0,49.0,available,instock,False,bo-lac-doanh-nghiep-corporate-tribe-nhung-bai-hoc-nhan-hoc-ap-dung-cho-doanh-nghiep-p196932306.html?spid=196932308,Danielle Braun | Jitske Kramer,Tiki Trading;196932308;175000 | nha sach nguyet linh;197545165;215000 | Nhà Sách Trẻ Online;197595426;175700 | Tiệm Sách Hoa Hồng;197604728;176300 | AHABOOKS;197606518;186500 | Bamboo Books;197822365;193500 | VBooks;198128767;176300 | Nhà Sách Vĩnh Thụy;199536456;189000 | HỆ THỐNG NHÀ SÁCH ABC;199737948;189000 | Zing Books;200982372;215000 | info book;201539980;189000,Nhà Sách Tiki | Sách tiếng Việt | Sách kinh tế | Bài học kinh doanh | Bộ Lạc Doanh Nghiệp – Corporate Tribe - Những bài học nhân học áp dụng cho doanh nghiệp,340
261974600,Gieo Thói Quen Nhỏ Gặt Thành Công Lớn,3300,25,69000,99000,99000,30000,30,0.0,0,0,,available,backorder,False,gieo-thoi-quen-nho-gat-thanh-cong-lon-p261974600.html?spid=262016124,,Alpha Books Official;262016124;69000 | Sống Official;262688364;69000,Nhà Sách Tiki | Sách tiếng Việt | Sách kinh tế | Bài học kinh doanh | Gieo Thói Quen Nhỏ Gặt Thành Công Lớn,
147854831,HÀNH TRÌNH KỊCH BẢN TRIỆU VIEW - Kiến tạo Thương Hiệu Bạc Tỷ từ kịch bản triệu view,3300,556,188000,200000,200000,12000,6,0.0,0,0,1.0,available,backorder,False,hanh-trinh-kich-ban-trieu-view-kien-tao-thuong-hieu-bac-ty-tu-kich-ban-trieu-view-p147854831.html?spid=173364669,Lê Chí Linh,SÁCH TRÍ TUỆ;173364669;188000 | Sbooks;147854832;235000 | TRÙM SÁCH;173060387;250000 | TIỆM SÁCH KHAI TÂM;181237975;250000,Nhà Sách Tiki | Sách tiếng Việt | Sách kinh tế | Bài học kinh doanh | HÀNH TRÌNH KỊCH BẢN TRIỆU VIEW - Kiến tạo Thương Hiệu Bạc Tỷ từ kịch bản triệu view,268
215733824,Làm thế nào để bán hàng với lợi nhuận cao hơn đối thủ,3300,149,157500,157500,157500,0,0,0.0,0,0,2.0,available,backorder,False,lam-the-nao-de-ban-hang-voi-loi-nhuan-cao-hon-doi-thu-p215733824.html?spid=249524363,,Nhà Sách Trẻ Online;249524363;157500 | Times Books;215733825;158000,Nhà Sách Tiki | Sách tiếng Việt | Sách kinh tế | Bài học kinh doanh | Làm thế nào để bán hàng với lợi nhuận cao hơn đối thủ,
758635,Thay Đổi Tất Cả Chỉ Trừ Vợ Và Con,3300,2150,109520,148000,148000,38480,26,4.5,4,0,46.0,available,backorder,False,thay-doi-tat-ca-chi-tru-vo-va-con-p758635.html?spid=20490434,E Ji Sung,Nhà sách Fahasa;20490434;109520 | Tân Việt;157196524;148000,Nhà Sách Tiki | Sách tiếng Việt | Sách kinh tế | Bài học kinh doanh | Thay Đổi Tất Cả Chỉ Trừ Vợ Và Con,192
115520175,Sách Tự Động Hóa Doanh Nghiệp Tập 2 – 6 Chiến Lược Phát Triển Doanh Nghiệp Trường Tồn,3300,693,699000,699000,699000,0,0,5.0,6,0,68.0,available,backorder,False,sach-tu-dong-hoa-doanh-nghiep-tap-2-6-chien-luoc-phat-trien-doanh-nghiep-truong-ton-p115520175.html?spid=115520176,,CEO BOOK STORE;115520176;699000,Nhà Sách Tiki | Sách tiếng Việt | Sách kinh tế | Bài học kinh doanh | Sách Tự Động Hóa Doanh Nghiệp Tập 2 – 6 Chiến Lược Phát Triển Doanh Nghiệp Trường Tồn,
150565093,Định Vị Thương Hiệu Trong Thời Đại 4.0 - Thương Hiệu Có Tầm,3300,550,111000,111000,111000,0,0,0.0,0,0,2.0,available,backorder,False,dinh-vi-thuong-hieu-trong-thoi-dai-4-0-thuong-hieu-co-tam-sibbooks-p150565093.html?spid=150937494,Mario Natarelli & Rina Plapler,Minhhabooks;150937494;111000,Nhà Sách Tiki | Sách tiếng Việt | Sách kinh tế | Bài học kinh doanh | Định Vị Thương Hiệu Trong Thời Đại 4.0 - Thương Hiệu Có Tầm,407
394522,Chiến Lược Đại Dương Xanh (Tái Bản),3300,2305,235000,235000,235000,0,0,0.0,0,0,1.0,available,backorder,False,chien-luoc-dai-duong-xanh-tai-ban-p394522.html?spid=209177644,"W.Chan Kim, Renée Mauborgne",Hiệu Sách Tự Do;209177644;235000,Nhà Sách Tiki | Sách tiếng Việt | Sách kinh tế | Bài học kinh doanh | Chiến Lược Đại Dương Xanh (Tái Bản),391
1940501,Better And Faster: Ý Tưởng Đột Phá Trong Kinh Doanh,3300,1890,119200,149000,149000,29800,20,4.7,3,0,10.0,available,backorder,False,better-and-faster-y-tuong-dot-pha-trong-kinh-doanh-p1940501.html?spid=20491988,Jeremy Gutsche,Nhà sách Fahasa;20491988;119200 | AHABOOKS;50228265;107281 | 1980 BOOKS HCM;55698698;96850 | Nhà Sách Vĩnh Thụy;202334969;131000 | info book;208436684;131000 | Nhà sách PLV;212963807;149000 | Trao Tri thức Gặt Niềm tin;212936803;131971,Nhà Sách Tiki | Sách tiếng Việt | Sách kinh tế | Bài học kinh doanh | Better And Faster: Ý Tưởng Đột Phá Trong Kinh Doanh,432
187618415,Người giàu có nhất thành Babylon,3300,361,86000,98000,98000,12000,12,0.0,0,0,,available,backorder,False,nguoi-giau-co-nhat-thanh-babylon-p187618415.html?spid=202482066,,HỆ THỐNG NHÀ SÁCH ABC;202482066;86000,Nhà Sách Tiki | Sách tiếng Việt | Sách kinh tế | Bài học kinh doanh | Người giàu có nhất thành Babylon,
169887119,Cao Thủ Săn Kèo: Bí Quyết Đầu Tư Của Tỉ Phú Do Thái - Săn Lùng Cơ Hội Làm Giàu Từ Bất Động Sản Và M&A Giữa Tâm Khủng Hoảng,3300,461,130500,150000,150000,19500,13,5.0,1,0,15.0,available,backorder,False,cao-thu-san-keo-bi-quyet-dau-tu-cua-ti-phu-do-thai-san-lung-co-hoi-lam-giau-tu-bat-dong-san-va-m-a-giua-tam-khung-hoang-p169887119.html?spid=169887120,Sam Zell,Nhà sách Fahasa;169887120;130500,Nhà Sách Tiki | Sách tiếng Việt | Sách kinh tế | Bài học kinh doanh | Cao Thủ Săn Kèo: Bí Quyết Đầu Tư Của Tỉ Phú Do Thái - Săn Lùng Cơ Hội Làm Giàu Từ Bất Động Sản Và M&A Giữa Tâm Khủng Hoảng,
175444830,Combo 2Q: 7 Bài Học Lãnh Đạo Trong Khủng Hoảng + Kiếm Tiền Thời Khủng Hoảng (Cẩm Nang Kinh Doanh / Phát Triển Lãnh Đạo Doanh Nghiệp Tự Thân / Đột Phá Quy Trình Quản Trị Và Nâng Tầm Dịch Vụ),3300,428,250500,250500,250500,0,0,0.0,0,0,9.0,available,backorder,False,combo-2q-7-bai-hoc-lanh-dao-trong-khung-hoang-kiem-tien-thoi-khung-hoang-cam-nang-kinh-doanh-phat-trien-lanh-dao-doanh-nghiep-tu-than-dot-pha-quy-trinh-quan-tri-va-nang-tam-dich-vu-p175444830.html?spid=175444832,,AHABOOKS;175444832;250500,Nhà Sách Tiki | Sách tiếng Việt | Sách kinh tế | Bài học kinh doanh | Combo 2Q: 7 Bài Học Lãnh Đạo Trong Khủng Hoảng + Kiếm Tiền Thời Khủng Hoảng (Cẩm Nang Kinh Doanh / Phát Triển Lãnh Đạo Doanh Nghiệp Tự Thân / Đột Phá Quy Trình Quản Trị Và Nâng Tầm Dịch Vụ),
248989628,BAD BLOOD - Máu Bẩn,3300,85,148000,168000,168000,20000,12,0.0,0,0,,available,backorder,False,bad-blood-mau-ban-p248989628.html?spid=253318758,,HỆ THỐNG NHÀ SÁCH ABC;253318758;148000 | Nhà Sách Trẻ Online;248989629;165744,Nhà Sách Tiki | Sách tiếng Việt | Sách kinh tế | Bài học kinh doanh | BAD BLOOD - Máu Bẩn,
173135270,"Range - Hiểu Sâu, Biết Rộng Kiểu Gì Cũng Thắng",3300,447,140000,199000,199000,59000,30,0.0,0,0,,available,backorder,False,range-hieu-sau-biet-rong-kieu-gi-cung-thang-p173135270.html?spid=192453222,David Epstein,Đồ chơi giáo dục thông minh;192453222;140000 | Tiki Trading;173135271;138000 | Bamboo Books;178788234;159200 | HỆ THỐNG NHÀ SÁCH ABC;192781720;175000 | info book;194819081;175000 | Zing Books;200816240;199000 | Hiệu Sách Tự Do;208683409;159200 | Nhà Sách Trẻ Online;262062111;136810 | Times Books;262062112;137110 | Tiệm Sách Hoa Hồng;262062113;137310 | VBooks;262062116;137310,"Nhà Sách Tiki | Sách tiếng Việt | Sách kinh tế | Bài học kinh doanh | Range - Hiểu Sâu, Biết Rộng Kiểu Gì Cũng Thắng",412
59340866,Combo Sách Thành Công Tức Thì: Huấn Luyện Viên Kinh Doanh + Chiến Lược Tạo Dòng Tiền + Quảng Cáo Ấn Tượng + Đội Ngũ Tuyệt Đỉnh + Tư Duy Tỷ Phú,3300,1040,796000,995000,995000,199000,20,0.0,0,0,,available,backorder,False,combo-sach-thanh-cong-tuc-thi-huan-luyen-vien-kinh-doanh-chien-luoc-tao-dong-tien-quang-cao-an-tuong-doi-ngu-tuyet-dinh-p59340866.html?spid=186748791,,Bamboo Books;186748791;796000 | Nhà Sách Lifebooks;88933866;995000 | ETS Books;88950028;696500 | info book;117833519;876000 | Trạm đọc;173947837;695000 | HỆ THỐNG NHÀ SÁCH ABC;194084836;876000 | Nhà sách PLV;226219781;990000,Nhà Sách Tiki | Sách tiếng Việt | Sách kinh tế | Bài học kinh doanh | Combo Sách Thành Công Tức Thì: Huấn Luyện Viên Kinh Doanh + Chiến Lược Tạo Dòng Tiền + Quảng Cáo Ấn Tượng + Đội Ngũ Tuyệt Đỉnh + Tư Duy Tỷ Phú,
427865,Hiểu Nghèo Thoát Nghèo,3300,2305,158000,158000,158000,0,0,0.0,0,0,,available,backorder,False,hieu-ngheo-thoat-ngheo-p427865.html?spid=262846795,Abhijit V. Banerjee; Esther Duflo,Hiệu Sách Tự Do;262846795;158000,Nhà Sách Tiki | Sách tiếng Việt | Sách kinh tế | Bài học kinh doanh | Hiểu Nghèo Thoát Nghèo,444
201679187,Combo Bộ Sách Những Trí Tuệ Vĩ Đại Các Thiên Tài: Einstein + Darwin + Tesla + Marie Curie + Hawking ( Bộ 5 Cuốn),3300,244,839700,1145000,1145000,305300,27,5.0,4,0,22.0,available,instock,False,combo-bo-sach-nhung-tri-tue-vi-dai-cac-thien-tai-einstein-thien-tai-va-thuyet-tuong-doi-darwin-nha-tu-nhien-hoc-hanh-trinh-vi-dai-va-thuyet-tien-hoa-tesla-nha-phat-minh-cha-de-cua-dong-dien-xoay-chieu-marie-curie-nha-nu-khoa-hoc-tien-phong-nguoi-dat-giai-nobel-nguoi-kham-pha-ra-chat-phong-xa-hawking-nguoi-dan-ong-phi-thuong-mot-thien-tai-vi-dai-va-cha-de-cua-thuyet-van-vat-bo-5-cuon-p201679187.html?spid=201679189,,Tiki Trading;201679189;839700,Nhà Sách Tiki | Sách tiếng Việt | Sách kinh tế | Bài học kinh doanh | Combo Bộ Sách Những Trí Tuệ Vĩ Đại Các Thiên Tài: Einstein + Darwin + Tesla + Marie Curie + Hawking ( Bộ 5 Cuốn),
55302743,10 Loại Hình Đổi Mới Sáng Tạo,3300,1124,199200,249000,249000,49800,20,4.0,1,0,7.0,available,backorder,False,10-loai-hinh-doi-moi-sang-tao-p55302743.html?spid=56003683,Larry Keeley | Ryan Pikkel | Brian Quinn | Helen Walters,Nhà sách Fahasa;56003683;199200 | Tiki Trading;55302744;174000 | Phương Đông Books;56266917;198500 | Alpha Books Official;58143311;174000 | Omega Plus Books;68877194;174300 | ETS Books;71087367;174300 | Sống Official;74856644;174300 | info book;118536467;219000 | Trạm đọc;125596286;174000 | Bamboo Books;178482950;199200 | Đồ chơi giáo dục thông minh;192874885;174300 | HỆ THỐNG NHÀ SÁCH ABC;193055986;219000 | Nhà Sách Vĩnh Thụy;198187713;219000 | Nhà sách PLV;225235713;239000 | FishingBook;260921356;211650,Nhà Sách Tiki | Sách tiếng Việt | Sách kinh tế | Bài học kinh doanh | 10 Loại Hình Đổi Mới Sáng Tạo,244
105231480,Kinh Doanh Thời Trang Thành Công Từ A-Z,3300,735,268000,268000,268000,0,0,0.0,0,0,2.0,available,backorder,False,kinh-doanh-thoi-trang-thanh-cong-tu-a-z-p105231480.html?spid=214637642,Nguyễn Mến,Hiệu Sách Kim Thái;214637642;268000,Nhà Sách Tiki | Sách tiếng Việt | Sách kinh tế | Bài học kinh doanh | Kinh Doanh Thời Trang Thành Công Từ A-Z,
