id,name,data_version,day_ago_created ,price,list_price,original_price,discount,discount_rate,rating_average,review_count,favourite_count,all_time_quantity_sold,inventory_status,inventory_type,has_ebook ,url_path,authors,seller_name;spid;price,breadcrumbs,number_of_page
208738903,Bộ HBR HandBook - Cẩm Nang Quản Trị Toàn Tập Từ Harvard - Bản Quyền,3300,189,525000,597000,597000,72000,12,0.0,0,0,,available,backorder,False,bo-hbr-handbook-cam-nang-quan-tri-toan-tap-tu-harvard-ban-quyen-p208738903.html?spid=214629039,,Nhà Sách Vĩnh Thụy;214629039;525000 | Gooda Official;208738904;477600,Nhà Sách Tiki | Sách tiếng Việt | Sách kinh tế | Sách kinh tế học | Bộ HBR HandBook - Cẩm Nang Quản Trị Toàn Tập Từ Harvard - Bản Quyền,
184304246,Ứng Dụng Trí Tuệ Nhân Tạo Vào Phân Tích Thị Trường Chứng Khoán,3300,384,202000,229000,229000,27000,12,0.0,0,0,,available,backorder,False,ung-dung-tri-tue-nhan-tao-vao-phan-tich-thi-truong-chung-khoan-p184304246.html?spid=184304247,Cris DoLoc,Nhà Sách Thành An;184304247;202000 | info book;208120020;229000 | HỆ THỐNG NHÀ SÁCH ABC;254079115;202000,Nhà Sách Tiki | Sách tiếng Việt | Sách kinh tế | Sách kinh tế học | Ứng Dụng Trí Tuệ Nhân Tạo Vào Phân Tích Thị Trường Chứng Khoán,452
172313254,9 Bài Học Về Tài Ăn Nói Trong Bán Hàng,3300,451,106000,120000,120000,14000,12,0.0,0,0,,available,backorder,False,9-bai-hoc-ve-tai-an-noi-trong-ban-hang-p172313254.html?spid=217642643,,Nhà Sách Vĩnh Thụy;217642643;106000 | MHbooks;263201954;96000,Nhà Sách Tiki | Sách tiếng Việt | Sách kinh tế | Sách kinh tế học | 9 Bài Học Về Tài Ăn Nói Trong Bán Hàng,
172313305,"7 Câu Hỏi ""Thần Kỳ"" Của Mọi Sếp Giỏi (Tái Bản 2020)",3300,451,131000,149000,149000,18000,12,0.0,0,0,,available,backorder,False,7-cau-hoi-than-ky-cua-moi-sep-gioi-tai-ban-2020-p172313305.html?spid=178836760,,Nhà Sách Vĩnh Thụy;178836760;131000 | info book;195990298;132000 | Times Books;215080288;122700 | Bamboo Books;262886369;127500,"Nhà Sách Tiki | Sách tiếng Việt | Sách kinh tế | Sách kinh tế học | 7 Câu Hỏi ""Thần Kỳ"" Của Mọi Sếp Giỏi (Tái Bản 2020)",
95981941,Combo Cổ Phiếu Thường Lợi Nhuận Phi Thường + 24 Bài Học Sống Còn Để Đầu Tư Thành Công Trên Thị Trường Chứng Khoán,3300,772,254400,318000,318000,63600,20,0.0,0,0,,available,backorder,False,combo-co-phieu-thuong-loi-nhuan-phi-thuong-24-bai-hoc-song-con-de-dau-tu-thanh-cong-tren-thi-truong-chung-khoan-p95981941.html?spid=177687879,Nhiều Tác Giả | Nhiều Tác Gỉa,Bamboo Books;177687879;254400 | HỆ THỐNG NHÀ SÁCH ABC;193760882;280000,Nhà Sách Tiki | Sách tiếng Việt | Sách kinh tế | Sách kinh tế học | Combo Cổ Phiếu Thường Lợi Nhuận Phi Thường + 24 Bài Học Sống Còn Để Đầu Tư Thành Công Trên Thị Trường Chứng Khoán,731
160591711,Ngày Xưa Có Một Con Bò... (Tái Bản 2019),3300,511,52000,70000,70000,18000,26,4.5,2,0,27.0,available,backorder,False,ngay-xua-co-mot-con-bo-tai-ban-2019-p160591711.html?spid=160591712,,Nhân Văn;160591712;52000 | info book;184079190;62000 | Nhà Sách Trẻ Online;190856171;58900 | HỆ THỐNG NHÀ SÁCH ABC;194200690;62000,Nhà Sách Tiki | Sách tiếng Việt | Sách kinh tế | Sách kinh tế học | Ngày Xưa Có Một Con Bò... (Tái Bản 2019),
29812119,Phương Thức Amazon - The Amazon Way ( Tặng Bookmark Sáng Tạo ),3300,1388,96000,109000,109000,13000,12,0.0,0,0,,available,backorder,False,phuong-thuc-amazon-the-amazon-way-tang-bookmark-sang-tao-p29812119.html?spid=76161834,,info book;76161834;96000 | GOLD BOOKS;47824771;86110,Nhà Sách Tiki | Sách tiếng Việt | Sách kinh tế | Sách kinh tế học | Phương Thức Amazon - The Amazon Way ( Tặng Bookmark Sáng Tạo ),
209349565,Thật đơn giản Tạo dựng quan hệ (Tái bản 2018) - Bản Quyền,3300,188,78000,89000,89000,11000,12,0.0,0,0,,available,backorder,False,that-don-gian-tao-dung-quan-he-tai-ban-2018-ban-quyen-p209349565.html?spid=248877001,,HỆ THỐNG NHÀ SÁCH ABC;248877001;78000 | Gooda Official;209349566;71200 | Nhà Sách Trẻ Online;259479384;52900 | Times Books;259479385;53200 | Tiệm Sách Hoa Hồng;259479386;53400 | VBooks;259479387;53400,Nhà Sách Tiki | Sách tiếng Việt | Sách kinh tế | Sách kinh tế học | Thật đơn giản Tạo dựng quan hệ (Tái bản 2018) - Bản Quyền,
176906792,Combo Lời Thú Tội Mới Của Một Sát Thủ Kinh Tế + Bí Quyết Của Các Tỷ Phú Tự Thân Lập Nghiệp (Bộ 2 Cuốn) ,3300,420,272000,309000,309000,37000,12,0.0,0,0,,available,backorder,False,combo-loi-thu-toi-moi-cua-mot-sat-thu-kinh-te-bi-quyet-cua-cac-ty-phu-tu-than-lap-nghiep-bo-2-cuon-p176906792.html?spid=248891811,,HỆ THỐNG NHÀ SÁCH ABC;248891811;272000,Nhà Sách Tiki | Sách tiếng Việt | Sách kinh tế | Sách kinh tế học | Combo Lời Thú Tội Mới Của Một Sát Thủ Kinh Tế + Bí Quyết Của Các Tỷ Phú Tự Thân Lập Nghiệp (Bộ 2 Cuốn) ,
209298931,Perennial seller - Cách tạo ra những sản phẩm trường tồn - Bản Quyền,3300,182,131000,149000,149000,18000,12,0.0,0,0,,available,backorder,False,perennial-seller-cach-tao-ra-nhung-san-pham-truong-ton-ban-quyen-p209298931.html?spid=214754898,,Nhà Sách Vĩnh Thụy;214754898;131000 | Gooda Official;209298932;119200 | Nhà Sách Trẻ Online;262030415;88900 | Times Books;262030416;89200 | Tiệm Sách Hoa Hồng;262030417;89400 | VBooks;262030418;89400,Nhà Sách Tiki | Sách tiếng Việt | Sách kinh tế | Sách kinh tế học | Perennial seller - Cách tạo ra những sản phẩm trường tồn - Bản Quyền,
11435316,Combo Tỷ Phú Tự Thân Lập Nghiệp Steve Jobs : Bí Quyết Của Các Tỷ Phú Tự Thân Lập Nghiệp + Steve Jobs Những Bí Quyết Đổi Mới Và Sáng Tạo,3300,1562,253000,288000,288000,35000,12,0.0,0,0,,available,backorder,False,combo-ty-phu-tu-than-lap-nghiep-steve-jobs-bi-quyet-cua-cac-ty-phu-tu-than-lap-nghiep-steve-jobs-nhung-bi-quyet-doi-moi-va-sang-tao-p11435316.html?spid=248892951,Carmine Gallo | John Sviokla | Mitch Cohen,HỆ THỐNG NHÀ SÁCH ABC;248892951;253000,Nhà Sách Tiki | Sách tiếng Việt | Sách kinh tế | Sách kinh tế học | Combo Tỷ Phú Tự Thân Lập Nghiệp Steve Jobs : Bí Quyết Của Các Tỷ Phú Tự Thân Lập Nghiệp + Steve Jobs Những Bí Quyết Đổi Mới Và Sáng Tạo,
12485635,Combo  Cuộc Dịch Chuyển Đại Dương Xanh +  13 Nguyên Tắc Nghĩ Giàu Làm Giàu - Think And Grow Rich (Tái Bản),3300,1547,272000,309000,309000,37000,12,0.0,0,0,,available,backorder,False,combo-cuoc-dich-chuyen-dai-duong-xanh-13-nguyen-tac-nghi-giau-lam-giau-think-and-grow-rich-tai-ban-p12485635.html?spid=73738501,Nhiều Tác Giả,Nhà Sách Vĩnh Thụy;73738501;272000 | Phương Đông Books;12823780;236503 | GOLD BOOKS;23446218;260260 | AHABOOKS;51627565;236503 | info book;76143976;272000 | nha sach nguyet linh;262368486;321100,Nhà Sách Tiki | Sách tiếng Việt | Sách kinh tế | Sách kinh tế học | Combo  Cuộc Dịch Chuyển Đại Dương Xanh +  13 Nguyên Tắc Nghĩ Giàu Làm Giàu - Think And Grow Rich (Tái Bản),743
208639502,Sự Giàu Và Nghèo Của Các Dân Tộc - The Wealth And The Poverty Of Nations (Tái Bản Mới Nhất),3300,189,404000,459000,459000,55000,12,0.0,0,0,,available,backorder,False,sach-su-giau-va-ngheo-cua-cac-dan-toc-the-wealth-and-the-poverty-of-nations-tai-ban-moi-nhat-p208639502.html?spid=248538648,,HỆ THỐNG NHÀ SÁCH ABC;248538648;404000 | Gooda Official;208639503;367200,Nhà Sách Tiki | Sách tiếng Việt | Sách kinh tế | Sách kinh tế học | Sự Giàu Và Nghèo Của Các Dân Tộc - The Wealth And The Poverty Of Nations (Tái Bản Mới Nhất),
149251036,Combo 2 cuốn Blockchain + The Bitcoin Standard - 1980Books,3300,553,283000,322000,322000,39000,12,0.0,0,0,,available,backorder,False,combo-2-cuon-blockchain-the-bitcoin-standard-1980books-p149251036.html?spid=201475914,,Nhà Sách Vĩnh Thụy;201475914;283000 | Minhhabooks;151805834;271000 | Tiệm sách Minh Hằng;190190119;271000,Nhà Sách Tiki | Sách tiếng Việt | Sách kinh tế | Sách kinh tế học | Combo 2 cuốn Blockchain + The Bitcoin Standard - 1980Books,
77561482,Combo Sách - Trên Đỉnh Phố Wall + Bán Khống: Thảm Họa Kinh Tế Đậm Chất Tài Chính Nhất Trong Lịch Sử Phố Wall,3300,861,257600,368000,368000,110400,30,0.0,0,0,2.0,available,backorder,False,combo-sach-tren-dinh-pho-wall-ban-khong-tham-hoa-kinh-te-dam-chat-tai-chinh-nhat-trong-lich-su-pho-wall-p77561482.html?spid=104859374,nhieu tac gia,Alpha Books Official;104859374;257600 | nha sach nguyet linh;77561483;339000 | VBooks;161266244;292530 | Bamboo Books;186746761;301760 | info book;206206080;368000 | HỆ THỐNG NHÀ SÁCH ABC;248098883;324000 | Nhà Sách Trẻ Online;261814059;291930 | Times Books;261814060;292230 | Tiệm Sách Hoa Hồng;261814061;292530,Nhà Sách Tiki | Sách tiếng Việt | Sách kinh tế | Sách kinh tế học | Combo Sách - Trên Đỉnh Phố Wall + Bán Khống: Thảm Họa Kinh Tế Đậm Chất Tài Chính Nhất Trong Lịch Sử Phố Wall,
184497125,Những Nhà Kinh Tế Tiên Phong,3300,382,114000,129000,129000,15000,12,0.0,0,0,,available,backorder,False,nhung-nha-kinh-te-tien-phong-p184497125.html?spid=184497126,Nathan Schneider,Nhà Sách Thành An;184497126;114000 | Nhà Sách Vĩnh Thụy;201841665;122000 | info book;208105236;139000,Nhà Sách Tiki | Sách tiếng Việt | Sách kinh tế | Sách kinh tế học | Những Nhà Kinh Tế Tiên Phong,340
74564464,TOP 05 SÁCH KINH TẾ ĐÁNG ĐỌC 2020,3300,910,774000,880000,880000,106000,12,0.0,0,0,,available,backorder,False,top-05-sach-kinh-te-dang-doc-2020-p74564464.html?spid=195241871,nhieu tac gia,HỆ THỐNG NHÀ SÁCH ABC;195241871;774000 | info book;121032693;774000 | Nhà Sách Vĩnh Thụy;121082628;835000,Nhà Sách Tiki | Sách tiếng Việt | Sách kinh tế | Sách kinh tế học | TOP 05 SÁCH KINH TẾ ĐÁNG ĐỌC 2020,1480
2063605,Fintech 4.0,3300,1875,73000,86000,86000,13000,15,0.0,0,0,1.0,available,backorder,False,fintech-4-0-p2063605.html?spid=88207782,Kitao Yoshitaka,SÁCH NGHÉ;88207782;73000 | HỆ THỐNG NHÀ SÁCH ABC;207013060;76000 | Tiệm Sách Hoa Hồng;247823574;66300,Nhà Sách Tiki | Sách tiếng Việt | Sách kinh tế | Sách kinh tế học | Fintech 4.0,
207977745,Quản lý nhà nước đối với doanh nghiệp thuộc khu vực kinh tế tư nhân ở Việt Nam hiện nay (Sách tham khảo),3300,119,120000,120000,120000,0,0,0.0,0,0,,available,backorder,False,quan-ly-nha-nuoc-doi-voi-doanh-nghiep-thuoc-khu-vuc-kinh-te-tu-nhan-o-viet-nam-hien-nay-sach-tham-khao-p207977745.html?spid=207977746,,Ngọc Long Book;207977746;120000,Nhà Sách Tiki | Sách tiếng Việt | Sách kinh tế | Sách kinh tế học | Quản lý nhà nước đối với doanh nghiệp thuộc khu vực kinh tế tư nhân ở Việt Nam hiện nay (Sách tham khảo),
248912482,Bắt kịp kinh tế và nhảy vọt công nghệ: Con đường phát triển và ổn định kinh tế vĩ mô ở Hàn Quốc,3300,85,287300,287300,287300,0,0,0.0,0,0,,available,backorder,False,bat-kip-kinh-te-va-nhay-vot-cong-nghe-con-duong-phat-trien-va-on-dinh-kinh-te-vi-mo-o-han-quoc-p248912482.html?spid=248912483,,Nhà sách Sự thật;248912483;287300,Nhà Sách Tiki | Sách tiếng Việt | Sách kinh tế | Sách kinh tế học | Bắt kịp kinh tế và nhảy vọt công nghệ: Con đường phát triển và ổn định kinh tế vĩ mô ở Hàn Quốc,624
242200599,"THUẬN THEO HOÀN CẢNH - KHÔNG CÓ MỘT CHIẾN LƯỢC PHÁT TRIỂN ""VẠN NĂNG"" - BRIAN LEVY",3300,109,199000,199000,199000,0,0,0.0,0,0,,available,backorder,False,thuan-theo-hoan-canh-khong-co-mot-chien-luoc-phat-trien-van-nang-brian-levy-p242200599.html?spid=242200600,,SÁCH ĐẠI NAM;242200600;199000,"Nhà Sách Tiki | Sách tiếng Việt | Sách kinh tế | Sách kinh tế học | THUẬN THEO HOÀN CẢNH - KHÔNG CÓ MỘT CHIẾN LƯỢC PHÁT TRIỂN ""VẠN NĂNG"" - BRIAN LEVY",435
163131981,Kẻ Hủy Diệt Trong Thế Giới Phẳng,3300,485,119000,140000,140000,21000,15,0.0,0,0,,available,backorder,False,ke-huy-diet-trong-the-gioi-phang-p163131981.html?spid=164079196,,Nhà sách NetaBooks;164079196;119000,Nhà Sách Tiki | Sách tiếng Việt | Sách kinh tế | Sách kinh tế học | Kẻ Hủy Diệt Trong Thế Giới Phẳng,332
147877893,10 Điều Khác Biệt Nhất Giữa Kẻ Thắng Và Người Thua,3300,557,79000,79000,79000,0,0,0.0,0,0,,available,backorder,False,10-dieu-khac-biet-nhat-giua-ke-thang-va-nguoi-thua-p147877893.html?spid=147877894,Keith Cameron Smith,Nhà sách Đạo Hạnh;147877894;79000,Nhà Sách Tiki | Sách tiếng Việt | Sách kinh tế | Sách kinh tế học | 10 Điều Khác Biệt Nhất Giữa Kẻ Thắng Và Người Thua,
176748182,Combo 2 Cuốn: Những Ông Trùm Tư Bản Cuối Cùng Ở Thượng Hải + Quá Nhiều Và Không Đủ - Gia Đình Tôi Đã Tạo Nên Người Đàn Ông Nguy Hiểm Nhất Thế Giới Như Thế Nào?,3300,422,291000,291000,291000,0,0,0.0,0,0,,available,backorder,False,combo-2-cuon-nhung-ong-trum-tu-ban-cuoi-cung-o-thuong-hai-qua-nhieu-va-khong-du-gia-dinh-toi-da-tao-nen-nguoi-dan-ong-nguy-hiem-nhat-the-gioi-nhu-the-nao-p176748182.html?spid=176765855,,Minhhabooks;176765855;291000,Nhà Sách Tiki | Sách tiếng Việt | Sách kinh tế | Sách kinh tế học | Combo 2 Cuốn: Những Ông Trùm Tư Bản Cuối Cùng Ở Thượng Hải + Quá Nhiều Và Không Đủ - Gia Đình Tôi Đã Tạo Nên Người Đàn Ông Nguy Hiểm Nhất Thế Giới Như Thế Nào?,
215544595,Sói Già Phố Wall Phần 2 (Tái Bản) - Tự truyện - Jordan Belfort,3300,153,119630,119630,119630,0,0,0.0,0,0,,available,backorder,False,soi-gia-pho-wall-phan-2-tai-ban-tu-truyen-jordan-belfort-p215544595.html?spid=215544596,,Times Books;215544596;119630,Nhà Sách Tiki | Sách tiếng Việt | Sách kinh tế | Sách kinh tế học | Sói Già Phố Wall Phần 2 (Tái Bản) - Tự truyện - Jordan Belfort,
68205331,Combo 2 Cuốn: Phong Cách Lãnh Đạo Châu Á + Quản Lý Doanh Nghiệp Trong Thời Đại 4.0,3300,1000,275220,275220,275220,0,0,0.0,0,0,1.0,available,backorder,False,combo-2-cuon-phong-cach-lanh-dao-chau-a-quan-ly-doanh-nghiep-trong-thoi-dai-4-0-p68205331.html?spid=71920824,,Times Books;71920824;275220 | Tiệm Sách Hoa Hồng;68205332;275520,Nhà Sách Tiki | Sách tiếng Việt | Sách kinh tế | Sách kinh tế học | Combo 2 Cuốn: Phong Cách Lãnh Đạo Châu Á + Quản Lý Doanh Nghiệp Trong Thời Đại 4.0,
13652275,combo chào hàng chuyên nghiệp để bán hàng thành công+giao tiếp chuyên nghiệp để bán hàng,3300,1530,214500,214500,214500,0,0,0.0,0,0,3.0,available,backorder,False,combo-chao-hang-chuyen-nghiep-de-ban-hang-thanh-cong-giao-tiep-chuyen-nghiep-de-ban-hang-p13652275.html?spid=13652276,Nhiều Tác Giả,Phương Đông Books;13652276;214500,Nhà Sách Tiki | Sách tiếng Việt | Sách kinh tế | Sách kinh tế học | combo chào hàng chuyên nghiệp để bán hàng thành công+giao tiếp chuyên nghiệp để bán hàng,628
198692514,Kinh tế báo chí ,3300,265,70000,70000,70000,0,0,0.0,0,0,2.0,available,backorder,False,kinh-te-bao-chi-p198692514.html?spid=198692515,,Ngọc Long Book;198692515;70000,Nhà Sách Tiki | Sách tiếng Việt | Sách kinh tế | Sách kinh tế học | Kinh tế báo chí ,
17043327,Combo Em Phải Đến Harvard Học Kinh Tế + Vô Cùng Tàn Nhẫn Vô Cùng Yêu Thương (Tặng Bookmark Phương Đông Books),3300,1483,261350,261350,261350,0,0,5.0,1,0,15.0,available,backorder,False,combo-em-phai-den-harvard-hoc-kinh-te-vo-cung-tan-nhan-vo-cung-yeu-thuong-tang-bookmark-phuong-dong-books-p17043327.html?spid=17043328,Nhiều Tác Giả,Phương Đông Books;17043328;261350,Nhà Sách Tiki | Sách tiếng Việt | Sách kinh tế | Sách kinh tế học | Combo Em Phải Đến Harvard Học Kinh Tế + Vô Cùng Tàn Nhẫn Vô Cùng Yêu Thương (Tặng Bookmark Phương Đông Books),
250070927,Sách - Khát Vọng Việt - Tập 2: Hãy Là Một Phần Của Sự Đổi Thay Kỳ Diệu - Thái Hà,3300,51,143200,179000,179000,35800,20,0.0,0,0,,available,backorder,False,sach-khat-vong-viet-tap-2-hay-la-mot-phan-cua-su-doi-thay-ky-dieu-thai-ha-p250070927.html?spid=250070931,Đỗ Cao Bảo,Sachhayonline24h;250070931;143200,Nhà Sách Tiki | Sách tiếng Việt | Sách kinh tế | Sách kinh tế học | Sách - Khát Vọng Việt - Tập 2: Hãy Là Một Phần Của Sự Đổi Thay Kỳ Diệu - Thái Hà,
262056749,HBR Cẩm Nang Doanh Nhân (Bìa cứng) - Bản Quyền,3300,23,138504,138504,138504,0,0,0.0,0,0,,available,backorder,False,hbr-cam-nang-doanh-nhan-bia-cung-ban-quyen-p262056749.html?spid=262056750,,VBooks;262056750;138504,Nhà Sách Tiki | Sách tiếng Việt | Sách kinh tế | Sách kinh tế học | HBR Cẩm Nang Doanh Nhân (Bìa cứng) - Bản Quyền,
31207243,Tạo Lập Mô Hình Kinh Doanh (Quà Tặng TickBook Sinh Động),3300,1379,286000,286000,286000,0,0,0.0,0,0,,available,backorder,False,tao-lap-mo-hinh-kinh-doanh-qua-tang-tickbook-sinh-dong-p31207243.html?spid=76478551,,Nhà Sách Vĩnh Thụy;76478551;286000 | Nhà Sách Lifebooks;88933397;299000 | ETS Books;88949649;209300,Nhà Sách Tiki | Sách tiếng Việt | Sách kinh tế | Sách kinh tế học | Tạo Lập Mô Hình Kinh Doanh (Quà Tặng TickBook Sinh Động),292
178779728,Chiến Lược Của Kẻ Thắng,3300,408,149000,149000,149000,0,0,0.0,0,0,,available,backorder,False,chien-luoc-cua-ke-thang-p178779728.html?spid=213999269,,info book;213999269;149000,Nhà Sách Tiki | Sách tiếng Việt | Sách kinh tế | Sách kinh tế học | Chiến Lược Của Kẻ Thắng,
95500963,Sách - Tăng trưởng Thần Tốc - FirstNews,3300,736,130840,130840,130840,0,0,0.0,0,0,3.0,available,backorder,False,sach-tang-truong-than-toc-firstnews-p95500963.html?spid=95500975,,Times Books;95500975;130840,Nhà Sách Tiki | Sách tiếng Việt | Sách kinh tế | Sách kinh tế học | Sách - Tăng trưởng Thần Tốc - FirstNews,335
247408118,Định Vị ( Tái bản),3300,98,117024,117024,117024,0,0,0.0,0,0,,available,backorder,False,dinh-vi-tai-ban-p247408118.html?spid=247408119,,Nhà Sách Trẻ Online;247408119;117024,Nhà Sách Tiki | Sách tiếng Việt | Sách kinh tế | Sách kinh tế học | Định Vị ( Tái bản),
247408222,Định Vị ( Tái bản),3300,98,117024,117024,117024,0,0,0.0,0,0,,available,backorder,False,dinh-vi-tai-ban-p247408222.html?spid=247408223,,Nhà Sách Trẻ Online;247408223;117024,Nhà Sách Tiki | Sách tiếng Việt | Sách kinh tế | Sách kinh tế học | Định Vị ( Tái bản),
173860404,"Combo 2Q: Tương Lai Sau Đại Dịch Covid + Kinh Tế Hậu Covid - Biến Nghịch Cảnh Thành Cơ Hội, Nắm Bắt Tâm Lý Thị Trường Sau Đại Dịch",3300,440,220500,220500,220500,0,0,0.0,0,0,,available,backorder,False,combo-2q-tuong-lai-sau-dai-dich-covid-kinh-te-hau-covid-bien-nghich-canh-thanh-co-hoi-nam-bat-tam-ly-thi-truong-sau-dai-dich-p173860404.html?spid=173860405,,AHABOOKS;173860405;220500,"Nhà Sách Tiki | Sách tiếng Việt | Sách kinh tế | Sách kinh tế học | Combo 2Q: Tương Lai Sau Đại Dịch Covid + Kinh Tế Hậu Covid - Biến Nghịch Cảnh Thành Cơ Hội, Nắm Bắt Tâm Lý Thị Trường Sau Đại Dịch",
262676097,Toán Cơ Sở Cho Kinh Tế,3300,17,70000,70000,70000,0,0,0.0,0,0,,available,backorder,False,toan-co-so-cho-kinh-te-p262676097.html?spid=262676098,,SACH32;262676098;70000,Nhà Sách Tiki | Sách tiếng Việt | Sách kinh tế | Sách kinh tế học | Toán Cơ Sở Cho Kinh Tế,
262043850,10 Điều khác biệt nhất giữa kẻ làm chủ và người làm thuê (Tái bản mới nhất) - Bản Quyền,3300,24,68904,68904,0,0,0,0.0,0,0,,out_of_stock,backorder,False,10-dieu-khac-biet-nhat-giua-ke-lam-chu-va-nguoi-lam-thue-tai-ban-moi-nhat-ban-quyen-p262043850.html,,,Nhà Sách Tiki | Sách tiếng Việt | Sách kinh tế | Sách kinh tế học | 10 Điều khác biệt nhất giữa kẻ làm chủ và người làm thuê (Tái bản mới nhất) - Bản Quyền,
32352509,10 Điều Khác Biệt Nhất Giữa Kẻ Thắng Và Người Thua (Tái Bản) (Quà Tặng Card đánh dấu sách đặc biệt),3300,1370,69000,69000,69000,0,0,0.0,0,0,,available,backorder,False,10-dieu-khac-biet-nhat-giua-ke-thang-va-nguoi-thua-tai-ban-qua-tang-card-danh-dau-sach-dac-biet-p32352509.html?spid=55549678,Keith Cameron Smith,Times Books;55549678;69000 | VBooks;70831742;69300,Nhà Sách Tiki | Sách tiếng Việt | Sách kinh tế | Sách kinh tế học | 10 Điều Khác Biệt Nhất Giữa Kẻ Thắng Và Người Thua (Tái Bản) (Quà Tặng Card đánh dấu sách đặc biệt),
38517933,10 Điều Khác Biệt Nhất Giữa Kẻ Thắng Và Người Thua (Tái Bản) Tặng Cây Viết Sapphire,3300,1323,69000,69000,69000,0,0,0.0,0,0,,available,backorder,False,10-dieu-khac-biet-nhat-giua-ke-thang-va-nguoi-thua-tai-ban-tang-cay-viet-sapphire-p38517933.html?spid=55549691,Keith Cameron Smith,Times Books;55549691;69000 | VBooks;70831746;69300,Nhà Sách Tiki | Sách tiếng Việt | Sách kinh tế | Sách kinh tế học | 10 Điều Khác Biệt Nhất Giữa Kẻ Thắng Và Người Thua (Tái Bản) Tặng Cây Viết Sapphire,
261021719,Kochland - Đế Chế Koch,3300,28,347304,347304,347304,0,0,0.0,0,0,,available,backorder,False,kochland-de-che-koch-p261021719.html?spid=261021720,,VBooks;261021720;347304,Nhà Sách Tiki | Sách tiếng Việt | Sách kinh tế | Sách kinh tế học | Kochland - Đế Chế Koch,
261973988,Lời Tự Thú Của Một Bậc Thầy Quảng Cáo - Bản Quyền,3300,25,82110,82110,82110,0,0,0.0,0,0,,available,backorder,False,loi-tu-thu-cua-mot-bac-thay-quang-cao-ban-quyen-p261973988.html?spid=261973989,,VBooks;261973989;82110,Nhà Sách Tiki | Sách tiếng Việt | Sách kinh tế | Sách kinh tế học | Lời Tự Thú Của Một Bậc Thầy Quảng Cáo - Bản Quyền,
262016738,Impossible to ignore - Cách tạo nội dung thao túng người dùng - Bản Quyền,3300,25,89400,89400,89400,0,0,0.0,0,0,,available,backorder,False,impossible-to-ignore-cach-tao-noi-dung-thao-tung-nguoi-dung-ban-quyen-p262016738.html?spid=262016739,,Tiệm Sách Hoa Hồng;262016739;89400,Nhà Sách Tiki | Sách tiếng Việt | Sách kinh tế | Sách kinh tế học | Impossible to ignore - Cách tạo nội dung thao túng người dùng - Bản Quyền,
261965433,Bank 4.0 (Tái Bản 2022),3300,25,151110,151110,151110,0,0,0.0,0,0,,available,backorder,False,bank-4-0-tai-ban-2022-p261965433.html?spid=261965434,,Tiệm Sách Hoa Hồng;261965434;151110,Nhà Sách Tiki | Sách tiếng Việt | Sách kinh tế | Sách kinh tế học | Bank 4.0 (Tái Bản 2022),
184989140,Sách Nền Kinh tế di động của Trung Quốc: Những cơ hội từ sự bùng nổ tiêu dùng thông tin lớn nhất và nhanh nhất (Xuất bản lần thứ hai),3300,379,220000,220000,220000,0,0,0.0,0,0,,available,backorder,False,sach-nen-kinh-te-di-dong-cua-trung-quoc-nhung-co-hoi-tu-su-bung-no-tieu-dung-thong-tin-lon-nhat-va-nhanh-nhat-xuat-ban-lan-thu-hai-p184989140.html?spid=184989141,,NhàSáchPhápLuật;184989141;220000,Nhà Sách Tiki | Sách tiếng Việt | Sách kinh tế | Sách kinh tế học | Sách Nền Kinh tế di động của Trung Quốc: Những cơ hội từ sự bùng nổ tiêu dùng thông tin lớn nhất và nhanh nhất (Xuất bản lần thứ hai),479
262811963,Bán Quần Áo Là Phải Bán Như Thế Này Này! - Bản Quyền,3300,12,68604,68604,68604,0,0,0.0,0,0,,available,backorder,False,ban-quan-ao-la-phai-ban-nhu-the-nay-nay-ban-quyen-p262811963.html?spid=262811964,,Times Books;262811964;68604,Nhà Sách Tiki | Sách tiếng Việt | Sách kinh tế | Sách kinh tế học | Bán Quần Áo Là Phải Bán Như Thế Này Này! - Bản Quyền,
262782689,Bất động sản căn bản - Bản Quyền,3300,13,138504,138504,138504,0,0,0.0,0,0,,available,backorder,False,bat-dong-san-can-ban-ban-quyen-p262782689.html?spid=262782690,,VBooks;262782690;138504,Nhà Sách Tiki | Sách tiếng Việt | Sách kinh tế | Sách kinh tế học | Bất động sản căn bản - Bản Quyền,
260814156,Nhà Đầu Tư Lão Luyện Và Thị Trường Chứng Khoán Việt Nam,3300,29,222024,222024,222024,0,0,0.0,0,0,,available,backorder,False,nha-dau-tu-lao-luyen-va-thi-truong-chung-khoan-viet-nam-p260814156.html?spid=260814157,,Tiệm Sách Hoa Hồng;260814157;222024,Nhà Sách Tiki | Sách tiếng Việt | Sách kinh tế | Sách kinh tế học | Nhà Đầu Tư Lão Luyện Và Thị Trường Chứng Khoán Việt Nam,
32351545,Dữ Liệu Nhỏ - Small Data (Quà Tặng Card đánh dấu sách đặc biệt),3300,1372,103104,103104,103104,0,0,0.0,0,0,,available,backorder,False,du-lieu-nho-small-data-qua-tang-card-danh-dau-sach-dac-biet-p32351545.html?spid=253468662,Martin Lindstrom,Nhà Sách Trẻ Online;253468662;103104 | Times Books;253468663;103404 | Tiệm Sách Hoa Hồng;253468664;103704 | VBooks;253468665;103704,Nhà Sách Tiki | Sách tiếng Việt | Sách kinh tế | Sách kinh tế học | Dữ Liệu Nhỏ - Small Data (Quà Tặng Card đánh dấu sách đặc biệt),
