id,name,data_version,day_ago_created ,price,list_price,original_price,discount,discount_rate,rating_average,review_count,favourite_count,all_time_quantity_sold,inventory_status,inventory_type,has_ebook ,url_path,authors,seller_name;spid;price,breadcrumbs,number_of_page
199036995,Sự Suy Tàn Của Quyền Lực - Tái Bản 2022,3300,262,106230,106230,106230,0,0,0.0,0,0,,available,backorder,False,su-suy-tan-cua-quyen-luc-tai-ban-2022-p199036995.html?spid=199036996,,Times Books;199036996;106230 | VBooks;230368311;106530,"Nhà Sách Tiki | Sách tiếng Việt | Sách kinh tế | Sách quản trị, lãnh đạo | Sự Suy Tàn Của Quyền Lực - Tái Bản 2022",
72679575,HỘP SÁCH CÔNG CỤ QUẢN LÝ NHÂN SỰ,3300,951,409500,409500,409500,0,0,0.0,0,0,,available,backorder,False,hop-sach-cong-cu-quan-ly-nhan-su-p72679575.html?spid=81706218,Nhiều Tác Giả,AHABOOKS;81706218;409500 | Tiệm Sách Hoa Hồng;77867554;433251 | Minhhabooks;105699107;411000,"Nhà Sách Tiki | Sách tiếng Việt | Sách kinh tế | Sách quản trị, lãnh đạo | HỘP SÁCH CÔNG CỤ QUẢN LÝ NHÂN SỰ",
101418301,Combo Sách - Ba Người Thầy Vĩ Đại + Lãnh Đạo Phục Vụ,3300,753,233000,233000,233000,0,0,0.0,0,0,,available,backorder,False,combo-sach-ba-nguoi-thay-vi-dai-lanh-dao-phuc-vu-p101418301.html?spid=119695013,,Nhà Sách Vĩnh Thụy;119695013;233000 | nha sach nguyet linh;101418303;264000 | info book;119694980;233000,"Nhà Sách Tiki | Sách tiếng Việt | Sách kinh tế | Sách quản trị, lãnh đạo | Combo Sách - Ba Người Thầy Vĩ Đại + Lãnh Đạo Phục Vụ",
242433792,ĐỨA TRẺ ÁNH TRĂNG,3300,109,96550,96550,96550,0,0,0.0,0,0,,available,backorder,False,dua-tre-anh-trang-p242433792.html?spid=242433793,,Nhà Sách Trẻ Online;242433793;96550 | Tiệm Sách Hoa Hồng;242723301;97150 | VBooks;242723433;97150,"Nhà Sách Tiki | Sách tiếng Việt | Sách kinh tế | Sách quản trị, lãnh đạo | ĐỨA TRẺ ÁNH TRĂNG",
68077550,Combo 2 cuốn sách: 90 Ngày Đầu Tiên Làm Sếp  + Đổi Mới Từ Cốt Lõi,3300,1001,288000,288000,288000,0,0,0.0,0,0,,available,backorder,False,combo-2-cuon-sach-90-ngay-dau-tien-lam-sep-doi-moi-tu-cot-loi-p68077550.html?spid=69150900,,Nhà Sách Lifebooks;69150900;288000,"Nhà Sách Tiki | Sách tiếng Việt | Sách kinh tế | Sách quản trị, lãnh đạo | Combo 2 cuốn sách: 90 Ngày Đầu Tiên Làm Sếp  + Đổi Mới Từ Cốt Lõi",
253300202,Năng Đoạn Kim Cương - Áp Dụng Giáo Lý Của Đức Phật Vào Quản Trị Doanh Nghiệp Và Đời Sống,3300,45,114430,114430,114430,0,0,0.0,0,0,,available,backorder,False,nang-doan-kim-cuong-ap-dung-giao-ly-cua-duc-phat-vao-quan-tri-doanh-nghiep-va-doi-song-p253300202.html?spid=253300203,,Times Books;253300203;114430,"Nhà Sách Tiki | Sách tiếng Việt | Sách kinh tế | Sách quản trị, lãnh đạo | Năng Đoạn Kim Cương - Áp Dụng Giáo Lý Của Đức Phật Vào Quản Trị Doanh Nghiệp Và Đời Sống",
199045274,Bản Đồ Chiến Lược,3300,262,183000,216000,216000,33000,15,0.0,0,0,3.0,available,backorder,False,ban-do-chien-luoc-p199045274.html?spid=199045275,Robert S. Kaplan | David P. Norton,Nhà sách NetaBooks;199045275;183000 | Cá Chép Bookstore;202212493;193500,"Nhà Sách Tiki | Sách tiếng Việt | Sách kinh tế | Sách quản trị, lãnh đạo | Bản Đồ Chiến Lược",504
79776179,Combo Xây Dựng Để Trường Tồn và Gã Nghiện Giày - Tự Truyện Của Nhà Sáng Lập NIKE,3300,832,215200,269000,269000,53800,20,0.0,0,0,,available,backorder,False,combo-xay-dung-de-truong-ton-va-ga-nghien-giay-tu-truyen-cua-nha-sang-lap-nike-p79776179.html?spid=89424294,Phil Knight | Jim Collins - Jerry I.Porras,Geta;89424294;215200 | Nhà Sách Vĩnh Thụy;115092818;296000 | info book;116349157;307000 | Nhà Sách Trẻ Online;127908087;347313 | Bamboo Books;193859649;346500,"Nhà Sách Tiki | Sách tiếng Việt | Sách kinh tế | Sách quản trị, lãnh đạo | Combo Xây Dựng Để Trường Tồn và Gã Nghiện Giày - Tự Truyện Của Nhà Sáng Lập NIKE",
138558532,Người Lãnh Đạo Không Quyết Định Vội Vàng,3300,586,74800,85000,85000,10200,12,0.0,0,0,,available,backorder,False,nguoi-lanh-dao-khong-quyet-dinh-voi-vang-p138558532.html?spid=138558533,Nakamura Kazuhiro,NewShop Official;138558533;74800 | Minhhabooks;166438288;67000 | Tiệm sách Minh Hằng;190192362;67000,"Nhà Sách Tiki | Sách tiếng Việt | Sách kinh tế | Sách quản trị, lãnh đạo | Người Lãnh Đạo Không Quyết Định Vội Vàng",246
559185,Nghệ Thuật Lãnh Đạo,3300,737992,230000,230000,230000,0,0,1.0,1,0,23.0,available,backorder,False,nghe-thuat-lanh-dao-p559185.html?spid=582920,Nguyễn Đình Hùng,Nhà Sách Lao Động;582920;230000,"Nhà Sách Tiki | Sách tiếng Việt | Sách kinh tế | Sách quản trị, lãnh đạo | Nghệ Thuật Lãnh Đạo",416
248590414,Quản Trị Nhân Sự Và Các Kỹ Năng Nghiệp Vụ Về Tổ Chức Hành Chính Nhân Sự,3300,89,327850,395000,395000,67150,17,0.0,0,0,,available,backorder,False,quan-tri-nhan-su-va-cac-ky-nang-nghiep-vu-ve-to-chuc-hanh-chinh-nhan-su-p248590414.html?spid=248590415,,Nhà sách Fahasa;248590415;327850,"Nhà Sách Tiki | Sách tiếng Việt | Sách kinh tế | Sách quản trị, lãnh đạo | Quản Trị Nhân Sự Và Các Kỹ Năng Nghiệp Vụ Về Tổ Chức Hành Chính Nhân Sự",
173093659,Quản Lý Tuyệt Vời Dùng Lời Đắc Địa - Cẩm Nang Đắc Nhân Tâm Cho Nhà Lãnh Đạo,3300,447,112230,129000,129000,16770,13,0.0,0,0,1.0,available,backorder,False,quan-ly-tuyet-voi-dung-loi-dac-dia-cam-nang-dac-nhan-tam-cho-nha-lanh-dao-p173093659.html?spid=173093660,,Nhà sách Fahasa;173093660;112230 | Nhà sách PLV;243197661;129000 | Nhà sách Miền Đông;246164716;129000,"Nhà Sách Tiki | Sách tiếng Việt | Sách kinh tế | Sách quản trị, lãnh đạo | Quản Lý Tuyệt Vời Dùng Lời Đắc Địa - Cẩm Nang Đắc Nhân Tâm Cho Nhà Lãnh Đạo",
10697626,Combo Bộ Sách Dành Cho Quản Lý Nên Đọc,3300,1581,177450,273000,273000,95550,35,0.0,0,0,,available,backorder,False,combo-bo-sach-danh-cho-quan-ly-nen-doc-p10697626.html?spid=58837473,,The King of Books;58837473;177450 | AHABOOKS;55319321;218500 | Shop60s;57644107;273000 | MCB Chumsachhoitu;187054203;273000 | The 1991 Book;247861247;177450,"Nhà Sách Tiki | Sách tiếng Việt | Sách kinh tế | Sách quản trị, lãnh đạo | Combo Bộ Sách Dành Cho Quản Lý Nên Đọc",
243057772,THỬ NGHIỆM KINH DOANH (Experimentation Works) - Stefan H. Thomke - Nguyễn Việt Anh dịch - (bìa mềm),3300,104,157950,195000,195000,37050,19,0.0,0,0,,available,backorder,False,thu-nghiem-kinh-doanh-experimentation-works-stefan-h-thomke-nguyen-viet-anh-dich-bia-mem-p243057772.html?spid=247722142,Stefan H. Thomke,Bảo Châu Books;247722142;157950 | Nhà Sách Khai Minh;243057773;185250,"Nhà Sách Tiki | Sách tiếng Việt | Sách kinh tế | Sách quản trị, lãnh đạo | THỬ NGHIỆM KINH DOANH (Experimentation Works) - Stefan H. Thomke - Nguyễn Việt Anh dịch - (bìa mềm)",320
262688077,Thành Phố Thông Minh Khung Quản Trị Và Phát Triển,3300,17,396000,396000,396000,0,0,0.0,0,0,,available,backorder,False,thanh-pho-thong-minh-khung-quan-tri-va-phat-trien-p262688077.html?spid=262688078,,Tazano Official Store;262688078;396000,"Nhà Sách Tiki | Sách tiếng Việt | Sách kinh tế | Sách quản trị, lãnh đạo | Thành Phố Thông Minh Khung Quản Trị Và Phát Triển",404
242765429,LÃNH ĐẠO DUNG HỢP (How to Be an Inclusive Leader) - Jennifer Brown - Hoàng Huấn dịch - (bìa cứng),3300,105,156750,165000,165000,8250,5,0.0,0,0,1.0,available,backorder,False,lanh-dao-dung-hop-how-to-be-an-inclusive-leader-jennifer-brown-hoang-huan-dich-bia-cung-p242765429.html?spid=242765430,Jennifer Brown,Nhà Sách Khai Minh;242765430;156750,"Nhà Sách Tiki | Sách tiếng Việt | Sách kinh tế | Sách quản trị, lãnh đạo | LÃNH ĐẠO DUNG HỢP (How to Be an Inclusive Leader) - Jennifer Brown - Hoàng Huấn dịch - (bìa cứng)",244
243060039,NHÀ LÃNH ĐẠO TRONG TÔI (The Leader In Me) - Stephen R. Covey - Trần Thụy Tuyết Anh dịch - (bìa mềm),3300,104,193500,215000,215000,21500,10,0.0,0,0,,available,backorder,False,nha-lanh-dao-trong-toi-the-leader-in-me-stephen-r-covey-tran-thuy-tuyet-anh-dich-bia-mem-p243060039.html?spid=257915048,Stephen R. Covey,Bamboo Books;257915048;193500 | Nhà Sách Khai Minh;243060040;204250,"Nhà Sách Tiki | Sách tiếng Việt | Sách kinh tế | Sách quản trị, lãnh đạo | NHÀ LÃNH ĐẠO TRONG TÔI (The Leader In Me) - Stephen R. Covey - Trần Thụy Tuyết Anh dịch - (bìa mềm)",400
68077542,Combo 2 cuốn sách: Những Nguyên Lý Quản Trị Bất Biến Mọi Thời Đại + Tư Duy Của Chiến Lược Gia - Nghệ Thuật Kinh Doanh Nhật Bản,3300,1000,235450,277000,277000,41550,15,0.0,0,0,,available,backorder,False,combo-2-cuon-sach-nhung-nguyen-ly-quan-tri-bat-bien-moi-thoi-dai-tu-duy-cua-chien-luoc-gia-nghe-thuat-kinh-doanh-nhat-ban-p68077542.html?spid=197616567,,Bamboo Books;197616567;235450,"Nhà Sách Tiki | Sách tiếng Việt | Sách kinh tế | Sách quản trị, lãnh đạo | Combo 2 cuốn sách: Những Nguyên Lý Quản Trị Bất Biến Mọi Thời Đại + Tư Duy Của Chiến Lược Gia - Nghệ Thuật Kinh Doanh Nhật Bản",
137434396,Sách Triết Lý Kinh Doanh Của Alibaba,3300,592,110000,110000,110000,0,0,0.0,0,0,,available,backorder,False,sach-triet-ly-kinh-doanh-cua-alibaba-p137434396.html?spid=137434397,Trần Vỹ,Nhà Sách Phương Nam;137434397;110000,"Nhà Sách Tiki | Sách tiếng Việt | Sách kinh tế | Sách quản trị, lãnh đạo | Sách Triết Lý Kinh Doanh Của Alibaba",332
131138713,Quá Nhiều Và Không Đủ - Gia Đình Tôi Đã Tạo Nên Người Đàn Ông Nguy Hiểm Nhất Thế Giới Như Thế Nào ?,3300,609,98700,149000,149000,50300,34,5.0,1,0,11.0,available,instock,False,qua-nhieu-va-khong-du-gia-dinh-toi-da-tao-nen-nguoi-dan-ong-nguy-hiem-nhat-the-gioi-nhu-the-nao-p131138713.html?spid=131138714,Ph.D | MARY L. TRUM,Tiki Trading;131138714;98700 | Minhhabooks;134503304;119000 | MHbooks;135225519;128000 | Phương Đông Books;137863114;149000 | Cá Chép Bookstore;155613768;126000 | Tiệm sách Minh Hằng;190192848;119000 | VBooks;193568227;113240,"Nhà Sách Tiki | Sách tiếng Việt | Sách kinh tế | Sách quản trị, lãnh đạo | Quá Nhiều Và Không Đủ - Gia Đình Tôi Đã Tạo Nên Người Đàn Ông Nguy Hiểm Nhất Thế Giới Như Thế Nào ?",283
414170,Trump - 100 Lời Khuyên Đầu Tư Bất Động Sản Khôn Ngoan Nhất (2014),3300,2305,149000,169000,169000,20000,12,0.0,0,0,,available,backorder,False,trump-100-loi-khuyen-dau-tu-bat-dong-san-khon-ngoan-nhat-2014-p414170.html?spid=203958221,Donald Trump,HỆ THỐNG NHÀ SÁCH ABC;203958221;149000 | Nhà Sách Trẻ Online;261839008;117024 | Times Books;261839009;117324 | Tiệm Sách Hoa Hồng;261839010;117624 | VBooks;261839011;117624,"Nhà Sách Tiki | Sách tiếng Việt | Sách kinh tế | Sách quản trị, lãnh đạo | Trump - 100 Lời Khuyên Đầu Tư Bất Động Sản Khôn Ngoan Nhất (2014)",340
50497053,Combo Sách Quản Trị Kinh Doanh :  Độc Tôn Để Trường Tồn + Dám Lãnh Đạo,3300,1189,252000,361000,361000,109000,30,0.0,0,0,,available,backorder,False,combo-sach-quan-tri-kinh-doanh-doc-ton-de-truong-ton-dam-lanh-dao-p50497053.html?spid=89920999,Nhiều Tác Giả,Alpha Books Official;89920999;252000 | Nhà Sách Lifebooks;50497054;361000 | Times Books;55708406;275220 | VBooks;70831598;275520 | Sống Official;75411204;252700 | ETS Books;88950481;252700 | Omega Plus Books;88963884;252700 | Nhà Sách Vĩnh Thụy;116187941;344000 | Bamboo Books;180607132;262400 | HỆ THỐNG NHÀ SÁCH ABC;193130334;318000 | Zing Books;201000238;328000,"Nhà Sách Tiki | Sách tiếng Việt | Sách kinh tế | Sách quản trị, lãnh đạo | Combo Sách Quản Trị Kinh Doanh :  Độc Tôn Để Trường Tồn + Dám Lãnh Đạo",
88874467,Combo Các Chỉ Số Cốt Yếu Trong Quản Lý  + Hạnh Phúc Trong Công Việc ,3300,800,278000,398000,398000,120000,30,5.0,1,0,6.0,available,backorder,False,combo-cac-chi-so-cot-yeu-trong-quan-ly-hanh-phuc-trong-cong-viec-p88874467.html?spid=90709006,nhieu tac gia,Alpha Books Official;90709006;278000 | Sống Official;88874468;278600 | Nhà Sách Lifebooks;90635650;398000 | ETS Books;90642010;278600 | Omega Plus Books;90645149;278600 | AHABOOKS;91815997;375500 | Times Books;93274283;334020 | VBooks;161255875;334320 | Bamboo Books;178788098;318400 | HỆ THỐNG NHÀ SÁCH ABC;249667427;350000 | FishingBook;260791649;338300 | Nhà Sách Trẻ Online;261801758;333720 | Tiệm Sách Hoa Hồng;261801759;334320,"Nhà Sách Tiki | Sách tiếng Việt | Sách kinh tế | Sách quản trị, lãnh đạo | Combo Các Chỉ Số Cốt Yếu Trong Quản Lý  + Hạnh Phúc Trong Công Việc ",760
53991276,TRIBE OF MENTORS Lời Khuyên Từ Nhưng Nhà Cố Vẫn Hàng Đầu Thế Gioi Tập 2 sach bizbooks dh,3300,1138,132600,204000,204000,71400,35,0.0,0,0,1.0,available,backorder,False,tribe-of-mentors-loi-khuyen-tu-nhung-nha-co-van-hang-dau-the-gioi-tap-2-sach-bizbooks-dh-p53991276.html?spid=58107744,,The King of Books;58107744;132600 | Shop60s;57644587;204000 | info book;197636788;180000 | Nhà Sách Vĩnh Thụy;207332491;180000 | The 1991 Book;247861533;132600,"Nhà Sách Tiki | Sách tiếng Việt | Sách kinh tế | Sách quản trị, lãnh đạo | TRIBE OF MENTORS Lời Khuyên Từ Nhưng Nhà Cố Vẫn Hàng Đầu Thế Gioi Tập 2 sach bizbooks dh",
215136582,Quản Trị Nhân Sự Thời Gen Z,3300,158,169150,199000,199000,29850,15,0.0,0,0,1.0,available,backorder,False,quan-tri-nhan-su-thoi-gen-z-p215136582.html?spid=215136583,Hồng Duyên,Nhà sách Fahasa;215136583;169150 | info book;232500698;199000 | HỆ THỐNG NHÀ SÁCH ABC;247974563;175000 | VBooks;249821912;139300 | FishingBook;258929197;169150,"Nhà Sách Tiki | Sách tiếng Việt | Sách kinh tế | Sách quản trị, lãnh đạo | Quản Trị Nhân Sự Thời Gen Z",
163562688,"Tư duy doanh nhân, hành động lãnh đạo",3300,485,97500,150000,150000,52500,35,0.0,0,0,3.0,available,backorder,False,tu-duy-doanh-nhan-hanh-dong-lanh-dao-p163562688.html?spid=177911639,,Sách TKBooks ;177911639;97500 | MCBooks Hạnh Phúc;163562689;97500 | MCBooks Sài Gòn;183313311;97500 | info book;196577484;132000 | HỆ THỐNG NHÀ SÁCH ABC;203015282;132000 | Nhà Sách Vĩnh Thụy;203469239;132000 | Hiệu Sách Tự Do;212321661;128000,"Nhà Sách Tiki | Sách tiếng Việt | Sách kinh tế | Sách quản trị, lãnh đạo | Tư duy doanh nhân, hành động lãnh đạo",
119063863,Radical Focus - OKRs - Bí Mật Của Tăng Trưởng,3300,669,96000,109000,109000,13000,12,0.0,0,0,1.0,available,backorder,False,radical-focus-okrs-bi-mat-cua-tang-truong-p119063863.html?spid=192013150,Christina Wodtke,Nhà Sách Vĩnh Thụy;192013150;96000 | info book;121610024;96000 | Omega Plus Books;146198074;104300 | Bamboo Books;192306814;119200 | HỆ THỐNG NHÀ SÁCH ABC;203853293;131000 | FishingBook;260921324;126650,"Nhà Sách Tiki | Sách tiếng Việt | Sách kinh tế | Sách quản trị, lãnh đạo | Radical Focus - OKRs - Bí Mật Của Tăng Trưởng",208
129911079,Phụ Nữ Lãnh Đạo Bằng Yêu Thương (chìa khóa của thành công),3300,614,104000,118000,118000,14000,12,0.0,0,0,,available,backorder,False,phu-nu-lanh-dao-bang-yeu-thuong-chia-khoa-cua-thanh-cong-p129911079.html?spid=198640768,David Devin,info book;198640768;104000 | Nhà Sách Vĩnh Thụy;199005795;104000 | HỆ THỐNG NHÀ SÁCH ABC;201027604;104000,"Nhà Sách Tiki | Sách tiếng Việt | Sách kinh tế | Sách quản trị, lãnh đạo | Phụ Nữ Lãnh Đạo Bằng Yêu Thương (chìa khóa của thành công)",
173449364,Lãnh Đạo Giỏi Phải Biết Tạo Niềm Vui,3300,445,223270,269000,269000,45730,17,0.0,0,0,,available,backorder,False,lanh-dao-gioi-phai-biet-tao-niem-vui-p173449364.html?spid=173449365,Jurgen Appelo,Nhà sách Fahasa;173449365;223270 | Nhà Sách Vĩnh Thụy;173691353;237000 | Bamboo Books;180396301;215200 | info book;195029027;237000 | HỆ THỐNG NHÀ SÁCH ABC;195282999;237000 | Nhà Sách Trẻ Online;262050302;185110 | Times Books;262050303;185410 | Tiệm Sách Hoa Hồng;262050304;185610 | VBooks;262050305;185610,"Nhà Sách Tiki | Sách tiếng Việt | Sách kinh tế | Sách quản trị, lãnh đạo | Lãnh Đạo Giỏi Phải Biết Tạo Niềm Vui",
1617811,Nhà Lãnh Đạo 360° (Tái Bản 2018),3300,1925,158000,179000,179000,21000,12,5.0,1,0,3.0,available,backorder,False,nha-lanh-dao-360-tai-ban-2018-p1617811.html?spid=73755879,John C. Maxwell,Nhà Sách Vĩnh Thụy;73755879;158000 | nha sach nguyet linh;13720720;160550 | info book;76151940;158000 | HỆ THỐNG NHÀ SÁCH ABC;248003358;158000,"Nhà Sách Tiki | Sách tiếng Việt | Sách kinh tế | Sách quản trị, lãnh đạo | Nhà Lãnh Đạo 360° (Tái Bản 2018)",436
54998886,Combo 2 Cuốn Sách Giúp Bạn Mở Rộng Tầm Nhìn Trong Kinh Doanh : Chiến Lược Mở Rộng Kinh Doanh Từ Cốt Lõi + Một Đời Quản Trị ,3300,1126,272000,309000,309000,37000,12,0.0,0,0,,available,backorder,False,combo-2-cuon-sach-giup-ban-mo-rong-tam-nhin-trong-kinh-doanh-chien-luoc-mo-rong-kinh-doanh-tu-cot-loi-mot-doi-quan-tri-p54998886.html?spid=248197562,Phan Văn Trường |  Chris Zook,HỆ THỐNG NHÀ SÁCH ABC;248197562;272000 | AHABOOKS;54998887;268501,"Nhà Sách Tiki | Sách tiếng Việt | Sách kinh tế | Sách quản trị, lãnh đạo | Combo 2 Cuốn Sách Giúp Bạn Mở Rộng Tầm Nhìn Trong Kinh Doanh : Chiến Lược Mở Rộng Kinh Doanh Từ Cốt Lõi + Một Đời Quản Trị ",
194784157,Combo 2 Cuốn Quản Trị Doanh Nghiệp: Từ Nhân Viên Giỏi Đến Vị Sếp Tài Ba + 12 Quy Tắc Lãnh Đạo Từ Seal (Trách Nhiệm Tối Thượng - Thành Công Tối Đa),3300,309,286000,325000,325000,39000,12,0.0,0,0,,available,backorder,False,combo-2-cuon-quan-tri-doanh-nghiep-tu-nhan-vien-gioi-den-vi-sep-tai-ba-12-quy-tac-lanh-dao-tu-seal-trach-nhiem-toi-thuong-thanh-cong-toi-da-p194784157.html?spid=199972676,,Nhà Sách Vĩnh Thụy;199972676;286000 | AHABOOKS;194784158;277500,"Nhà Sách Tiki | Sách tiếng Việt | Sách kinh tế | Sách quản trị, lãnh đạo | Combo 2 Cuốn Quản Trị Doanh Nghiệp: Từ Nhân Viên Giỏi Đến Vị Sếp Tài Ba + 12 Quy Tắc Lãnh Đạo Từ Seal (Trách Nhiệm Tối Thượng - Thành Công Tối Đa)",
248574724,MBO - Công Cụ Quản Lý Công Việc Theo Mục Tiêu - Furukawa Hisataka Ikeda Hiroshi Yanagisawa Saori,3300,89,184000,209000,209000,25000,12,0.0,0,0,,available,backorder,False,mbo-cong-cu-quan-ly-cong-viec-theo-muc-tieu-furukawa-hisataka-ikeda-hiroshi-yanagisawa-saori-p248574724.html?spid=253347019,,HỆ THỐNG NHÀ SÁCH ABC;253347019;184000 | Nhà sách Anh Thành;248574725;215000,"Nhà Sách Tiki | Sách tiếng Việt | Sách kinh tế | Sách quản trị, lãnh đạo | MBO - Công Cụ Quản Lý Công Việc Theo Mục Tiêu - Furukawa Hisataka Ikeda Hiroshi Yanagisawa Saori",384
162161244,Lời khuyên từ những nhà cố vấn hàng đầu thế giới – Tribe of mentor (Tập 2)_ Sách hay mỗi ngày ,3300,490,180000,204000,204000,24000,12,0.0,0,0,,available,backorder,False,loi-khuyen-tu-nhung-nha-co-van-hang-dau-the-gioi-tribe-of-mentor-tap-2-_-sach-hay-moi-ngay-p162161244.html?spid=197636757,,info book;197636757;180000 | MCBooks Hạnh Phúc;162161245;132600 | Sách Doanh Nhân;178225976;119000 | HỆ THỐNG NHÀ SÁCH ABC;203083422;180000 | Nhà Sách Vĩnh Thụy;203428528;180000,"Nhà Sách Tiki | Sách tiếng Việt | Sách kinh tế | Sách quản trị, lãnh đạo | Lời khuyên từ những nhà cố vấn hàng đầu thế giới – Tribe of mentor (Tập 2)_ Sách hay mỗi ngày ",
215725896,Trải Nghiệm Khách Hàng Xuất Sắc,3300,151,204700,204700,204700,0,0,0.0,0,0,,available,backorder,False,trai-nghiem-khach-hang-xuat-sac-p215725896.html?spid=215725897,,Times Books;215725897;204700,"Nhà Sách Tiki | Sách tiếng Việt | Sách kinh tế | Sách quản trị, lãnh đạo | Trải Nghiệm Khách Hàng Xuất Sắc",
248789798,Thấy Những Gì Người Khác Bỏ Qua Và Dự Đoán Tương Lai,3300,87,87950,87950,87950,0,0,0.0,0,0,,available,backorder,False,thay-nhung-gi-nguoi-khac-bo-qua-va-du-doan-tuong-lai-p248789798.html?spid=248789799,,Nhà Sách Trẻ Online;248789799;87950 | Times Books;253325716;88250 | Tiệm Sách Hoa Hồng;253325717;88550 | VBooks;253325718;88550,"Nhà Sách Tiki | Sách tiếng Việt | Sách kinh tế | Sách quản trị, lãnh đạo | Thấy Những Gì Người Khác Bỏ Qua Và Dự Đoán Tương Lai",
248789671,Thấy Những Gì Người Khác Bỏ Qua Và Dự Đoán Tương Lai,3300,87,87950,87950,87950,0,0,0.0,0,0,,available,backorder,False,thay-nhung-gi-nguoi-khac-bo-qua-va-du-doan-tuong-lai-p248789671.html?spid=248789672,,Nhà Sách Trẻ Online;248789672;87950 | Times Books;253325719;88250 | Tiệm Sách Hoa Hồng;253325720;88550 | VBooks;253325723;88550,"Nhà Sách Tiki | Sách tiếng Việt | Sách kinh tế | Sách quản trị, lãnh đạo | Thấy Những Gì Người Khác Bỏ Qua Và Dự Đoán Tương Lai",
215111197,Chiến Lược Chăn Voi - Chiến lược chăn Voi là cách những doanh nhân thông minh có thể thu hút và giữ chân những chú Voi quan trọng – những khách hàng lớn,3300,158,85460,85460,85460,0,0,0.0,0,0,1.0,available,backorder,False,chien-luoc-chan-voi-chien-luoc-chan-voi-la-cach-nhung-doanh-nhan-thong-minh-co-the-thu-hut-va-giu-chan-nhung-chu-voi-quan-trong-nhung-khach-hang-lon-p215111197.html?spid=215111198,,Times Books;215111198;85460 | Tiệm sách Minh Hằng;225917369;101000,"Nhà Sách Tiki | Sách tiếng Việt | Sách kinh tế | Sách quản trị, lãnh đạo | Chiến Lược Chăn Voi - Chiến lược chăn Voi là cách những doanh nhân thông minh có thể thu hút và giữ chân những chú Voi quan trọng – những khách hàng lớn",
196376864,Sách: Cây thập tự ven đường,3300,293,109950,109950,109950,0,0,0.0,0,0,,available,backorder,False,sach-cay-thap-tu-ven-duong-p196376864.html?spid=205696009,,Nhà Sách Trẻ Online;205696009;109950 | Times Books;196376865;110250,"Nhà Sách Tiki | Sách tiếng Việt | Sách kinh tế | Sách quản trị, lãnh đạo | Sách: Cây thập tự ven đường",
200789863,Sách: Bộ Mặt Thật Của Tiền Điện Tử,3300,250,123950,123950,123950,0,0,0.0,0,0,,available,backorder,False,sach-bo-mat-that-cua-tien-dien-tu-p200789863.html?spid=200789864,,Tiệm Sách Hoa Hồng;200789864;123950,"Nhà Sách Tiki | Sách tiếng Việt | Sách kinh tế | Sách quản trị, lãnh đạo | Sách: Bộ Mặt Thật Của Tiền Điện Tử",
212961114,Biến Tầm Nhìn Thành Hành Động,3300,177,169000,169000,169000,0,0,0.0,0,0,,available,backorder,False,bien-tam-nhin-thanh-hanh-dong-p212961114.html?spid=213587899,John C. Maxwell,info book;213587899;169000,"Nhà Sách Tiki | Sách tiếng Việt | Sách kinh tế | Sách quản trị, lãnh đạo | Biến Tầm Nhìn Thành Hành Động",458
227759764,"Tư Duy Ngoài Khuôn Khổ - Lãnh Đạo Tiến Bộ, Đổi Mới Thế Hệ",3300,117,118560,152000,152000,33440,22,0.0,0,0,,available,backorder,False,tu-duy-ngoai-khuon-kho-lanh-dao-tien-bo-doi-moi-the-he-p227759764.html?spid=227759768,Rosabeth Moss Kanter,GOLD BOOKS;227759768;118560 | MHbooks;261945038;120000,"Nhà Sách Tiki | Sách tiếng Việt | Sách kinh tế | Sách quản trị, lãnh đạo | Tư Duy Ngoài Khuôn Khổ - Lãnh Đạo Tiến Bộ, Đổi Mới Thế Hệ",472
262664413,Tài Chính Dành Cho Sếp,3300,17,94010,119000,119000,24990,21,0.0,0,0,,available,backorder,False,sach-alphabooks-tai-chinh-danh-cho-sep-tai-ban-p262664413.html?spid=262664414,Harvard Business Review Press,GOLD BOOKS;262664414;94010,"Nhà Sách Tiki | Sách tiếng Việt | Sách kinh tế | Sách quản trị, lãnh đạo | Tài Chính Dành Cho Sếp",216
242767426,ĐÁNH GIÁ KẾT QUẢ ĐÀO TẠO (Kirkpatrick's Four Levels of Training Evaluation) - James D. Kirkpatrick và Wendy Kayser Kirkpatrick - Lê Hồng Vân dịch (bìa mềm),3300,105,242250,255000,255000,12750,5,0.0,0,0,,available,backorder,False,danh-gia-ket-qua-dao-tao-kirkpatrick-s-four-levels-of-training-evaluation-james-d-kirkpatrick-va-wendy-kayser-kirkpatrick-le-hong-van-dich-bia-mem-p242767426.html?spid=242767429,nhieu tac gia,Nhà Sách Khai Minh;242767429;242250,"Nhà Sách Tiki | Sách tiếng Việt | Sách kinh tế | Sách quản trị, lãnh đạo | ĐÁNH GIÁ KẾT QUẢ ĐÀO TẠO (Kirkpatrick's Four Levels of Training Evaluation) - James D. Kirkpatrick và Wendy Kayser Kirkpatrick - Lê Hồng Vân dịch (bìa mềm)",380
252169877,CHIẾN LƯỢC CƠ CHẾ CON NGƯỜI - THẾ KIỀNG 3C CỦA TỒN VINH DOANH NGHIỆP - Tôn Thất Nguyễn Thiêm - (bìa mềm),3300,63,128250,135000,135000,6750,5,0.0,0,0,,available,backorder,False,chien-luoc-co-che-con-nguoi-the-kieng-3c-cua-ton-vinh-doanh-nghiep-ton-that-nguyen-thiem-bia-mem-p252169877.html?spid=252169878,Tôn Thất Nguyễn Thiêm,Nhà Sách Khai Minh;252169878;128250,"Nhà Sách Tiki | Sách tiếng Việt | Sách kinh tế | Sách quản trị, lãnh đạo | CHIẾN LƯỢC CƠ CHẾ CON NGƯỜI - THẾ KIỀNG 3C CỦA TỒN VINH DOANH NGHIỆP - Tôn Thất Nguyễn Thiêm - (bìa mềm)",328
