id,name,data_version,day_ago_created ,price,list_price,original_price,discount,discount_rate,rating_average,review_count,favourite_count,all_time_quantity_sold,inventory_status,inventory_type,has_ebook ,url_path,authors,seller_name;spid;price,breadcrumbs,number_of_page
90332005,BỘ SÁCH - Biz Coaching: Quản Trị Doanh Nghiệp Từ Những Khối Óc Hàng Đầu Thế Giới,3300,794,974350,1499000,1499000,524650,35,0.0,0,0,1.0,available,backorder,False,bo-sach-biz-coaching-quan-tri-doanh-nghiep-tu-nhung-khoi-oc-hang-dau-the-gioi-p90332005.html?spid=101866276,nhieu tac gia,The King of Books;101866276;974350 | NVP;109176084;899400 | info book;197633840;1319000 | Nhà Sách Vĩnh Thụy;202595978;1319000 | HỆ THỐNG NHÀ SÁCH ABC;203228001;1319000,"Nhà Sách Tiki | Sách tiếng Việt | Sách kinh tế | Sách quản trị, lãnh đạo | BỘ SÁCH - Biz Coaching: Quản Trị Doanh Nghiệp Từ Những Khối Óc Hàng Đầu Thế Giới",1686
212047494,Lãnh Đạo Chuyển Hóa _PACE,3300,181,127000,155000,155000,28000,18,0.0,0,0,2.0,available,backorder,False,lanh-dao-chuyen-hoa-_pace-p212047494.html?spid=212047495,,NewShop Official;212047495;127000 | Bamboo Books;257914953;139500,"Nhà Sách Tiki | Sách tiếng Việt | Sách kinh tế | Sách quản trị, lãnh đạo | Lãnh Đạo Chuyển Hóa _PACE",360
249347295,21 Chiến Lược Lãnh Đạo Bản Thân Dành Cho Doanh Nhân,3300,81,230230,299000,299000,68770,23,0.0,0,0,9.0,available,backorder,False,21-chien-luoc-lanh-dao-ban-than-danh-cho-doanh-nhan-p249347295.html?spid=249347296,,Nhà sách Fahasa;249347296;230230,"Nhà Sách Tiki | Sách tiếng Việt | Sách kinh tế | Sách quản trị, lãnh đạo | 21 Chiến Lược Lãnh Đạo Bản Thân Dành Cho Doanh Nhân",
73183407,Sách Tự động hóa doanh nghiệp Tập 2,3300,938,699000,699000,699000,0,0,5.0,16,0,78.0,available,instock,False,sach-tu-dong-hoa-doanh-nghiep-tap-2-p73183407.html?spid=73183408,,KHO SÁCH PDCA;73183408;699000 | CEO BOOK STORE;108385429;699000,"Nhà Sách Tiki | Sách tiếng Việt | Sách kinh tế | Sách quản trị, lãnh đạo | Sách Tự động hóa doanh nghiệp Tập 2",362
57017912,Combo 2 Cuốn Sách Lãnh Đạo: Bí Mật Tài Chính Người Giàu (Trọn Bộ) - (Sách Kinh Tế / Quản Trị),3300,1090,148500,148500,148500,0,0,4.8,5,0,19.0,available,instock,False,combo-2-cuon-sach-lanh-dao-bi-mat-tai-chinh-nguoi-giau-tron-bo-sach-kinh-te-quan-tri-p57017912.html?spid=57017913,Nguyễn Minh Ngọc,AHABOOKS;57017913;148500,"Nhà Sách Tiki | Sách tiếng Việt | Sách kinh tế | Sách quản trị, lãnh đạo | Combo 2 Cuốn Sách Lãnh Đạo: Bí Mật Tài Chính Người Giàu (Trọn Bộ) - (Sách Kinh Tế / Quản Trị)",
195192245,HBR - On Change Management - Quản Lý Sự Thay Đổi (Tái Bản 2020),3300,308,228650,269000,269000,40350,15,0.0,0,0,1.0,available,backorder,False,hbr-on-change-management-quan-ly-su-thay-doi-tai-ban-2020-p195192245.html?spid=213963056,Harvard Business Review Press,Bamboo Books;213963056;228650 | info book;214053075;269000 | FishingBook;261953077;228650,"Nhà Sách Tiki | Sách tiếng Việt | Sách kinh tế | Sách quản trị, lãnh đạo | HBR - On Change Management - Quản Lý Sự Thay Đổi (Tái Bản 2020)",
253060233,Thuật Lãnh Đạo Từ Vị Tu Sĩ Bán Chiếc Ferrari _FN,3300,53,94000,118000,118000,24000,20,0.0,0,0,,available,backorder,False,thuat-lanh-dao-tu-vi-tu-si-ban-chiec-ferrari-_fn-p253060233.html?spid=253060234, Robin Sharma,NewShop Official;253060234;94000 | SEA BOOKS;262804748;94400,"Nhà Sách Tiki | Sách tiếng Việt | Sách kinh tế | Sách quản trị, lãnh đạo | Thuật Lãnh Đạo Từ Vị Tu Sĩ Bán Chiếc Ferrari _FN",352
107668501,Huấn Luyện Tự Thân - Lãnh Đạo Tự Thân,3300,728,94000,94000,94000,0,0,0.0,0,0,,available,backorder,False,huan-luyen-tu-than-lanh-dao-tu-than-p107668501.html?spid=190096581,Pamela McLean,Tiệm sách Minh Hằng;190096581;94000 | Tân Việt;109957484;119000 | Minhhabooks;114824263;94999,"Nhà Sách Tiki | Sách tiếng Việt | Sách kinh tế | Sách quản trị, lãnh đạo | Huấn Luyện Tự Thân - Lãnh Đạo Tự Thân",306
248086299,Bình yên nước Mỹ _BV,3300,92,140030,140030,140030,0,0,0.0,0,0,,available,backorder,False,binh-yen-nuoc-my-_bv-p248086299.html?spid=248086300,,Tiệm Sách Hoa Hồng;248086300;140030 | Minhhabooks;248801943;166000,"Nhà Sách Tiki | Sách tiếng Việt | Sách kinh tế | Sách quản trị, lãnh đạo | Bình yên nước Mỹ _BV",
357050,Bí Quyết Tuyển Dụng Và Đãi Ngộ Người Tài (Tái Bản 2012),3300,2305,53000,53000,53000,0,0,0.0,0,0,,available,backorder,False,bi-quyet-tuyen-dung-va-dai-ngo-nguoi-tai-tai-ban-2012-p357050.html?spid=259507780,Brian Tracy,Hiệu Sách Tự Do;259507780;53000,"Nhà Sách Tiki | Sách tiếng Việt | Sách kinh tế | Sách quản trị, lãnh đạo | Bí Quyết Tuyển Dụng Và Đãi Ngộ Người Tài (Tái Bản 2012)",136
47108021,"Bộ 2 cuốn:The Book Of Leadership - Dẫn Dắt Bản Thân, Đội Nhóm Và Tổ Chức Vươn Xa và Thủ Lĩnh Bộ Lạc – Thuật Lãnh Đạo Xuất Chúng Để Đưa Tổ Chức Vươn Tới Một Tầm Cao Mới TV",3300,1250,400000,400000,400000,0,0,0.0,0,0,,available,backorder,False,bo-2-cuon-the-book-of-leadership-dan-dat-ban-than-doi-nhom-va-to-chuc-vuon-xa-va-thu-linh-bo-lac-thuat-lanh-dao-xuat-chung-de-dua-to-chuc-vuon-toi-mot-tam-cao-moi-tv-p47108021.html?spid=67952602,,Shop60s;67952602;400000 | NVP;48093659;280000 | NhatPham0356;50075008;286000,"Nhà Sách Tiki | Sách tiếng Việt | Sách kinh tế | Sách quản trị, lãnh đạo | Bộ 2 cuốn:The Book Of Leadership - Dẫn Dắt Bản Thân, Đội Nhóm Và Tổ Chức Vươn Xa và Thủ Lĩnh Bộ Lạc – Thuật Lãnh Đạo Xuất Chúng Để Đưa Tổ Chức Vươn Tới Một Tầm Cao Mới TV",
104806756,Tôi Muốn Trở Thành Nhà Lãnh Đạo,3300,739,139300,199000,199000,59700,30,5.0,7,0,27.0,available,backorder,False,toi-muon-tro-thanh-nha-lanh-dao-p104806756.html?spid=106066499,Phạm Duy Hiếu,Omega Plus Books;106066499;139300 | Sống Official;106066568;139300 | Moonshine Shop;108672526;155000 | Nhà Sách Trẻ Online;108967395;137904 | Nhà Sách Vĩnh Thụy;117033707;190000 | info book;117840401;175000 | VBooks;161370703;138504 | Bamboo Books;180583106;159200 | HỆ THỐNG NHÀ SÁCH ABC;192105422;175000 | Đồ chơi giáo dục thông minh;192730840;139300 | FishingBook;260791696;169150 | Times Books;261809518;138204 | Tiệm Sách Hoa Hồng;261809519;138504,"Nhà Sách Tiki | Sách tiếng Việt | Sách kinh tế | Sách quản trị, lãnh đạo | Tôi Muốn Trở Thành Nhà Lãnh Đạo",216
100378795,Sách Tự Động Hóa Doanh Nghiệp Tập 2,3300,751,699000,699000,699000,0,0,3.5,2,0,17.0,available,backorder,False,sach-tu-dong-hoa-doanh-nghiep-tap-2-p100378795.html?spid=100378796,,PDCA Hoàng Đình Trọng;100378796;699000,"Nhà Sách Tiki | Sách tiếng Việt | Sách kinh tế | Sách quản trị, lãnh đạo | Sách Tự Động Hóa Doanh Nghiệp Tập 2",361
262055513,Nhà Lãnh Đạo 360 Độ,3300,23,125000,179000,179000,54000,30,0.0,0,0,,available,backorder,False,nha-lanh-dao-360-do-p262055513.html?spid=262078078,,Alpha Books Official;262078078;125000,"Nhà Sách Tiki | Sách tiếng Việt | Sách kinh tế | Sách quản trị, lãnh đạo | Nhà Lãnh Đạo 360 Độ",
531395,Xây Dựng Thương Hiệu Mạnh,3300,737992,33600,33600,33600,0,0,5.0,1,0,9.0,available,backorder,False,xay-dung-thuong-hieu-manh-p531395.html?spid=89424680,MBA. Nguyễn Văn Dung,Nhà Sách Kinh Tế Hương Huy;89424680;33600,"Nhà Sách Tiki | Sách tiếng Việt | Sách kinh tế | Sách quản trị, lãnh đạo | Xây Dựng Thương Hiệu Mạnh",230
253237721,7 Quy tắc tạo lập vị trí số Một của doanh nghiệp vừa và nhỏ,3300,29,76230,99000,99000,22770,23,0.0,0,0,,available,backorder,False,7-quy-tac-tao-lap-vi-tri-so-mot-cua-doanh-nghiep-vua-va-nho-p253237721.html?spid=253237722,Motoshi Sato,Nhà Xuất Bản Phụ Nữ Việt Nam;253237722;76230 | SÁCH ĐẠI NAM;260860855;97000,"Nhà Sách Tiki | Sách tiếng Việt | Sách kinh tế | Sách quản trị, lãnh đạo | 7 Quy tắc tạo lập vị trí số Một của doanh nghiệp vừa và nhỏ",
201631489,THAY ĐỔI TỪ TÂM - Cách Để Trở Thành Một Nhà Lãnh Đạo Chân Chính,3300,181,198000,198000,198000,0,0,0.0,0,0,9.0,available,backorder,False,thay-doi-tu-tam-p201631489.html?spid=201631490,,Scrumviet;201631490;198000,"Nhà Sách Tiki | Sách tiếng Việt | Sách kinh tế | Sách quản trị, lãnh đạo | THAY ĐỔI TỪ TÂM - Cách Để Trở Thành Một Nhà Lãnh Đạo Chân Chính",180
127807712,Combo 2 cuốn: 108 BÍ QUYẾT XÂY DỰNG ĐỘI NHÓM TRONG KINH DOANH THEO MẠNG (Lê Thị Lan) +  LÃNH ĐẠO TỪ TÂM (Nguyễn Quang Vịnh),3300,622,299000,436000,436000,137000,31,0.0,0,0,3.0,available,backorder,False,combo-2-cuon-108-bi-quyet-xay-dung-doi-nhom-trong-kinh-doanh-theo-mang-le-thi-lan-lanh-dao-tu-tam-nguyen-quang-vinh-p127807712.html?spid=173079226,,TRÙM SÁCH;173079226;299000 | Sbooks;127807713;409840 | NewShop Official;139512430;379320 | SÁCH TRÍ TUỆ;173378206;409840,"Nhà Sách Tiki | Sách tiếng Việt | Sách kinh tế | Sách quản trị, lãnh đạo | Combo 2 cuốn: 108 BÍ QUYẾT XÂY DỰNG ĐỘI NHÓM TRONG KINH DOANH THEO MẠNG (Lê Thị Lan) +  LÃNH ĐẠO TỪ TÂM (Nguyễn Quang Vịnh)",548
28312740,Bộ sách về ông trùm công nghệ: Sinh Ra Để Trở Thành Steve Jobs - Tesla Tương Lai Và Những Điều Viễn Tưởng,3300,1392,207000,207000,207000,0,0,0.0,0,0,1.0,available,backorder,False,bo-sach-ve-ong-trum-cong-nghe-sinh-ra-de-tro-thanh-steve-jobs-tesla-tuong-lai-va-nhung-dieu-vien-tuong-p28312740.html?spid=73400832,"Brent Schlender, Rick Tetzeli | Charles Morris",Geta;73400832;207000 | Nhà Sách Vĩnh Thụy;54904018;233000 | info book;59186298;215000 | HỆ THỐNG NHÀ SÁCH ABC;243356686;215000,"Nhà Sách Tiki | Sách tiếng Việt | Sách kinh tế | Sách quản trị, lãnh đạo | Bộ sách về ông trùm công nghệ: Sinh Ra Để Trở Thành Steve Jobs - Tesla Tương Lai Và Những Điều Viễn Tưởng",
55182607,"Combo Hành Trình Trở Thành Nhà Lãnh Đạo Truyền Cảm Hứng, Quản Trị Nhân Lực Giỏi: Nhà Lãnh Đạo Vạn Người Mê + Sức Mạnh Của Ngôn Từ (Top Sách Bán Chạy Về Quản Trị Kinh Doanh)",3300,1123,170500,170500,170500,0,0,0.0,0,0,10.0,available,instock,False,combo-hanh-trinh-tro-thanh-nha-lanh-dao-truyen-cam-hung-quan-tri-nhan-luc-gioi-nha-lanh-dao-van-nguoi-me-suc-manh-cua-ngon-tu-top-sach-ban-chay-ve-quan-tri-kinh-doanh-p55182607.html?spid=55182608,,Phương Đông Books;55182608;170500,"Nhà Sách Tiki | Sách tiếng Việt | Sách kinh tế | Sách quản trị, lãnh đạo | Combo Hành Trình Trở Thành Nhà Lãnh Đạo Truyền Cảm Hứng, Quản Trị Nhân Lực Giỏi: Nhà Lãnh Đạo Vạn Người Mê + Sức Mạnh Của Ngôn Từ (Top Sách Bán Chạy Về Quản Trị Kinh Doanh)",
206838141,Người Giàu Theo Quan Điểm Công Chúng,3300,208,170000,200000,200000,30000,15,0.0,0,0,,available,backorder,False,nguoi-giau-theo-quan-diem-cong-chung-p206838141.html?spid=243097919,,Nhà Sách Minh Đức;243097919;170000 | Sách Huế THT;206838142;200000 | Book Hunter;252561443;200000,"Nhà Sách Tiki | Sách tiếng Việt | Sách kinh tế | Sách quản trị, lãnh đạo | Người Giàu Theo Quan Điểm Công Chúng",396
137129973,Sách Đạo Đức Kinh Doanh - Cẩm Nang Quản Lý Doanh Nghiệp Kinh Doanh Có Trách Nhiệm Trong Các Nền Kinh Tế Thị Trường Mới Nổi,3300,593,71550,71550,71550,0,0,5.0,1,0,8.0,available,backorder,False,sach-dao-duc-kinh-doanh-cam-nang-quan-ly-doanh-nghiep-kinh-doanh-co-trach-nhiem-trong-cac-nen-kinh-te-thi-truong-moi-noi-p137129973.html?spid=137129974,Bộ Thương Mại Hoa Kỳ,Nhà Sách Phương Nam;137129974;71550,"Nhà Sách Tiki | Sách tiếng Việt | Sách kinh tế | Sách quản trị, lãnh đạo | Sách Đạo Đức Kinh Doanh - Cẩm Nang Quản Lý Doanh Nghiệp Kinh Doanh Có Trách Nhiệm Trong Các Nền Kinh Tế Thị Trường Mới Nổi",448
170824152,COMBO 9 CHIẾN LƯỢC QUYỀN LỰC,3300,456,225000,225000,225000,0,0,0.0,0,0,2.0,available,backorder,False,combo-9-chien-luoc-quyen-luc-p170824152.html?spid=170824154,,Minhhabooks;170824154;225000,"Nhà Sách Tiki | Sách tiếng Việt | Sách kinh tế | Sách quản trị, lãnh đạo | COMBO 9 CHIẾN LƯỢC QUYỀN LỰC",
76252016,Sách Combo 2 cuốn dành cho nhà lãnh đạo Bí quyết đối mặt & khắc phục rủi ro dành cho nhà lãnh đạo+Bí quyết ra quyết định dành cho nhà lãnh đạo,3300,875,168000,198000,198000,30000,15,0.0,0,0,4.0,available,backorder,False,sach-combo-2-cuon-danh-cho-nha-lanh-dao-bi-quyet-doi-mat-khac-phuc-rui-ro-danh-cho-nha-lanh-dao-bi-quyet-ra-quyet-dinh-danh-cho-nha-lanh-dao-p76252016.html?spid=176835099,Son Masayoshi,NewShop Official;176835099;168000 | Pandabooks Hiệu Sách;76252017;148500,"Nhà Sách Tiki | Sách tiếng Việt | Sách kinh tế | Sách quản trị, lãnh đạo | Sách Combo 2 cuốn dành cho nhà lãnh đạo Bí quyết đối mặt & khắc phục rủi ro dành cho nhà lãnh đạo+Bí quyết ra quyết định dành cho nhà lãnh đạo",184
138327454,Dẫn Dắt Sự Thay Đổi (Tái bản năm 2018),3300,588,114000,129000,129000,15000,12,0.0,0,0,,available,backorder,False,dan-dat-su-thay-doi-tai-ban-nam-2018-p138327454.html?spid=249026419,John P. Kotter,HỆ THỐNG NHÀ SÁCH ABC;249026419;114000 | VBooks;249593362;89010 | Nhà Sách Trẻ Online;261943980;88510 | Times Books;261943981;88810 | Tiệm Sách Hoa Hồng;261943982;89010,"Nhà Sách Tiki | Sách tiếng Việt | Sách kinh tế | Sách quản trị, lãnh đạo | Dẫn Dắt Sự Thay Đổi (Tái bản năm 2018)",287
24835043,Combo John C. Maxwell: Thuật Đắc Nhân Tâm + 21 Phẩm Chất Vàng Của Nhà Lãnh Đạo,3300,1418,236000,268000,268000,32000,12,0.0,0,0,,available,backorder,False,combo-john-c-maxwell-thuat-dac-nhan-tam-21-pham-chat-vang-cua-nha-lanh-dao-p24835043.html?spid=249650716,,HỆ THỐNG NHÀ SÁCH ABC;249650716;236000 | Phương Đông Books;27746133;240500 | nha sach nguyet linh;31052431;255000 | Nhà Sách Đinh Lễ;34363412;247000 | Nhà Sách Lifebooks;52850170;251000 | Times Books;55568319;194748 | info book;119645838;241000 | Bamboo Books;185306404;262400 | Zing Books;200793268;258000,"Nhà Sách Tiki | Sách tiếng Việt | Sách kinh tế | Sách quản trị, lãnh đạo | Combo John C. Maxwell: Thuật Đắc Nhân Tâm + 21 Phẩm Chất Vàng Của Nhà Lãnh Đạo",
250096244,Quy Luật Bất Biến Về Lãnh Đạo,3300,73,92500,92500,92500,0,0,0.0,0,0,3.0,available,backorder,False,quy-luat-bat-bien-ve-lanh-dao-p250096244.html?spid=251756912,,VIETNAMBOOK;251756912;92500 | Nhà sách NetaBooks;250096245;92650 | nha sach nguyet linh;251267824;103550 | Nhà Sách Đinh Lễ;251268966;109000 | Bamboo Books;251452207;98100 | Nhà Sách Vĩnh Thụy;252681902;109000 | info book;259645060;98000 | Tiệm sách Minh Hằng;260926394;86000,"Nhà Sách Tiki | Sách tiếng Việt | Sách kinh tế | Sách quản trị, lãnh đạo | Quy Luật Bất Biến Về Lãnh Đạo",256
686525,24/8 - Để Dẫn Đầu Trong Mọi Cuộc Đua,3300,2198,67500,75000,75000,7500,10,0.0,0,0,1.0,available,backorder,False,24-8-de-dan-dau-trong-moi-cuoc-dua-p686525.html?spid=20446504,Amit Offir,Nhà sách Fahasa;20446504;67500 | Tiki Trading;686528;49700 | Nhà Sách Vĩnh Thụy;202002249;66000 | info book;208188786;66000 | Nhà sách PLV;212943745;75000,"Nhà Sách Tiki | Sách tiếng Việt | Sách kinh tế | Sách quản trị, lãnh đạo | 24/8 - Để Dẫn Đầu Trong Mọi Cuộc Đua",192
54423067,Quyết định,3300,1135,93000,152000,152000,59000,39,0.0,0,0,,available,backorder,False,quyet-dinh-p54423067.html?spid=56438190,,Bookstores;56438190;93000,"Nhà Sách Tiki | Sách tiếng Việt | Sách kinh tế | Sách quản trị, lãnh đạo | Quyết định",
32582465,Lãnh Đạo Tích Cực - Thành Công Vượt Bậc,3300,1372,115440,148000,148000,32560,22,1.0,1,0,11.0,available,backorder,False,lanh-dao-tich-cuc-thanh-cong-vuot-bac-p32582465.html?spid=34749992,Jan Mühlfeit | Melina Costi,Nhà sách Fahasa;34749992;115440 | Nhà Sách Vĩnh Thụy;72569682;130000 | BOOKS AND LIFE;72750902;111000 | Saigon Books Official;155889679;75480 | HỆ THỐNG NHÀ SÁCH ABC;205428724;130000 | Times Books;215737477;121060,"Nhà Sách Tiki | Sách tiếng Việt | Sách kinh tế | Sách quản trị, lãnh đạo | Lãnh Đạo Tích Cực - Thành Công Vượt Bậc",416
20437994,Combo sách kinh doanh thật dễ dàng : The First time manager lần đầu làm sếp - Những mẹo mực quản lý độc đáo và thú vị + Running learn vận hành tinh  gọn bộ công cụ chiến lược dành cho Start- up - Tặng kèm bookmark thiết kế,3300,1462,258500,258500,258500,0,0,0.0,0,0,7.0,available,backorder,False,combo-sach-kinh-doanh-that-de-dang-the-first-time-manager-lan-dau-lam-sep-nhung-meo-muc-quan-ly-doc-dao-va-thu-vi-running-learn-van-hanh-tinh-gon-bo-cong-cu-chien-luoc-danh-cho-start-up-tang-kem-bookmark-thiet-ke-p20437994.html?spid=20437995,Nhiều Tác Giả,AHABOOKS;20437995;258500,"Nhà Sách Tiki | Sách tiếng Việt | Sách kinh tế | Sách quản trị, lãnh đạo | Combo sách kinh doanh thật dễ dàng : The First time manager lần đầu làm sếp - Những mẹo mực quản lý độc đáo và thú vị + Running learn vận hành tinh  gọn bộ công cụ chiến lược dành cho Start- up - Tặng kèm bookmark thiết kế",399
222614828,Cách Quản Trị Của Amazon,3300,116,164000,205000,205000,41000,20,0.0,0,0,2.0,available,backorder,False,cach-quan-tri-cua-amazon-p222614828.html?spid=222614829,Bill Carr,Bảo Châu Books;222614829;164000 | Bamboo Books;257914976;184500 | Nhà Sách Tri Văn;262885993;205000,"Nhà Sách Tiki | Sách tiếng Việt | Sách kinh tế | Sách quản trị, lãnh đạo | Cách Quản Trị Của Amazon",352
121604692,"Combo06 cuốn: WHO? Chuyện kể về danh nhân thế giới: Lionel Messi, Pele, Michael Jordan, Usain Bolt, Michael Jackson, K-pop Twice",3300,649,282000,300000,300000,18000,6,5.0,1,0,16.0,available,backorder,False,combo06-cuon-who-chuyen-ke-ve-danh-nhan-the-gioi-lionel-messi-pele-michael-jordan-usain-bolt-michael-jackson-k-pop-twice-p121604692.html?spid=121604695,,Tủ sách Hoa Hướng Dương;121604695;282000,"Nhà Sách Tiki | Sách tiếng Việt | Sách kinh tế | Sách quản trị, lãnh đạo | Combo06 cuốn: WHO? Chuyện kể về danh nhân thế giới: Lionel Messi, Pele, Michael Jordan, Usain Bolt, Michael Jackson, K-pop Twice",
68943075,Bill Gates: Tham Vọng Lớn Lao Và Quá Trình Hình Thành Đế Chế Microsoft + Nhà Lãnh Đạo 4.0,3300,987,278600,398000,398000,119400,30,0.0,0,0,,available,backorder,False,bill-gates-tham-vong-lon-lao-va-qua-trinh-hinh-thanh-de-che-microsoft-nha-lanh-dao-4-0-p68943075.html?spid=76590586,,Alpha Books Official;76590586;278600 | Sống Official;75580831;299600,"Nhà Sách Tiki | Sách tiếng Việt | Sách kinh tế | Sách quản trị, lãnh đạo | Bill Gates: Tham Vọng Lớn Lao Và Quá Trình Hình Thành Đế Chế Microsoft + Nhà Lãnh Đạo 4.0",
208403367,HBR On - Nền Tảng Và Hệ Sinh Thái Trong Chiến Lược Kinh Doanh,3300,194,215200,269000,269000,53800,20,0.0,0,0,2.0,available,backorder,False,hbr-on-nen-tang-va-he-sinh-thai-trong-chien-luoc-kinh-doanh-p208403367.html?spid=208403368,Harvard Business Review,Nhà sách Fahasa;208403368;215200 | HỆ THỐNG NHÀ SÁCH ABC;248538334;237000 | FishingBook;258929168;228650,"Nhà Sách Tiki | Sách tiếng Việt | Sách kinh tế | Sách quản trị, lãnh đạo | HBR On - Nền Tảng Và Hệ Sinh Thái Trong Chiến Lược Kinh Doanh",
207395693,Cắt Giảm Chi Phí - Quản Lý Kiểm Soát Và Chuyển Đổi Phí Thành Lợi Nhuận,3300,204,153550,185000,185000,31450,17,0.0,0,0,1.0,available,backorder,False,cat-giam-chi-phi-quan-ly-kiem-soat-va-chuyen-doi-phi-thanh-loi-nhuan-p207395693.html?spid=207395694,,Nhà sách Fahasa;207395694;153550 | HỆ THỐNG NHÀ SÁCH ABC;208105553;185000 | info book;214604869;185000,"Nhà Sách Tiki | Sách tiếng Việt | Sách kinh tế | Sách quản trị, lãnh đạo | Cắt Giảm Chi Phí - Quản Lý Kiểm Soát Và Chuyển Đổi Phí Thành Lợi Nhuận",
750781,Quy Tắc Của Google - Google Tuyển Dụng Và Giữ Chân Nhân Tài Như Thế Nào?,3300,2154,152800,219000,219000,66200,30,0.0,0,0,,available,backorder,False,quy-tac-cua-google-p750781.html?spid=98573228,Laszlo Bock,Omega Plus Books;98573228;152800 | Times Books;56077159;150910 | ETS Books;104874751;153300 | Nhà Sách Vĩnh Thụy;173909989;193000 | Bamboo Books;178585772;175200 | Trạm đọc;179059521;152424 | HỆ THỐNG NHÀ SÁCH ABC;197693289;193000 | Nhà Sách Trẻ Online;262055988;150610 | Tiệm Sách Hoa Hồng;262055991;151110 | VBooks;262055992;151110,"Nhà Sách Tiki | Sách tiếng Việt | Sách kinh tế | Sách quản trị, lãnh đạo | Quy Tắc Của Google - Google Tuyển Dụng Và Giữ Chân Nhân Tài Như Thế Nào?",430
115758511,Nhà lãnh đạo tương lai: 140 CEO và 14.000 nhân viên toàn cầu nói gì về lãnh đạo? (The Future Leader) - Tác giả Jacob Morgan,3300,691,175000,250000,250000,75000,30,0.0,0,0,5.0,available,backorder,False,nha-lanh-dao-tuong-lai-140-ceo-va-14-000-nhan-vien-toan-cau-noi-gi-ve-lanh-dao-the-future-leader-tac-gia-jacob-morgan-p115758511.html?spid=115758517,Jacob Morgan,BOOKS CITY;115758517;175000 | info book;120568063;240000 | Nhà Sách Vĩnh Thụy;120653449;239000 | HỆ THỐNG NHÀ SÁCH ABC;247374414;220000,"Nhà Sách Tiki | Sách tiếng Việt | Sách kinh tế | Sách quản trị, lãnh đạo | Nhà lãnh đạo tương lai: 140 CEO và 14.000 nhân viên toàn cầu nói gì về lãnh đạo? (The Future Leader) - Tác giả Jacob Morgan",384
37882015,Bộ Sách Bách Khoa Toàn Thư Về Quản Lý Dự Án - Chỉ Dẫn Bạn Mọi Thứ Về Quản Lý Dự Án ( Quản Trị Dự Án - Những Nguyên Tắc Căn Bản + Checklist Thông Minh Cho Mọi Dự Án + Tất Tần Tật Về Quản Lý Dự Án ) tặng kèm bookmark Sáng Tạo,3300,1330,332000,377000,377000,45000,12,0.0,0,0,,available,backorder,False,bo-sach-bach-khoa-toan-thu-ve-quan-ly-du-an-chi-dan-ban-moi-thu-ve-quan-ly-du-an-quan-tri-du-an-nhung-nguyen-tac-can-ban-checklist-thong-minh-cho-moi-du-an-tat-tan-tat-ve-quan-ly-du-an-tang-kem-bookmark-sang-tao-p37882015.html?spid=192859285,Nhiều Tác Giả,HỆ THỐNG NHÀ SÁCH ABC;192859285;332000 | Tiệm Sách Hoa Hồng;54759826;316680 | Times Books;55724454;316680,"Nhà Sách Tiki | Sách tiếng Việt | Sách kinh tế | Sách quản trị, lãnh đạo | Bộ Sách Bách Khoa Toàn Thư Về Quản Lý Dự Án - Chỉ Dẫn Bạn Mọi Thứ Về Quản Lý Dự Án ( Quản Trị Dự Án - Những Nguyên Tắc Căn Bản + Checklist Thông Minh Cho Mọi Dự Án + Tất Tần Tật Về Quản Lý Dự Án ) tặng kèm bookmark Sáng Tạo",
187601118,Thuật Lãnh Đạo Của Người Do Thái,3300,362,113000,128000,128000,15000,12,0.0,0,0,1.0,available,backorder,False,thuat-lanh-dao-cua-nguoi-do-thai-p187601118.html?spid=187601119,Erica Brown,Nhà Sách Thành An;187601119;113000,"Nhà Sách Tiki | Sách tiếng Việt | Sách kinh tế | Sách quản trị, lãnh đạo | Thuật Lãnh Đạo Của Người Do Thái",
992029,Tự Phát Triển 101 – Những Điều Nhà Lãnh Đạo Cần Biết,3300,2011,56050,59000,59000,2950,5,5.0,6,0,43.0,available,backorder,False,tu-phat-trien-101-nhung-dieu-nha-lanh-dao-can-biet-p992029.html?spid=26652377,John C. Maxwell,Nhà sách Fahasa;26652377;56050 | The King of Books;58112655;38350 | Shop60s;70624457;59000 | info book;173807796;52000 | HỆ THỐNG NHÀ SÁCH ABC;203128204;52000,"Nhà Sách Tiki | Sách tiếng Việt | Sách kinh tế | Sách quản trị, lãnh đạo | Tự Phát Triển 101 – Những Điều Nhà Lãnh Đạo Cần Biết",140
102876151,Combo Sách Harvard Business Review - Đằng sau 1 quyết định lớn + Tư duy lãnh đạo Hành động lãnh đạo + Cẩm nang quản lý,3300,746,291720,374000,374000,82280,22,4.0,2,0,11.0,available,backorder,False,combo-sach-harvard-business-review-dang-sau-1-quyet-dinh-lon-tu-duy-lanh-dao-hanh-dong-lanh-dao-cam-nang-quan-ly-p102876151.html?spid=102876152,nhieu tac gia,First News;102876152;291720 | Bamboo Books;197411709;317900,"Nhà Sách Tiki | Sách tiếng Việt | Sách kinh tế | Sách quản trị, lãnh đạo | Combo Sách Harvard Business Review - Đằng sau 1 quyết định lớn + Tư duy lãnh đạo Hành động lãnh đạo + Cẩm nang quản lý",
155531932,How Management Works - Hiểu Hết Về Quản Lý,3300,531,270000,330000,330000,60000,18,5.0,1,0,14.0,available,backorder,False,how-management-works-hieu-het-ve-quan-ly-p155531932.html?spid=155531933,DK,Nhà sách Fahasa;155531933;270000 | Bamboo Books;185179975;297000 | Nhà Sách Vĩnh Thụy;199167736;290000 | SÁCH ĐẠI NAM;248912286;330000 | FishingBook;253141763;297000,"Nhà Sách Tiki | Sách tiếng Việt | Sách kinh tế | Sách quản trị, lãnh đạo | How Management Works - Hiểu Hết Về Quản Lý",
