id,name,data_version,day_ago_created ,price,list_price,original_price,discount,discount_rate,rating_average,review_count,favourite_count,all_time_quantity_sold,inventory_status,inventory_type,has_ebook ,url_path,authors,seller_name;spid;price,breadcrumbs,number_of_page
108957019,Bộ Sách Về Nghệ Thuật Lãnh Đạo Và Phát Triển Doanh Nghiệp (Bộ 3 Cuốn),3300,721,346860,423000,423000,76140,18,0.0,0,0,,available,backorder,False,bo-sach-ve-nghe-thuat-lanh-dao-va-phat-trien-doanh-nghiep-bo-3-cuon-p108957019.html?spid=108957020,Nhiều Tác Giả | Nhiều Tác Giả | Nhiều tác giả | Nhiều Tác Giả  | Nhiều Tác giả | nhieu tac gia | nhieu tac gia | nhieu tac gia | nhieu tac gia | nhieu tac gia | nhieu tac gia | nhieu tac gia | nhieu tac gia | nhieu tac gia | nhieu tac gia | nhieu tac gia | nhieu tac gia | nhieu tac gia | nhieu tac gia | nhieu tac gia | nhieu tac gia | nhieu tac gia | nhieu tac gia | nhieu tac gia | nhieu tac gia | nhieu tac gia | nhieu tac gia | nhieu tac gia | nhieu tac gia | nhieu tac gia | nhieu tac gia | nhieu tac gia | nhieu tac gia | nhieu tac gia | nhieu tac gia | nhieu tac gia | nhieu tac gia | nhieu tac gia | nhieu tac gia | nhieu tac gia | nhieu tac gia | nhieu tac gia | nhieu tac gia | nhieu tac gia | nhieu tac gia | nhieu tac gia | nhieu tac gia | nhieu tac gia | nhieu tac gia | nhieu tac gia | nhieu tac gia | nhieu tac gia | nhieu tac gia | nhieu tac gia | nhieu tac gia | nhieu tac gia | nhieu tac gia | nhieu tac gia | nhieu tac gia | nhiều tác giả | Nhiều Tác Gỉa,Nhà sách Fahasa;108957020;346860 | Minhhabooks;114810121;338000 | MHbooks;120567831;348000 | Tiệm sách Minh Hằng;190193967;338000,"Nhà Sách Tiki | Sách tiếng Việt | Sách kinh tế | Sách quản trị, lãnh đạo | Bộ Sách Về Nghệ Thuật Lãnh Đạo Và Phát Triển Doanh Nghiệp (Bộ 3 Cuốn)",
200023618,Combo 4Q Hay Nhất Của Robin Sharma : Khám Phá Vận Mệnh - 7 Bước Đánh Thức Bản Thân + Trí Tuệ Gia Đình - Từ Vị Tu Sĩ Bán Đi Chiếc Ferrari + Vị Tu Sĩ Bán Chiếc Ferrari + Thuật Lãnh Đạo Từ Vị Tu Sĩ Bán Chiếc Ferrari (Tặng Kèm Bookmark Bamboo Books),3300,254,491000,491000,491000,0,0,5.0,1,0,6.0,available,backorder,False,combo-4q-hay-nhat-cua-robin-sharma-kham-pha-van-menh-7-buoc-danh-thuc-ban-than-tri-tue-gia-dinh-tu-vi-tu-si-ban-di-chiec-ferrari-vi-tu-si-ban-chiec-ferrari-thuat-lanh-dao-tu-vi-tu-si-ban-chiec-ferrari-tang-kem-bookmark-bamboo-books-p200023618.html?spid=200023619,,Bamboo Books;200023619;491000,"Nhà Sách Tiki | Sách tiếng Việt | Sách kinh tế | Sách quản trị, lãnh đạo | Combo 4Q Hay Nhất Của Robin Sharma : Khám Phá Vận Mệnh - 7 Bước Đánh Thức Bản Thân + Trí Tuệ Gia Đình - Từ Vị Tu Sĩ Bán Đi Chiếc Ferrari + Vị Tu Sĩ Bán Chiếc Ferrari + Thuật Lãnh Đạo Từ Vị Tu Sĩ Bán Chiếc Ferrari (Tặng Kèm Bookmark Bamboo Books)",
187156452,Combo 3 Cuốn Nhà Lãnh Đạo Không Chức Danh - Đời Ngắn Lắm Đừng Ngủ Dài - Điều Vĩ Đại Đời Thường (Tái Bản),3300,362,262800,292000,292000,29200,10,0.0,0,0,1.0,available,backorder,False,combo-3-cuon-nha-lanh-dao-khong-chuc-danh-doi-ngan-lam-dung-ngu-dai-dieu-vi-dai-doi-thuong-tai-ban-p187156452.html?spid=192720396, Robin Sharma,Bamboo Books;192720396;262800 | NHASACHTRITUE;187156453;239360 | FishingBook;252653309;262800,"Nhà Sách Tiki | Sách tiếng Việt | Sách kinh tế | Sách quản trị, lãnh đạo | Combo 3 Cuốn Nhà Lãnh Đạo Không Chức Danh - Đời Ngắn Lắm Đừng Ngủ Dài - Điều Vĩ Đại Đời Thường (Tái Bản)",
252040890,Nâng Tầm - 5 Bước Chuyển Mình Cho Doanh Nghiệp Của Bạn,3300,66,139000,167000,167000,28000,17,0.0,0,0,,available,backorder,False,nang-tam-5-buoc-chuyen-minh-cho-doanh-nghiep-cua-ban-p252040890.html?spid=252040891,,Nhân Văn;252040891;139000 | Nhà sách PLV;252183449;167000,"Nhà Sách Tiki | Sách tiếng Việt | Sách kinh tế | Sách quản trị, lãnh đạo | Nâng Tầm - 5 Bước Chuyển Mình Cho Doanh Nghiệp Của Bạn",
109369047,Những Vị Thần Quản Lý,3300,720,160550,169000,169000,8450,5,0.0,0,0,1.0,available,backorder,False,nhung-vi-than-quan-ly-p109369047.html?spid=109369048,Kim Jin Su,Nhà sách Fahasa;109369048;160550 | Times Books;139139708;138280 | VBooks;140357049;138580 | Bamboo Books;248292650;152100 | FishingBook;253268840;152100 | SÁCH ĐẠI NAM;261037113;167000,"Nhà Sách Tiki | Sách tiếng Việt | Sách kinh tế | Sách quản trị, lãnh đạo | Những Vị Thần Quản Lý",
5573471,Nhà lãnh đạo kim cương,3300,1708,132000,186000,186000,54000,29,0.0,0,0,,available,backorder,False,nha-lanh-dao-kim-cuong-p5573471.html?spid=147337215,,Nhân Văn;147337215;132000,"Nhà Sách Tiki | Sách tiếng Việt | Sách kinh tế | Sách quản trị, lãnh đạo | Nhà lãnh đạo kim cương",384
121602648,WHO? Chuyện kể về danh nhân thế giới - Michael Jackson,3300,650,52000,55000,55000,3000,5,5.0,3,0,18.0,available,backorder,False,who-chuyen-ke-ve-danh-nhan-the-gioi-michael-jackson-p121602648.html?spid=121602649,,Tủ sách Hoa Hướng Dương;121602649;52000,"Nhà Sách Tiki | Sách tiếng Việt | Sách kinh tế | Sách quản trị, lãnh đạo | WHO? Chuyện kể về danh nhân thế giới - Michael Jackson",
247719154,Tinh Hoa Quản Trị Dự Án _FN,3300,96,117300,138000,138000,20700,15,0.0,0,0,,available,backorder,False,tinh-hoa-quan-tri-du-an-_fn-p247719154.html?spid=263049428,,Bamboo Books;263049428;117300 | Tiệm Sách Hoa Hồng;247719155;114540 | info book;262067687;124000 | Nhà Sách Trẻ Online;263019748;113940 | Times Books;263019749;114240 | VBooks;263019750;114540,"Nhà Sách Tiki | Sách tiếng Việt | Sách kinh tế | Sách quản trị, lãnh đạo | Tinh Hoa Quản Trị Dự Án _FN",
215548583,Nhà Lãnh Đạo Đáng Tin Cậy (SGB),3300,153,167000,190000,190000,23000,12,0.0,0,0,,available,backorder,False,nha-lanh-dao-dang-tin-cay-sgb-p215548583.html?spid=247546249,,HỆ THỐNG NHÀ SÁCH ABC;247546249;167000 | Tiệm Sách Hoa Hồng;215548584;155800 | Times Books;215730405;155500 | Nhà Sách Trẻ Online;253242147;155200,"Nhà Sách Tiki | Sách tiếng Việt | Sách kinh tế | Sách quản trị, lãnh đạo | Nhà Lãnh Đạo Đáng Tin Cậy (SGB)",
33478047,Bộ Sách Về Đổi Mới Sáng Tạo Dành Cho Các CEO ( Giải Pháp Cho Đổi Mới Và Sáng Tạo + Đổi Mới Từ Cốt Lõi + Mã Gen Của Nhà Cải Cách ) tặng kèm bookmark Sáng Tạo,3300,1363,402000,457000,457000,55000,12,0.0,0,0,,available,backorder,False,bo-sach-ve-doi-moi-sang-tao-danh-cho-cac-ceo-giai-phap-cho-doi-moi-va-sang-tao-doi-moi-tu-cot-loi-ma-gen-cua-nha-cai-cach-tang-kem-bookmark-sang-tao-p33478047.html?spid=212333724,Nhiều Tác Giả,info book;212333724;402000 | Phương Đông Books;34918494;350512,"Nhà Sách Tiki | Sách tiếng Việt | Sách kinh tế | Sách quản trị, lãnh đạo | Bộ Sách Về Đổi Mới Sáng Tạo Dành Cho Các CEO ( Giải Pháp Cho Đổi Mới Và Sáng Tạo + Đổi Mới Từ Cốt Lõi + Mã Gen Của Nhà Cải Cách ) tặng kèm bookmark Sáng Tạo",
159899566,Bộ 2 Cuốn Lãnh Đạo Hoàn Hảo: 100 Phương Pháp Truyền Động Lực Cho Đội Nhóm Chiến Thắng + 100 Phương Pháp Thúc Đẩy Mọi Người - MinhAnBooks,3300,516,226000,257000,257000,31000,12,0.0,0,0,,available,backorder,False,bo-2-cuon-lanh-dao-hoan-hao-100-phuong-phap-truyen-dong-luc-cho-doi-nhom-chien-thang-100-phuong-phap-thuc-day-moi-nguoi-minhanbooks-p159899566.html?spid=203491241,,Nhà Sách Vĩnh Thụy;203491241;226000,"Nhà Sách Tiki | Sách tiếng Việt | Sách kinh tế | Sách quản trị, lãnh đạo | Bộ 2 Cuốn Lãnh Đạo Hoàn Hảo: 100 Phương Pháp Truyền Động Lực Cho Đội Nhóm Chiến Thắng + 100 Phương Pháp Thúc Đẩy Mọi Người - MinhAnBooks",
217125623,Sách Một Đời Quản Trị,3300,132,180000,200000,200000,20000,10,0.0,0,0,,available,backorder,False,sach-mot-doi-quan-tri-p217125623.html?spid=217125627,,Nhà Sách Dalifa;217125627;180000,"Nhà Sách Tiki | Sách tiếng Việt | Sách kinh tế | Sách quản trị, lãnh đạo | Sách Một Đời Quản Trị",
230368345,SỰ SUY TÀN CỦA QUYỀN LỰC    (*** CHÍNH HÃNG ***),3300,113,106230,106230,106230,0,0,0.0,0,0,,available,backorder,False,su-suy-tan-cua-quyen-luc-chinh-hang-p230368345.html?spid=248783226,,Times Books;248783226;106230 | VBooks;230368346;106530,"Nhà Sách Tiki | Sách tiếng Việt | Sách kinh tế | Sách quản trị, lãnh đạo | SỰ SUY TÀN CỦA QUYỀN LỰC    (*** CHÍNH HÃNG ***)",
215105241,Kẻ Bám Đuổi - Truyện trinh thám,3300,158,123650,123650,123650,0,0,0.0,0,0,,available,backorder,False,ke-bam-duoi-truyen-trinh-tham-p215105241.html?spid=215105242,,Times Books;215105242;123650,"Nhà Sách Tiki | Sách tiếng Việt | Sách kinh tế | Sách quản trị, lãnh đạo | Kẻ Bám Đuổi - Truyện trinh thám",
194017067,Combo 2Q Sách Quản Trị - Lãnh Đạo : The Leadership Lab – Bí Quyết Lãnh Đạo Trong Kỷ Nguyên Số + Trải Nghiệm Khách Hàng Xuất Sắc,3300,314,359500,359500,359500,0,0,0.0,0,0,,available,backorder,False,combo-2q-sach-quan-tri-lanh-dao-the-leadership-lab-bi-quyet-lanh-dao-trong-ky-nguyen-so-trai-nghiem-khach-hang-xuat-sac-p194017067.html?spid=194017068,,Phương Đông Books;194017068;359500,"Nhà Sách Tiki | Sách tiếng Việt | Sách kinh tế | Sách quản trị, lãnh đạo | Combo 2Q Sách Quản Trị - Lãnh Đạo : The Leadership Lab – Bí Quyết Lãnh Đạo Trong Kỷ Nguyên Số + Trải Nghiệm Khách Hàng Xuất Sắc",
262050497,Lãnh Đạo Giỏi Phải Biết Tạo Niềm Vui,3300,23,185410,185410,185410,0,0,0.0,0,0,,available,backorder,False,lanh-dao-gioi-phai-biet-tao-niem-vui-p262050497.html?spid=262050498,,Times Books;262050498;185410,"Nhà Sách Tiki | Sách tiếng Việt | Sách kinh tế | Sách quản trị, lãnh đạo | Lãnh Đạo Giỏi Phải Biết Tạo Niềm Vui",
263049720,(Bìa Cứng) KIỂM SOÁT QUẢN TRỊ - Bob Tricker - Nguyễn Thị Thu Hương dịch,3300,6,337000,375000,375000,38000,10,0.0,0,0,,available,backorder,False,bia-cung-kiem-soat-quan-tri-bob-tricker-nguyen-thi-thu-huong-dich-p263049720.html?spid=263049721,Bob Tricker,Nhà Sách Khai Minh;263049721;337000,"Nhà Sách Tiki | Sách tiếng Việt | Sách kinh tế | Sách quản trị, lãnh đạo | (Bìa Cứng) KIỂM SOÁT QUẢN TRỊ - Bob Tricker - Nguyễn Thị Thu Hương dịch",784
246162716,"6 THỰC HÀNH THIẾT YẾU ĐỂ QUẢN TRỊ ĐỘI NGŨ - Scott Jeffrey Miller, Todd Davis, Victoria Roos Olsson - Vũ Đức Trí Thể, Lương Thị Mỹ Hạnh dịch - (bìa mềm)",3300,101,118750,125000,125000,6250,5,0.0,0,0,,available,backorder,False,6-thuc-hanh-thiet-yeu-de-quan-tri-doi-ngu-scott-jeffrey-miller-todd-davis-victoria-roos-olsson-vu-duc-tri-the-luong-thi-my-hanh-dich-bia-mem-p246162716.html?spid=246162717, Todd Davis | Victoria Roos Olsson | Scott Jeffrey Miller,Nhà Sách Khai Minh;246162717;118750,"Nhà Sách Tiki | Sách tiếng Việt | Sách kinh tế | Sách quản trị, lãnh đạo | 6 THỰC HÀNH THIẾT YẾU ĐỂ QUẢN TRỊ ĐỘI NGŨ - Scott Jeffrey Miller, Todd Davis, Victoria Roos Olsson - Vũ Đức Trí Thể, Lương Thị Mỹ Hạnh dịch - (bìa mềm)",244
121603477,WHO? Chuyện kể về danh nhân thế giới - K-pop Twice,3300,650,47000,50000,50000,3000,6,0.0,0,0,4.0,available,backorder,False,who-chuyen-ke-ve-danh-nhan-the-gioi-k-pop-twice-p121603477.html?spid=121603478,,Tủ sách Hoa Hướng Dương;121603478;47000,"Nhà Sách Tiki | Sách tiếng Việt | Sách kinh tế | Sách quản trị, lãnh đạo | WHO? Chuyện kể về danh nhân thế giới - K-pop Twice",
205692559,Phát Triển Kỹ Năng và Nghệ Thuật Lãnh Đạo,3300,216,282000,282000,282000,0,0,0.0,0,0,,available,backorder,False,phat-trien-ky-nang-va-nghe-thuat-lanh-dao-p205692559.html?spid=205692560,,Luatvietbook;205692560;282000 | Nhà Sách Lao Động;224161932;282000,"Nhà Sách Tiki | Sách tiếng Việt | Sách kinh tế | Sách quản trị, lãnh đạo | Phát Triển Kỹ Năng và Nghệ Thuật Lãnh Đạo",519
205471921,Nghệ Thuật Lãnh Đạo Tận Tâm _AZ,3300,220,101000,119000,119000,18000,15,0.0,0,0,1.0,available,backorder,False,nghe-thuat-lanh-dao-tan-tam-_az-p205471921.html?spid=205471922,,NewShop Official;205471922;101000 | Nhà Sách Vĩnh Thụy;205507389;105000 | info book;214807503;119000,"Nhà Sách Tiki | Sách tiếng Việt | Sách kinh tế | Sách quản trị, lãnh đạo | Nghệ Thuật Lãnh Đạo Tận Tâm _AZ",250
140368208,Thuật đọc tâm lý Sếp,3300,581,83850,129000,129000,45150,35,0.0,0,0,5.0,available,backorder,False,thuat-doc-tam-ly-sep-p140368208.html?spid=140368209,Hironori Furukawa,1980 BOOKS HCM;140368209;83850 | Minhhabooks;148077862;103000 | Nhà Sách Vĩnh Thụy;195773647;114000 | info book;208284130;129000 | Nhà sách PLV;212257627;129000 | Trao Tri thức Gặt Niềm tin;212465969;106640,"Nhà Sách Tiki | Sách tiếng Việt | Sách kinh tế | Sách quản trị, lãnh đạo | Thuật đọc tâm lý Sếp",
42427195,Combo Sách : Nhà Lãnh Đạo Giỏi Giải Quyết Vấn Đề Như Thế Nào? +  Những Thách Thức Của Nhà Lãnh Đạo + Lãnh Đạo Giỏi Phải Biết Tạo Niềm Vui  ,3300,1250,549000,624000,624000,75000,12,0.0,0,0,,available,backorder,False,combo-sach-nha-lanh-dao-gioi-giai-quyet-van-de-nhu-the-nao-nhung-thach-thuc-cua-nha-lanh-dao-lanh-dao-gioi-phai-biet-tao-niem-vui-p42427195.html?spid=248277244,Nhiều Tác Giả,HỆ THỐNG NHÀ SÁCH ABC;248277244;549000 | Phương Đông Books;54569994;488006 | Times Books;55658400;475980 | AHABOOKS;57608094;497156 | VBooks;161462667;476280 | Nhà Sách Trẻ Online;260814670;445913 | Tiệm Sách Hoa Hồng;260814671;446513,"Nhà Sách Tiki | Sách tiếng Việt | Sách kinh tế | Sách quản trị, lãnh đạo | Combo Sách : Nhà Lãnh Đạo Giỏi Giải Quyết Vấn Đề Như Thế Nào? +  Những Thách Thức Của Nhà Lãnh Đạo + Lãnh Đạo Giỏi Phải Biết Tạo Niềm Vui  ",
194020052,Combo 2Q Sách Quản Trị - Lãnh Đạo : The Leadership Lab – Bí Quyết Lãnh Đạo Trong Kỷ Nguyên Số + Nhà Lãnh Đạo Tương Lai,3300,314,351000,399000,399000,48000,12,0.0,0,0,,available,backorder,False,combo-2q-sach-quan-tri-lanh-dao-the-leadership-lab-bi-quyet-lanh-dao-trong-ky-nguyen-so-nha-lanh-dao-tuong-lai-p194020052.html?spid=209600023,,Nhà Sách Vĩnh Thụy;209600023;351000 | Phương Đông Books;194020053;359500 | HỆ THỐNG NHÀ SÁCH ABC;247374620;351000,"Nhà Sách Tiki | Sách tiếng Việt | Sách kinh tế | Sách quản trị, lãnh đạo | Combo 2Q Sách Quản Trị - Lãnh Đạo : The Leadership Lab – Bí Quyết Lãnh Đạo Trong Kỷ Nguyên Số + Nhà Lãnh Đạo Tương Lai",
66667576,Combo Sách Cho Nhà Lãnh Đạo: 21 Phẩm Chất Vàng Của Nhà Lãnh Đạo + Những Thách Thức Của Nhà Lãnh Đạo,3300,1013,280000,318000,318000,38000,12,0.0,0,0,,available,backorder,False,combo-sach-cho-nha-lanh-dao-21-pham-chat-vang-cua-nha-lanh-dao-nhung-thach-thuc-cua-nha-lanh-dao-p66667576.html?spid=248165116,,HỆ THỐNG NHÀ SÁCH ABC;248165116;280000 | Times Books;71972005;240108 | VBooks;161462664;240408 | Nhà Sách Trẻ Online;261965022;239808 | Tiệm Sách Hoa Hồng;261965023;240408,"Nhà Sách Tiki | Sách tiếng Việt | Sách kinh tế | Sách quản trị, lãnh đạo | Combo Sách Cho Nhà Lãnh Đạo: 21 Phẩm Chất Vàng Của Nhà Lãnh Đạo + Những Thách Thức Của Nhà Lãnh Đạo",
250059305,Phát Triển Kỹ Năng Và Nghệ Thuật Lãnh Đạo,3300,74,246000,246000,246000,0,0,0.0,0,0,,available,backorder,False,phat-trien-ky-nang-va-nghe-thuat-lanh-dao-p250059305.html?spid=250059306,,FAHABI STORE;250059306;246000,"Nhà Sách Tiki | Sách tiếng Việt | Sách kinh tế | Sách quản trị, lãnh đạo | Phát Triển Kỹ Năng Và Nghệ Thuật Lãnh Đạo",520
215561343,Trải Nghiệm Khách Hàng Xuất Sắc - Thực thi chiến lược trải nghiệm khách hàng và văn hóa lấy khách hàng làm trung tâm,3300,153,204700,204700,204700,0,0,0.0,0,0,,available,backorder,False,trai-nghiem-khach-hang-xuat-sac-thuc-thi-chien-luoc-trai-nghiem-khach-hang-va-van-hoa-lay-khach-hang-lam-trung-tam-p215561343.html?spid=215561344,,Times Books;215561344;204700,"Nhà Sách Tiki | Sách tiếng Việt | Sách kinh tế | Sách quản trị, lãnh đạo | Trải Nghiệm Khách Hàng Xuất Sắc - Thực thi chiến lược trải nghiệm khách hàng và văn hóa lấy khách hàng làm trung tâm",
248727587,Cuốn sách: Lời Hứa,3300,88,92830,92830,92830,0,0,0.0,0,0,,available,backorder,False,cuon-sach-loi-hua-p248727587.html?spid=248727588,,Times Books;248727588;92830 | Tiệm sách Minh Hằng;252533190;110000,"Nhà Sách Tiki | Sách tiếng Việt | Sách kinh tế | Sách quản trị, lãnh đạo | Cuốn sách: Lời Hứa",
261801747,Các Chỉ Số Cốt Yếu Trong Quản Lý,3300,27,143200,143200,143200,0,0,0.0,0,0,,available,backorder,False,cac-chi-so-cot-yeu-trong-quan-ly-p261801747.html?spid=261801748,,Times Books;261801748;143200,"Nhà Sách Tiki | Sách tiếng Việt | Sách kinh tế | Sách quản trị, lãnh đạo | Các Chỉ Số Cốt Yếu Trong Quản Lý",
37134939,Tinh Hoa Lãnh Đạo (Tái Bản) ( Tặng Kèm Bookmark Tuyệt Đẹp ),3300,1335,122000,139000,139000,17000,12,0.0,0,0,,available,backorder,False,tinh-hoa-lanh-dao-tai-ban-tang-kem-bookmark-tuyet-dep-p37134939.html?spid=73500149,John C. Maxwell,Nhà Sách Vĩnh Thụy;73500149;122000 | VBooks;37134940;110664 | Times Books;56270761;110364 | info book;76167945;122000,"Nhà Sách Tiki | Sách tiếng Việt | Sách kinh tế | Sách quản trị, lãnh đạo | Tinh Hoa Lãnh Đạo (Tái Bản) ( Tặng Kèm Bookmark Tuyệt Đẹp )",364
200681800,Combo 21 Nguyên Tắc Vàng Của Nghệ Thuật Lãnh Đạo và 17 Nguyên Tắc Vàng Trong Làm Việc Nhóm,3300,251,227000,258000,258000,31000,12,0.0,0,0,,available,backorder,False,combo-21-nguyen-tac-vang-cua-nghe-thuat-lanh-dao-va-17-nguyen-tac-vang-trong-lam-viec-nhom-p200681800.html?spid=247972233,,HỆ THỐNG NHÀ SÁCH ABC;247972233;227000 | Trạm đọc;200681801;215600,"Nhà Sách Tiki | Sách tiếng Việt | Sách kinh tế | Sách quản trị, lãnh đạo | Combo 21 Nguyên Tắc Vàng Của Nghệ Thuật Lãnh Đạo và 17 Nguyên Tắc Vàng Trong Làm Việc Nhóm",
394520,90 Ngày Đầu Tiên Làm Sếp (Tái Bản 2014),3300,2305,175000,199000,199000,24000,12,0.0,0,0,,available,backorder,False,90-ngay-dau-tien-lam-sep-tai-ban-2014-p394520.html?spid=248197164,Michael Watkins,HỆ THỐNG NHÀ SÁCH ABC;248197164;175000,"Nhà Sách Tiki | Sách tiếng Việt | Sách kinh tế | Sách quản trị, lãnh đạo | 90 Ngày Đầu Tiên Làm Sếp (Tái Bản 2014)",331
39047610,"Combo Tuyệt Chiêu Lãnh Đạo, Quản Lý Hiệu Qủa: Nhà Lãnh Đạo 360°+ Kỹ Năng Lãnh Đạo Hiệu Quả + Khởi Nghiệp Thành Công Từ Nhà Đầu Tư Mạo Hiểm (Bộ 3 Cuốn Kỹ Năng Lãnh Đạo Hay Nhất 2019 / Tặng Kèm Bookmark Happy Life)",3300,1319,398500,398500,398500,0,0,0.0,0,0,1.0,available,backorder,False,combo-tuyet-chieu-lanh-dao-quan-ly-hieu-qua-nha-lanh-dao-360-ky-nang-lanh-dao-hieu-qua-khoi-nghiep-thanh-cong-tu-nha-dau-tu-mao-hiem-bo-3-cuon-ky-nang-lanh-dao-hay-nhat-2019-tang-kem-bookmark-happy-life-p39047610.html?spid=39047611, Martin Lanik | Tim Draper |  John C. Maxwell,Phương Đông Books;39047611;398500,"Nhà Sách Tiki | Sách tiếng Việt | Sách kinh tế | Sách quản trị, lãnh đạo | Combo Tuyệt Chiêu Lãnh Đạo, Quản Lý Hiệu Qủa: Nhà Lãnh Đạo 360°+ Kỹ Năng Lãnh Đạo Hiệu Quả + Khởi Nghiệp Thành Công Từ Nhà Đầu Tư Mạo Hiểm (Bộ 3 Cuốn Kỹ Năng Lãnh Đạo Hay Nhất 2019 / Tặng Kèm Bookmark Happy Life)",
262812842,Thương Lượng Không Nhân Nhượng,3300,12,77200,77200,77200,0,0,0.0,0,0,,available,backorder,False,thuong-luong-khong-nhan-nhuong-p262812842.html?spid=262812843,,Times Books;262812843;77200,"Nhà Sách Tiki | Sách tiếng Việt | Sách kinh tế | Sách quản trị, lãnh đạo | Thương Lượng Không Nhân Nhượng",
155833262,Sách - Anh: The Manager,3300,528,415000,415000,415000,0,0,0.0,0,0,,available,backorder,False,sach-anh-the-manager-p155833262.html?spid=155833263,Mike Carson,Blue Horizon Books;155833263;415000,"Nhà Sách Tiki | Sách tiếng Việt | Sách kinh tế | Sách quản trị, lãnh đạo | Sách - Anh: The Manager",320
37170239,Combo 2 Cuốn Sách Kinh Tế Tâm Đắc Nhất : Quản lý – Khởi Nguồn Của Thành Công + Tương Lai Của Quyền Lực (Tặng kèm Bookmark Happy Life / Những Lời Khuyên Hữu Ích Cho Những Nhà Quản Lý Thành Công ) ,3300,1338,169400,220000,220000,50600,23,0.0,0,0,,available,backorder,False,combo-2-cuon-sach-kinh-te-tam-dac-nhat-quan-ly-khoi-nguon-cua-thanh-cong-tuong-lai-cua-quyen-luc-tang-kem-bookmark-happy-life-nhung-loi-khuyen-huu-ich-cho-nhung-nha-quan-ly-thanh-cong-p37170239.html?spid=37972803,Nhiều Tác Giả,GOLD BOOKS;37972803;169400,"Nhà Sách Tiki | Sách tiếng Việt | Sách kinh tế | Sách quản trị, lãnh đạo | Combo 2 Cuốn Sách Kinh Tế Tâm Đắc Nhất : Quản lý – Khởi Nguồn Của Thành Công + Tương Lai Của Quyền Lực (Tặng kèm Bookmark Happy Life / Những Lời Khuyên Hữu Ích Cho Những Nhà Quản Lý Thành Công ) ",
216285804,SÁCH: Nhà lãnh đạo tương lai: 140 CEO và 14.000 nhân viên toàn cầu nói gì về lãnh đạo? - Tác giả Jacob Morgan,3300,133,212500,250000,250000,37500,15,0.0,0,0,,available,backorder,False,sach-nha-lanh-dao-tuong-lai-140-ceo-va-14-000-nhan-vien-toan-cau-noi-gi-ve-lanh-dao-tac-gia-jacob-morgan-p216285804.html?spid=263056578,,Bamboo Books;263056578;212500 | Nhà Sách Dalifa;216285806;225000,"Nhà Sách Tiki | Sách tiếng Việt | Sách kinh tế | Sách quản trị, lãnh đạo | SÁCH: Nhà lãnh đạo tương lai: 140 CEO và 14.000 nhân viên toàn cầu nói gì về lãnh đạo? - Tác giả Jacob Morgan",
215544694,Bùng Nổ Bộ Não Với Siêu Phương Pháp Huấn Luyện Silva (Cuốn sách được Psychology today lựa chọn),3300,153,95000,95000,95000,0,0,0.0,0,0,,available,backorder,False,bung-no-bo-nao-voi-sieu-phuong-phap-huan-luyen-silva-cuon-sach-duoc-psychology-today-lua-chon-p215544694.html?spid=215544695,,Times Books;215544695;95000 | VBooks;230343850;95300,"Nhà Sách Tiki | Sách tiếng Việt | Sách kinh tế | Sách quản trị, lãnh đạo | Bùng Nổ Bộ Não Với Siêu Phương Pháp Huấn Luyện Silva (Cuốn sách được Psychology today lựa chọn)",
261962060,Lãnh Đạo Giỏi Hỏi Câu Hỏi Hay,3300,25,132000,189000,189000,57000,30,0.0,0,0,,available,backorder,False,lanh-dao-gioi-hoi-cau-hoi-hay-p261962060.html?spid=262890369,,Sống Official;262890369;132000,"Nhà Sách Tiki | Sách tiếng Việt | Sách kinh tế | Sách quản trị, lãnh đạo | Lãnh Đạo Giỏi Hỏi Câu Hỏi Hay",
205810520,Đạo Kinh Doanh,3300,216,178200,178200,178200,0,0,0.0,0,0,,available,backorder,False,dao-kinh-doanh-p205810520.html?spid=205810521,Nguyễn Anh Dũng,Nhà Sách Phương Nam;205810521;178200,"Nhà Sách Tiki | Sách tiếng Việt | Sách kinh tế | Sách quản trị, lãnh đạo | Đạo Kinh Doanh",302
194018174,Combo 2Q Sách Quản Trị - Lãnh Đạo : The Leadership Lab – Bí Quyết Lãnh Đạo Trong Kỷ Nguyên Số + How Management Works - Hiểu Hết Về Quản Lý,3300,313,422000,479000,479000,57000,12,0.0,0,0,,available,backorder,False,combo-2q-sach-quan-tri-lanh-dao-the-leadership-lab-bi-quyet-lanh-dao-trong-ky-nguyen-so-how-management-works-hieu-het-ve-quan-ly-p194018174.html?spid=209600021,,Nhà Sách Vĩnh Thụy;209600021;422000 | Phương Đông Books;194018175;429500 | VBooks;195844889;456960,"Nhà Sách Tiki | Sách tiếng Việt | Sách kinh tế | Sách quản trị, lãnh đạo | Combo 2Q Sách Quản Trị - Lãnh Đạo : The Leadership Lab – Bí Quyết Lãnh Đạo Trong Kỷ Nguyên Số + How Management Works - Hiểu Hết Về Quản Lý",
175413270,Combo Những Đỉnh Cao Chỉ Huy + Xây Dựng Để Trường Tồn,3300,428,516000,586000,586000,70000,12,0.0,0,0,,available,backorder,False,combo-nhung-dinh-cao-chi-huy-xay-dung-de-truong-ton-p175413270.html?spid=199650208,,HỆ THỐNG NHÀ SÁCH ABC;199650208;516000,"Nhà Sách Tiki | Sách tiếng Việt | Sách kinh tế | Sách quản trị, lãnh đạo | Combo Những Đỉnh Cao Chỉ Huy + Xây Dựng Để Trường Tồn",
35974624,Combo Sách Kỹ Năng Lãnh Đạo Của Phụ Nữ : Cách Phụ Nữ Lãnh Đạo +  Phụ Nữ Lãnh Đạo Bằng Yêu Thương ( Tặng kèm bookmark Green Life),3300,1349,231500,231500,231500,0,0,0.0,0,0,8.0,available,instock,False,combo-sach-ky-nang-lanh-dao-cua-phu-nu-cach-phu-nu-lanh-dao-phu-nu-lanh-dao-bang-yeu-thuong-tang-kem-bookmark-green-life-p35974624.html?spid=35974625,"David Devin | Joanna Barsh, Susie Cranston & Geoffrey Lewis",AHABOOKS;35974625;231500,"Nhà Sách Tiki | Sách tiếng Việt | Sách kinh tế | Sách quản trị, lãnh đạo | Combo Sách Kỹ Năng Lãnh Đạo Của Phụ Nữ : Cách Phụ Nữ Lãnh Đạo +  Phụ Nữ Lãnh Đạo Bằng Yêu Thương ( Tặng kèm bookmark Green Life)",
